question,context,ground_truth_answer,generated_answer,context_precision,context_recall,context_entities_recall,noise_sensitivity,response_relevancy,faithfulness
"Based on the article Designing Secure Blockchain-Based Authentication and Key Management Mechanism for Internet of Drones Applications, explain the Blockchain Implementation Phase","Table 1: Subjects of the papers.
Subject Paper Reference
BC
BC-RAN: Cloud radio access network enabled by blockchain for 5G [73]
Blockchain-enabled wireless communications: a new paradigm towards 6G [74]
Distributed Network Slicing Management Using Blockchains in E-Health Environments [75]
Design of a Security and Trust Framework for 5G Multi-domain Scenarios [76]
Data Broker: Dynamic Multi-Hop Routing Protocol in Blockchain Radio Access Network [77]
Future Industry Internet of Things with Zero-trust Security [78]
Blockchain Based Privacy Preserving Framework for Emerging 6G Wireless Communications [79]
Blockchain-based fog radio access networks: Architecture, key technologies, and challenges [80]
Evaluation of soft computing in intrusion detection for secure social Internet of Things based on collaborative edge
computing [81]
Resource Sharing and Trading of Blockchain Radio Access Networks: Architecture and Prototype Design [82]
Radio optical network security analysis with routing in quantum computing for 5G wireless communication using
blockchain machine learning model [83]
Hedera: A Permissionless and Scalable Hybrid Blockchain Consensus Algorithm in Multi-Access Edge Computing for IoT [84]
FH
Securing Ethernet-based optical fronthaul for 5G network [85]
Secure Open Fronthaul Interface for 5G Networks [86]
Transport Security Considerations for the Open-RAN Fronthaul [87]
Open-RAN Fronthaul Transport Security Architecture and Implementation [35]
IDS/IPS
Detecting DoS and DDoS Attacks by Using CuSum Algorithm in 5G Networks [88]
Attacks and failures prediction framework for a collaborative 5G mobile network [89]
The Novel System of Attacks Detection in 5G [90]
An edge based hybrid intrusion detection framework for mobile edge computing [91]
A highly secured IDS for IoT using EXPSO-STF A feature selection for LAANN to detect attacks [92]
RRC
Authentication Protocol for an IoT-Enabled LTE Network [93]
On the Impact of Rogue Base Stations in 4G/LTE Self Organizing Net

---

chine Learning
CPU Central Processing Unit MT Mobile Terminal
CSO Chicken Swarm Optimization mURLLC Massive Ultra-Reliable and Low-Latency Communications
dApps Decentralized Applications NIB Network-In-Box
DAD Deep Anomaly Detection PoAh Proof of Authentication
DoS Denial of Service PoC Proof of Collaboration
DDoS Distributed Denial of Services PoK Proof of Knowledge
DL Deep Learning PoS Proof of Stack
DRL Deep Reinforcement Learning PoW Proof of Work
DT Digital Twin P2P Peer-to-Peer
DTWN Digital Twin Wireless Networks PBFT Practical Byzantine Fault-Tolerant
DWSN Dynamic Wireless Sensor Networks RIS Reconfigurable Intelligent Surfaces
FDL Federated Transfer learning RNN Recurrence Neural Network
FL Federated Learning SDA Secure Data Analytics
Geth Go-Ethereum SMPC Secure Multi-Party Computation
GNN Gated Neural Network SQL Structured Query Language
GPU Graphical Processing Unit SYN Synchronize
GRU Gated Recurrent Unit UDP User Datagram Protocol
GUI Graphical User Interface VAE Variational Autoencoder
ICMP Internet Control Message Protocol 6G Sixth Generation
excluded the papers that retained low-quality content. In the next stage,
we filter the papers after reading their abstracts and key contributions.
Lastly, we extract the papers for our survey on technology enablers
(i.e., blockchain, FL, and 6G) for secure big data services.
3. Background and literature review
In this section, we present the technological backgrounds of the
stack of technology enablers and a literature review of related survey
articles. Table 2 shows the summarized list of acronyms used in the
article.
3.1. Background
The definition and fundamental concepts of the technologies such
as the Internet of Things (IoT) and IIoT, big data, blockchain, FL, and
6G used in this survey are presented in this section.
3.1.1. IoT and IIoT
The IoT shifts the communication paradigm, enabling billions of
heterogeneous devices to connect seamlessly and provide real-time
information. The IoT is the fastest-growin

---

iting – review & editing, Supervision, Funding acqui-
sition. Xiaolong Liu: Writing – review & editing, Supervision, Investi-
gation, Funding acquisition.
Declaration of competing interest
The authors declare that they have no known competing finan-
cial interests or personal relationships that could have appeared to
influence the work reported in this paper.
Acknowledgments
This work was supported in part by fund of scientific and techno-
logical innovation of Fujian agriculture and Forestry University (Grant
No. KFb22091XA), Project of Industry-university-institute Cooperation
in Colleges and Universities in Fujian Province (Grant No. 2022H6006,
2024H6007) and the Project of Software Technology Innovation Re-
search and Industrialization in Fujian Province (Grant No. 2024.488).
Data availability
Data will be made available on request.
References
[1] Number of Internet of Things (IoT) connected devices worldwide from 2019
to 2021, with forecasts from 2022 to 2030, 2018, https://www.statista.com/
statistics/1183457/iot-connected-devices-worldwide/ .
[2] Xu Yang, Xuechao Yang, Xun Yi, Ibrahim Khalil, Xiaotong Zhou, Debiao He, Xinyi
Huang, Surya Nepal, Blockchain-based secure and lightweight authentication for
Internet of Things, IEEE Internet Things J. 9 (5) (2021) 3321–3332.
[3] Soumyashree S. Panda, Debasish Jena, Bhabendu Kumar Mohanta, Somula
Ramasubbareddy, Mahmoud Daneshmand, Amir H. Gandomi, Authentication and
key management in distributed iot using blockchain technology, IEEE Internet
Things J. 8 (16) (2021) 12947–12954.
[4] Zesen Hou, Jianting Ning, Xinyi Huang, Shengmin Xu, Leo Yu Zhang, Blockchain-
based efficient verifiable outsourced attribute-based encryption in cloud, Comput.
Stand. Interfaces (2024) 103854.
[5] Ya-Nan Cao, Yujue Wang, Yong Ding, Zhenwei Guo, Qianhong Wu, Hai Liang,
Blockchain-empowered security and privacy protection technologies for smart
grid, Comput. Stand. Interfaces 85 (2023) 103708.
[6] Noureddine Chikouche, Pierre-Louis Cayrel,

---

determine the security threats per layer. The 
article also analyzes the feasibility of the attacks and discusses the cor -
responding defense mechanisms. Finally, it summarizes the security of 
sensor-enabled IoT devices. Abdulla et al. [ 148 ] introduce a solution to 
ARP spoofing for IoT. Based on the analysis of the operation mechanism 
of the Neighbor Discovery Protocol, it is pointed out that the default 
premise of the link trust is the root cause of the security defect of ND 
(Neighbor Discovery). It analyzes the use of ND security flaws to perform 
MitM attacks on the IoT nodes and explains the safety protection of ND. 
The test results show that the proposed method is feasible and effective, 
which greatly reduces the impact of the attack. Navas et al. [ 149 ] 
introduce ARP spoofing and DNS Spoofing. SSL protocol is the most 
widely used secure transmission protocol on the Internet and is used to 
protect sensitive data of users in large-scale network transactions such as 
Internet banking and e-commerce. There have been two MITMs in SSL 
applications. Based on the introduction of the principle of SSL protocol, 
this article analyzes in detail the implementation principles and condi -
tions of the two MITM attack methods that threaten the security of SSL 
applications and proposes two effective measures to prevent such at -
tacks. Low-power IoT devices have the features of low power con -
sumption, no need for charging for a long time, which also means that 
similar security problems are more likely to pose a threat. Its embedded 
system is lightweight and simpler, and encryption algorithms are 
simpler. For attackers, it is easier to eavesdrop and grasp the complete 
information of the system. Capella et al. [ 150 ] introduce concealment 
and internet traffic. A model based on a WSN network is proposed. 
A. Razaque et al.","During this step, we present the specifics of the blockchain. It is a
significant phase of the proposed mechanism. Note that ‘‘Elliptic Curve
Cryptography (ECC)’’ encryption is used to encrypt a transaction in a
block with the help of the public key 𝐾 𝑈𝐸 𝑆𝑗
of the respective ground
station server (𝐸 𝑆𝑗 ) so that only 𝐸 𝑆𝑗 can decrypt the data using its
own private key. In this case, since block verification involves the verification
of signature present in a block using the ‘‘Elliptic Curve Digital
Signature Algorithm (ECDSA)’’ for signature verification, we have applied
the public-key based ECC encryption for protection of transactions
(containing the crucial data in case of sensitive applications such as
healthcare and military).
The particulars are delineated using the following steps:
• BIP1: As discussed earlier, the ground station server 𝐸 𝑆𝑗 receives
information 𝐼 𝑛𝑓𝐷 𝐸𝑖
from a connected drone 𝐷 𝐸𝑖 through the
established session key 𝑆 𝐾𝐷 𝐸𝑖,𝐸 𝑆𝑗
in a secure way. Then 𝐸 𝑆𝑗
creates a partial block 𝑃 𝐵 𝐾𝐸 𝑆𝑗
from the received information
𝐼 𝑛𝑓𝐷 𝐸𝑖
. First, 𝐸 𝑆𝑗 creates its public and private key pairs as
{𝐾 𝑈𝐸 𝑆𝑗
, 𝐾 𝑆𝐸 𝑆𝑗
} through some public key cryptographic systems,
i.e., Elliptic Curve Cryptography (ECC) algorithm. It then
divides 𝐼 𝑛𝑓𝐷 𝐸𝑖
into some transactions say 𝑡𝑟𝑥 = {𝑡𝑟1, 𝑡𝑟2,…, 𝑡𝑟𝑥}.
Further, 𝐸 𝑆𝑗 encrypts 𝑡𝑟𝑥 with its public key 𝐾 𝑈𝐸 𝑆𝑗
to convert
them into encrypted transactions, say 𝑇 𝑅𝑥 = 𝐸𝐾 𝑈𝐸 𝑆𝑗
(𝑡𝑟𝑥). The
partial block contains fields as follows 𝑃 𝐵 𝐾𝐸 𝑆𝑗 = {𝑂 𝑊 𝐼𝐸 𝑆𝑗
,
𝐾 𝑈𝐸 𝑆𝑗
, 𝑇 𝑅𝑥, 𝑀 𝑇𝑟𝑜𝑜𝑡𝐸 𝑆𝑗
}, where 𝑂 𝑊 𝐼𝐸 𝑆𝑗
is owner 𝐸 𝑆𝑗 ’s identity
information and 𝑀 𝑇𝑟𝑜𝑜𝑡𝐸 𝑆𝑗
is the Merkle tree root value, which
is generated from all transactions. 𝐸 𝑆𝑗 then sends partial block
𝑃 𝐵 𝐾𝐸 𝑆𝑗
to connected cloud server 𝐶 𝑆𝑙 with the help of the
established session key 𝑆 𝐾𝐸 𝑆𝑗 ,𝐶 𝑆𝑘
in a secure way.
• BIP2: After receiving 𝑃 𝐵 𝐾𝐸 𝑆𝑗
, 𝐶 𝑆𝑙 makes full block 𝐹 𝐵 𝐾𝐶 𝑆𝑙 from it. 𝐹 𝐵 𝐾𝐶 𝑆𝑙
contains fields as 𝐹 𝐵 𝐾𝐶 𝑆𝑙 = {𝐵 𝐼 𝐷𝐹 𝐵 𝐾𝐶 𝑆𝑙
,
𝑅𝑁𝐹 𝐵 𝐾𝐶 𝑆𝑙
, 𝑇 𝑆 𝑉𝐹 𝐵 𝐾𝐶 𝑆𝑙
, 𝐻 𝑎𝑠ℎ𝐹 𝐵 𝐾𝐶 𝑆𝑙
, 𝐻 𝑎𝑠ℎ𝐹 𝐵 𝐾𝐶 𝑆𝑙−1
, 𝑂 𝑊 𝐼𝐸 𝑆𝑗
,
𝐾 𝑈𝐸 𝑆𝑗
, 𝑇 𝑅𝑥, 𝑀 𝑇𝑟𝑜𝑜𝑡𝐸 𝑆𝑗
, 𝑆 𝑖𝑔 𝑛𝐹 𝐵 𝐾𝐶 𝑆𝑙
}, where 𝐵 𝐼 𝐷𝐹 𝐵 𝐾𝐶 𝑆𝑙
,
𝑅𝑁𝐹 𝐵 𝐾𝐶 𝑆𝑙
, 𝑇 𝑆 𝑉𝐹 𝐵 𝐾𝐶 𝑆𝑙
, 𝐻 𝑎𝑠ℎ𝐹 𝐵 𝐾𝐶 𝑆𝑙
, 𝐻 𝑎𝑠ℎ𝐹 𝐵 𝐾𝐶 𝑆𝑙−1
, and
𝑆 𝑖𝑔 𝑛𝐹 𝐵 𝐾𝐶 𝑆𝑙
are the block’s (𝐹 𝐵 𝐾𝐶 𝑆𝑙
) identity information, a
random nonce value, the timestamp, the hash of the current
block, the hash of the preceding block, and the block’s signature
𝐹 𝐵 𝐾𝐶 𝑆𝑙
.
• BIP3: Upon the completion of this process, 𝐶 𝑆𝑙 will disseminate
𝐹 𝐵 𝐾𝐶 𝑆𝑙
via its peer-to-peer cloud server network. At this juncture,
the appointed leader, referred to as 𝐶 𝑆′′
𝑙
, will initiate a
consensus over the just received block. To achieve this purpose,
the server (𝐶 𝑆′′
𝑙
) may employ the procedures of the standard
‘‘practical Byzantine Fault Tolerance (pBFT) method [21]’’. The
block 𝐹 𝐵 𝐾𝐶 𝑆𝑙
is incorporated into the blockchain 𝐵 𝐶 𝐻𝐼 𝑜𝐷𝑖
at
the successful completion of the consensus process. The formed
blockchain 𝐵 𝐶 𝐻𝐼 𝑜𝐷𝑖
can be considered like a ‘‘consortium
blockchain’’. As it contains some private data, however, at the
same time some of the data should be available publicly as per
the raised requirements.
For the better understanding of the readers, the proposed BAKMMIoD
is also explained through a process flow diagram, which is depicted
in Fig. 2. It provides the details of various activities and processes
of the proposed scheme. The activities like registration of drone, registration
of ground station server, and registration of cloud server
are highlighted. After that, there is the execution of authentication
and key establishment between the drone and ground station server.
Further, there is the execution of key management between the ground
station server and cloud server. After that, there is the execution of the
blockchain formation phase.
Remark 1. Here, we provide the importance of using the blockchain
technology instead of using a strong public-key encryption algorithm,
like RSA-2048 or others, for storing the encrypted data in a semi-trusted
cloud environment. In fact, Mitra et al. [38] interestingly investigated
the ‘‘impact on blockchain-based artificial intelligence (AI)/machine
learning (ML)-enabled big data analytics for cognitive IoT environment’’.
They argued that data poisoning attacks are a serious concern
when the data is simply stored in semi-trusted cloud storage in place
of the blockchain, because they can significantly impact businesses
and organizations, both financially and in terms of their reputation,
particularly when the big data analytics rely on corrupted data. Their
comprehensive experimental results illustrate the impact of data poisoning
attacks on an ML model when data is stored in cloud storage
(i.e., outside of blockchain) versus in a blockchain (i.e., without data
poisoning). The findings reveal substantial performance improvements
in accuracy, recall, precision, and F1-score when the data remain free
from poisoning attacks. This is true because the data residing into the
blockchain cannot be tampered when the transactions are added into
the blockchain through the consensus mechanism. Hence, though the
blockchain implementation becomes little more costly as compared to
simply putting encrypted data in semi-trusted cloud storage, we certainly
have various advantages not only for strengthening the security
of the system, but also for improving substantial performance in terms
of accuracy, recall, precision, and F1-score in big data analytics.
Remark 2. The identity is the original identity information of an entity
(i.e., drone, ground station server and cloud server), whereas to make
the communication anonymous we have used pseudo identity, due to
this mechanism the original identity of an entity is not revealed to the
other entities of the network. The temporary identity is used to make
the communication anonymous as well as untraceable. The temporary
identity information is changed in each session, because in each session
we have the provision of use of a new temporary identity. It helps us
to achieve the untraceability property for the exchanged data in every
session of the communications.",,,,,,,
"What is the conclusion of the document 6G Internet-of-Things Assisted Smart Homes and Buildings: Enabling Technologies, Opportunities and Challenges?","yers: Perception Layer,
Network layer and Application Layer (Chaabouni et al., 2019). The
perception layer is a hardware layer comprising of sensors and ac-
tuators, these include IoT devices ranging from CCTV cameras for a
smart home system, to healthcare smart watches and autonomous cars.
These devices are responsible for collecting vital environmental data.
Data may be sent between devices via communication protocols such
as Bluetooth, RFID, etc. The objective is to send collected data to the
cloud for further analysis. Actuators may receive commands from the
cloud or from a device like a smartphone that could turn on/off the
smart bulb in a smart home system. This leads to the second layer
of the architecture, the Network layer. This layer is responsible for
the transmission of collected data and commands between sensors and
actuators, here protocols such as WiFi, 3G, GSM etc are utilised for data
transmission.
The final layer of IoT architecture is the Application layer, which is
where the business logic and user interface are implemented. Through
this layer users may interact with the IoT system, for example in
a smart home setting users might send commands to turn the air
conditioner on/off. This fundamental three-layer IoT architecture is not
the only architecture that exists, in fact, it can be utilised to form other
architectural flavours with more layers (Lu and Xu, 2019).
3.4. IoT challenges and limitations
As the deployment of IoT technologies grows across multiple in-
dustries, so does the opportunity of cyber attacks. These threats arise
from a number of factors: IoT has limitations that make it difficult to
secure with state-of-the-art security solutions. The Internet of Things
(IoT) devices are inherently limited by processing power and storage
constraints (Belguith et al., 2020; Saleem et al., 2018). These limi-
tations can impact the performance and functionality of the devices.
Moreover, the lack of sufficient configuration of IoT devices can cre

---

Journal Pre-proof
Coldnet: V accine Logistics Tracking by Integrating the Internet of Things and Smart Contracts: An
Immutable and Reliable Approach
Jonas L. Vilas Boas, Ygor S. Costa, Rodrigo da R. Righi, Antonio M. Alberti and Joel J.P .C. Rodrigues
PII: S2096-7209(25)00113-7
DOI: https://doi.org/10.1016/j.bcra.2025.100386
Reference: BCRA 100386
To appear in: Blockchain: Research and Applications
Received date: 19 March 2025
Revised date: 2 June 2025
Accepted date: 3 July 2025
Please cite this article as: J.L. Vilas Boas, Y .S. Costa, R.d.R. Righi et al., Coldnet: V accine Logistics Tracking by Integrating the Internet of Thin gs and Smart
Contracts: An Immutable and Reliable Approach, Blockchain: Research and Applications, 100386, doi: https://doi.org/10.1016/j.bcra.2025.100386.
This is a PDF ﬁle of an article that has undergone enhancements after acceptance, such as the addition of a cover page and metadata, and formatting for
readability, but it is not yet the deﬁnitive version of record. This version will undergo additional copyediting, typesetting and review before it is published in its
ﬁnal form, but we are providing this version to give early visibility of the article. Please note that, during the production process, errors may be dis covered which
could affect the content, and all legal disclaimers that apply to the journal pertain.
© 2025 Published by Elsevier.

---

M. Kokila and S. Reddy K Cyber Security and Applications 3 (2025) 100057
Table 1 
Comparative analysis of related works. 
Ref. Survey Objective 
Hameed et al. [23] Comprehending the security needs and confronting challenges 
within the IoT 
Security vulnerabilities are categorized, emphasizing challenges, current 
solutions, and areas of ongoing research. 
Wang et al. [24] Exploration of Blockchain Applications in the IoT Advancements in Blockchain Data Structure and Consensus Protocols: 
Review of Relevant Research Works. 
Sengupta et al. [8] An In-Depth Analysis of Threats, Privacy Concerns, and 
Blockchain-Based Solutions for IoT and Industrial IoT 
Classiﬁcation of Attacks on IoT and Countermeasures; In-Depth 
Examination of Blockchain-Based Solutions for IoT and IIoT Applications. 
Neshenko et al. [25] A Comprehensive Examination of Vulnerabilities in IoT Systems IoT taxonomy, eﬀects and remediation with an initial investigation into 
Large-Scale exploitation 
Meneghello et el. [13] IoT: The Internet of Dangerous Things? A Survey of Practical 
Security Vulnerabilities in Real IoT Devices 
Security measures taken by the IoT communication protocols that are used 
the most, as well as the vulnerabilities in those protocols. 
Raﬁque et al. [15] Enhancing IoT Services via Software-Deﬁned Networking and Edge 
Computing: A Thorough Exploration 
Utilizing SDN and Edge Computing for Resource-Constrained, 
Compute-Intensive Tasks. 
Al-Garadi et al. [20] Examination of Machine and Deep Learning Strategies for 
Augmenting Security in the IoT 
Security Challenges in IoT and Resolutions Employing Machine Learning 
and Deep Learning. 
Sharma et al. [12] Ensuring Security, Privacy, and Trust in Smart Mobile-IoT (M-IoT): 
An In-Depth Survey 
TComparative Analysis of Threats and Countermeasures in Existing 
Literature for Smart Mobile-IoT (M-IoT). 
Fernandez et al. [26] Transitioning from Pre-Quantum to Post-Quantum IoT Security: An 
Exploration of Quantum-Resistant Cryptosystem

---

Journal of Network and Computer Applications 236 (2025) 104110
3
M. Lefoane et al.
Table 1
A table of acronyms and their descriptions.
Acronym Description
IoT Internet of Things
IoMT Internet of Medical Things
4IR Fourth Industrial Revolution
DDoS Distributed Denial of Service
ML Machine Learning
DL Deep Learning
CNI Critical National Infrastructure
OSR Overall Success Rate
TPR True Positive Rate
FPR False Positive Rate
RFID Radio Frequency Identification
IDSs Intrusion Detection Systems
PaaS Platform as a Service
IaaS Infrastructure as a Service
SaaS Software as a Service
AADRNN Auto-Associative Dense Random Neural Network
KNN K-Nearest Neighbour
C&C Comand and Control
SVM Support Vector Machines
ABD Anomaly Based Detection
CDIS Compromised Device Identification System
CNN Convolutional Neural Networks
DNN Deep Neural Networks
GOA Grasshopper algorithm
BLSTM Bidirectional long short-term memory
DCNN Distributed Convolutional Neural Networks
LSTM Long Short-Term Memory
not considered only for IoT technology in isolation but key enabling
technologies that are behind the success of IoT proliferation. The chal-
lenges and crucial requirements are revealed. Furthermore, there are
key technologies that form core solutions in the detection of IoT Botnet
attacks. Consideration of the entire IoT ecosystem when reviewing
detection approaches thus forms the basis for review and criteria for
analysis.
The process depicted in the flowchart illustrated in Fig. 1 high-
lights the sequential steps that were undertaken. The initiation of the
literature review involved the execution of keyword search queries
encompassing terms such as ‘‘Internet of Things Botnet detection’’,
‘‘Machine Learning for Internet of Things Botnet detection’’, and ‘‘Deep
Learning Internet of Things Botnet detection’’ on Google Scholar.
A comprehensive exploration across multiple databases, including
IEEEXplore, ACM, SCIENCEDIRECT, and SCOPUS, yielded a diverse
collection of articles pertaining to the detect","As an integrant of SCs, SHs and SBs equipped with advanced communication technologies and IoT can provide a variety of
services to their inhabitants through adaptations and responsiveness. However, the conventional communication systems deteriorate
to provide satisfactory performance due to the high data generated by the IoT devices. The 6G-IoT system will lead to intelligent and
autonomous connected systems that can pave the way to turn the concept of SCs from hype to reality. In this paper, we surveyed the
existing literature on SHs and SBs and we investigated the enabling 6G technologies in the context of SHs and SBs with an emphasis
on IoT enabled SHs and SBs, its major requirements, advanced ICT, and enabling 6G technologies followed by the key challenges and
opportunities. Given the significance of 6G and IoT in SCs, this survey article provide a guideline and helpful resources in defining
the future research direction in modeling of future SHs and SBs. Keeping in view the challenges, the advanced ML techniques
needs to be explored for integrated communication and sensing in SHs and SBs such as transformer and diffusion models. On the
other hand, cloud–edge collaboration technologies such as federated learning, edge intelligence and distributed optimization can be
considered to enhance intelligence in SHs and SBs. Similarly, the performance evaluation and optimization of the multiple coexisted
technologies such as JCAS, VLC and sensing, BC, and RIS aided smart indoor environment needs further exploration in future. More
specifically, advances in RIS architectures such as simultaneous transmission and reflection (STAR)-RIS and optical RIS (ORIS) for
the SH and SB applications is one of the trending topic that needs to be explored. Moreover, explainable AI along with the digital
twin needs to be considered for SHs and SBs applications. On the other hand, the interoperability of multiple technologies in case
of interconnected homes and building along with the healthcare systems is challenging and needs special consideration",,,,,,,
Explain the Comparisons of Communicational Overhead in the scientific article A Blockchain and IPFS-Aided Anonymous Traitor Tracing Scheme Based on Puncturable Encryption in Industrial Internet of Things!,"iting – review & editing, Supervision, Funding acqui-
sition. Xiaolong Liu: Writing – review & editing, Supervision, Investi-
gation, Funding acquisition.
Declaration of competing interest
The authors declare that they have no known competing finan-
cial interests or personal relationships that could have appeared to
influence the work reported in this paper.
Acknowledgments
This work was supported in part by fund of scientific and techno-
logical innovation of Fujian agriculture and Forestry University (Grant
No. KFb22091XA), Project of Industry-university-institute Cooperation
in Colleges and Universities in Fujian Province (Grant No. 2022H6006,
2024H6007) and the Project of Software Technology Innovation Re-
search and Industrialization in Fujian Province (Grant No. 2024.488).
Data availability
Data will be made available on request.
References
[1] Number of Internet of Things (IoT) connected devices worldwide from 2019
to 2021, with forecasts from 2022 to 2030, 2018, https://www.statista.com/
statistics/1183457/iot-connected-devices-worldwide/ .
[2] Xu Yang, Xuechao Yang, Xun Yi, Ibrahim Khalil, Xiaotong Zhou, Debiao He, Xinyi
Huang, Surya Nepal, Blockchain-based secure and lightweight authentication for
Internet of Things, IEEE Internet Things J. 9 (5) (2021) 3321–3332.
[3] Soumyashree S. Panda, Debasish Jena, Bhabendu Kumar Mohanta, Somula
Ramasubbareddy, Mahmoud Daneshmand, Amir H. Gandomi, Authentication and
key management in distributed iot using blockchain technology, IEEE Internet
Things J. 8 (16) (2021) 12947–12954.
[4] Zesen Hou, Jianting Ning, Xinyi Huang, Shengmin Xu, Leo Yu Zhang, Blockchain-
based efficient verifiable outsourced attribute-based encryption in cloud, Comput.
Stand. Interfaces (2024) 103854.
[5] Ya-Nan Cao, Yujue Wang, Yong Ding, Zhenwei Guo, Qianhong Wu, Hai Liang,
Blockchain-empowered security and privacy protection technologies for smart
grid, Comput. Stand. Interfaces 85 (2023) 103708.
[6] Noureddine Chikouche, Pierre-Louis Cayrel,

---

ScienceDirect
Available online at www.sciencedirect.com
Procedia Computer Science 272 (2025) 625–630
1877-0509 © 2025 The Authors. Published by Elsevier B.V .
This is an open access article under the CC BY-NC-ND license (https://creativecommons.org/licenses/by-nc-nd/4.0)
Peer review under the responsibility of the scientific committee of the Program Chairs.
10.1016/j.procs.2025.10.258
10.1016/j.procs.2025.10.258 1877-0509
© 2025 The Authors. Published by Elsevier B.V .
This is an open access article under the CC BY-NC-ND license (https://creativecommons.org/licenses/by-nc-nd/4.0)
Peer review under the responsibility of the scientific committee of the Program Chairs.
 
Available online at www.sciencedirect.com 
ScienceDirect 
Procedia Computer Science 00 (2025) 000–000  
www.elsevier.com/locate/procedia 
 
1877-0509 © 2025 The Authors. Published by Elsevier B.V. 
This is an open access article under the CC BY-NC-ND license (http://creativecommons.org/licenses/by-nc-nd/4.0/) 
Peer-review under responsibility of the Conference Program Chairs.  
The 2nd International Workshop on Intelligent Mobile Systems based on Internet of Things 
October 28-30, 2025, Istanbul, Türkiye 
Securing the Industrial Internet of Things: Threats, Vulnerabilities, 
and Recommendations 
Akzhibek Amirovaa*, Laura Aldashevaa, Aliya Abdiramana 
aAstana IT University, Astana, 010000, Kazakhstan 
Abstract 
The Industrial Internet of Things (IIoT) is a key component of Industry 4.0, enabling intelligent automation, real -time data 
exchange, and integration of cyber -physical systems in industrial environments. However, the increasing complexity and 
interconnectivity of IIoT infrastructures introduce significant cybersecurity challenges. This paper provides a comprehensive 
overview of the current state of information security in IIoT systems. It begins with a conceptual analysis of IIoT and its distinctions 
from general IoT applications. The study reviews recent scientific research from 2018 to 2

---

ter or materials 
discussed in this manuscript.
Acknowledgements
The authors extend their appreciation to the Deanship of Research 
and Graduate Studies at King Khalid University for funding this work 
through Large Research Project under grant number RGP2/17/45. 
Princess Nourah bint Abdulrahman University Researchers Supporting 
Project number (PNURSP2025R303), Princess Nourah bint Abdulrah -
man University, Riyadh, Saudi Arabia. The authors extend their appre -
ciation to Northern Border University, Saudi Arabia, for supporting this 
work through project number (NBU-CRP-2025-2903). The authors are 
thankful to the Deanship of Graduate Studies and Scientific Research at 
University of Bisha for supporting this work through the Fast-Track 
Research Support Program. This work was supported by the Deanship 
of Scientific Research, Vice Presidency for Graduate Studies and Scien -
tific Research, King Faisal University, Saudi Arabia, under project Grant 
KFU252077.
References
[1] P. Rani, S. Verma, S.P. Yadav, B.K. Rai, M.S. Naruka, D. Kumar, Simulation of the 
lightweight blockchain technique based on privacy and security for healthcare data 
for the cloud system, Int. J. E-Health Med. Commun. (IJEHMC 13 (4) (2022) 1 – 15 .
[2] R. Kumar, R. Tripathi, Towards design and implementation of security and privacy 
framework for Internet of Medical Things (IoMT) by leveraging blockchain and 
IPFS technology, J. Supercomput 77 (8) (Aug. 2021) 7916 – 7955, https://doi.org/ 
10.1007/s11227-020-03570-x .
[3] P. Rani, et al., Federated learning-based misbehaviour detection for the 5G-enabled 
internet of vehicles, IEEE Trans. Consum. Electron. (2023) .
[4] D.F.B. Cardoso, Medical Devices Information Systems in Primary Care, Master ’ s 
Thesis, Universidade NOVA de Lisboa (Portugal), 2022. Accessed: Mar. 03, 2025. 
[Online]. Available: 〈 https://search.proquest.com/openview/4c4fc23a4d9b19d0f 
bbe2dc472f79f59/1?pq-origsite = gscholar & cbl = 2026366 & diss = y 〉 .
[5] P. Rani, U.C.

---

ScienceDirect
Available online at www.sciencedirect.com
Procedia Computer Science 259 (2025) 1270–1281
1877-0509 © 2025 The Authors. Published by Elsevier B.V .
This is an open access article under the CC BY-NC-ND license ( https://creativecommons.org/licenses/by-nc-nd/4.0 )
Peer-review under responsibility of the scientific committee of the Sixth International Conference on Futuristic Trends 
in Networks and Computing Technologies (FTNCT06)
10.1016/j.procs.2025.04.082
 
Available online at www.sciencedirect.com 
ScienceDirect 
Procedia Computer Science 00 (2025) 000–000  
www.elsevier.com/locate/procedia 
 
1877-0509 © 2025 The Authors. Published by ELSEVIER B.V. 
This is an open access article under the CC BY-NC-ND license (https://creativecommons.org/licenses/by-nc-nd/4.0) 
Peer-review under responsibility of the scientific committee of the Sixth International Conference on Futuristic Trends in Networks and 
Computing Technologies (FTNCT06) 
Sixth International Conference on Futuristic Trends in Networks and Computing Technologies (FTNCT06)  held in  
Uttarakhand, India 
Enhance Quality of Services in Internet of Things using 
Improved Dynamic Bandwidth Allocation (IDBA) Techniques 
Shekhara, Gaurav Bhandarib , Sudhanshu Tyagic 
aIcfai university, Dehradun, uttarkhand 248197,India  
                                                                                                                      bIcfai university, Dehradun, uttarkhand 248197,India  
 
Abstract 
The Internet of Things (IoT) is a frequently employed term in the twenty -first century. It is an important part of the Industrial 4.0 
revolution and has garnered industrial traction. By 2030, there will be approximately 50 billion Internet of Th ings devices, 
according to many projections. Some countries will expand around two -thirds of these IoT devices on their own. Numerous 
Internet of things or I oT issues might arise from inadequate computing power and broadband availability. These issues incl","As an integrant of SCs, SHs and SBs equipped with advanced communication technologies and IoT can provide a variety of services to their inhabitants through adaptations and responsiveness. However, the conventional communication systems deteriorate to provide satisfactory performance due to the high data generated by the IoT devices. The 6G-IoT system will lead to intelligent and autonomous connected systems that can pave the way to turn the concept of SCs from hype to reality. In this paper, we surveyed the existing literature on SHs and SBs and we investigated the enabling 6G technologies in the context of SHs and SBs with an emphasis on IoT enabled SHs and SBs, its major requirements, advanced ICT, and enabling 6G technologies followed by the key challenges and opportunities. Given the significance of 6G and IoT in SCs, this survey article provide a guideline and helpful resources in defining the future research direction in modeling of future SHs and SBs. Keeping in view the challenges, the advanced ML techniques needs to be explored for integrated communication and sensing in SHs and SBs such as transformer and diffusion models. On the other hand, cloud–edge collaboration technologies such as federated learning, edge intelligence and distributed optimization can be considered to enhance intelligence in SHs and SBs. Similarly, the performance evaluation and optimization of the multiple coexisted technologies such as JCAS, VLC and sensing, BC, and RIS aided smart indoor environment needs further exploration in future. More specifically, advances in RIS architectures such as simultaneous transmission and reflection (STAR)-RIS and optical RIS (ORIS) for the SH and SB applications is one of the trending topic that needs to be explored. Moreover, explainable AI along with the digital twin needs to be considered for SHs and SBs applications. On the other hand, the interoperability of multiple technologies in case of interconnected homes and building along with the healthcare systems is challenging and needs special consideration.",,,,,,,
Provide an academic summary of the abstract from the article A Cloud-Assisted Anonymous and Privacy-Preserving Authentication Scheme for Internet of Medical Things!,"Internet of Things 30 (2025) 101469
6
J.S. Yalli et al.
Table 2
Inclusion and exclusion criteria.
Criteria Inclusion criteria Exclusion criteria
Publication year 2014–2023 Not between 2014–2023
Type Journal articles and full conference papers Abstract-only papers, tutorials, seminars, interviews, and blog
posts
Language English Non-English
Availability Full-text articles available for review Incomplete or inaccessible studies
Relevance Focus on IoT authentication schemes Not addressing IoT authentication mechanisms
Authentication proof Works that include algorithms/pseudo-code with security
analysis
Works that do not provide any algorithm or analysis
Publication status Peer-reviewed and final versions Unpublished or pre-print versions
Access type Open access or subscription-based articles via institutional
login
Non-accessible (restricted or pay-walled)
Fig. 1. Flowchart of articles inclusion & exclusion criteria.
• IoT OR Internet of Things
• IoT Security
• IoT AND Authentication
• Authentication Algorithm OR Lightweight Authentication
• IoT Authentication Analysis
No filters were applied initially to ensure a comprehensive result of potentially relevant studies, so 4472 papers were displayed.
Once the broad pool of articles was obtained, multiple filters were used to refine the results based on publication date (restricted
to the last decade), language (English only), and document type (journal articles and full conference papers). Fig. 2 illustrates the
initial search results, showing the distribution of articles across the selected databases.
3.2. Inclusion and exclusion criteria
All retrieved studies were meticulously evaluated during the article screening phase based on the inclusion and exclusion criteria,
as specified in Table 2. These criteria guided the selection process, ensuring that only papers addressing IoT authentication schemes
were used in this review. Articles not aligning with the criteria were excluded from further analysis, and 4372 articles we

---

Internet of Things 30 (2025) 101469
7
J.S. Yalli et al.
Fig. 2. Final articles screened and selected.
3.3. Screening and selection process
A comprehensive screening process was applied to the articles retrieved during the initial search phase. This process followed a
two-step approach:
1. Title and Abstract Screening: Articles were first screened based on their titles and abstracts to remove less relevant studies
from this SLR. At this stage, studies that did not focus on IoT networks or authentication were excluded.
2. Full-Text Screening: The remaining articles underwent a full-text review to ensure relevance to the specific topic of IoT
authentication schemes. Only articles that addressed IoT security via authentication were retained.
Note that the screening and selection process described above was conducted manually by navigating through the whole article
to see if the title, abstract, authentication proof, and analysis are provided to add or drop the article. This was conducted manually
for almost 100 articles. This multi-step manual screening procedure ensured that only proven authentication works of high-quality
articles were selected for further analysis and comparison.
3.4. Research trend
This subsection shows how research in IoT security is gaining weight. It is shown that significant research on IoT has been
conducted in the last decade. This has motivated us to study, assess, and evaluate the works proposed and find out why the security
issue in IoT persists. The keywords search in Section 3.1 reflects the results in Fig. 3. This has shown an exponential increase, and
the number of IoT publications demonstrates that research in IoT is embraced daily. Some observations drawn are as follows:
1. Exponential growth: The number of publications is increasing yearly and has accelerated significantly throughout 2023. This
exponential rise indicates that IoT technology is fast growing and gaining attention across many industries.
2. IoT Sensor Nodes Advancements

---

Cyber Security and Applications 3 (2025) 100057 
Contents lists available at ScienceDirect 
Cyber Security and Applications 
journal homepage: http://www.keaipublishing.com/en/journals/cyber -security-and-applications/ 
Authentication, access control and scalability models in Internet of Things 
Security–A review 
M Kokila,Srinivasa Reddy K ∗ 
School of Computer Science and Engineering, VIT-AP University, Amaravathi. Andhra Pradesh, India 
a r t i c l e i n f o 
Keywords: 
Internet of Things 
Blockchain 
Scalability 
Data Security 
Edge computing 
Authentication schemes 
a b s t r a c t 
The Internet of Things (IoT) leads to the next phase of human interaction with technology. With the help of the 
IoT, physical objects can be given the ability to generate, receive, and seamlessly trade data with one another. 
The IoT includes a wide variety of applications, each of which focuses on automating a speciﬁc task and works 
to give inanimate objects the ability to act independently of human intervention. The currently available and 
upcoming IoT applications hold a great deal of promise for enhancing the level of convenience, productivity, 
and automation enjoyed by users. High levels of security, privacy, authentication, and the ability to recover from 
attacks are required for the implementation of such a world in a manner that is constantly expanding. In this 
light, it is necessary to make the necessary adjustments to the architecture of IoT applications to accomplish end- 
to-end security in IoT environments. In this article, a comprehensive review of the security-related challenges and 
potential sources of danger posed by IoT applications is provided. Following a discussion of security concerns, a 
variety of new and established technologies that are focused on achieving a high degree of trust in the applications 
of the IoT are covered. Machine learning, fog computing, edge computing, and blockchain are just a few of the 
technologies that help the IoT provide gr

---

Table 1: Subjects of the papers.
Subject Paper Reference
BC
BC-RAN: Cloud radio access network enabled by blockchain for 5G [73]
Blockchain-enabled wireless communications: a new paradigm towards 6G [74]
Distributed Network Slicing Management Using Blockchains in E-Health Environments [75]
Design of a Security and Trust Framework for 5G Multi-domain Scenarios [76]
Data Broker: Dynamic Multi-Hop Routing Protocol in Blockchain Radio Access Network [77]
Future Industry Internet of Things with Zero-trust Security [78]
Blockchain Based Privacy Preserving Framework for Emerging 6G Wireless Communications [79]
Blockchain-based fog radio access networks: Architecture, key technologies, and challenges [80]
Evaluation of soft computing in intrusion detection for secure social Internet of Things based on collaborative edge
computing [81]
Resource Sharing and Trading of Blockchain Radio Access Networks: Architecture and Prototype Design [82]
Radio optical network security analysis with routing in quantum computing for 5G wireless communication using
blockchain machine learning model [83]
Hedera: A Permissionless and Scalable Hybrid Blockchain Consensus Algorithm in Multi-Access Edge Computing for IoT [84]
FH
Securing Ethernet-based optical fronthaul for 5G network [85]
Secure Open Fronthaul Interface for 5G Networks [86]
Transport Security Considerations for the Open-RAN Fronthaul [87]
Open-RAN Fronthaul Transport Security Architecture and Implementation [35]
IDS/IPS
Detecting DoS and DDoS Attacks by Using CuSum Algorithm in 5G Networks [88]
Attacks and failures prediction framework for a collaborative 5G mobile network [89]
The Novel System of Attacks Detection in 5G [90]
An edge based hybrid intrusion detection framework for mobile edge computing [91]
A highly secured IDS for IoT using EXPSO-STF A feature selection for LAANN to detect attacks [92]
RRC
Authentication Protocol for an IoT-Enabled LTE Network [93]
On the Impact of Rogue Base Stations in 4G/LTE Self Organizing Net","With the rapid advancement of the Internet of Medical Things (IoMT) and the increasing adoption of cloud
computing, the storage and processing of medical data have become significantly more efficient. However, in
cloud-assisted IoMT environments, data is exposed to risks due to open networks and semi-trusted cloud service
providers, potentially compromising sensitive information. Ensuring data security is paramount; yet, existing
authentication protocols often exhibit limitations, such as high computational overhead and security vulnerabilities.
In this paper, we propose a cloud-assisted authentication scheme designed to ensure secure privacy
protection for physiological data within the open network environment of IoMT, while accommodating the
resource-constrained nature of sensor nodes. Our innovative remote anonymous authentication scheme leverages
Elliptic Curve Cryptography to facilitate secure mutual authentication over insecure channels. During the
authentication phase, the cloud server cannot ascertain the user’s true identity, allowing patients to access
services anonymously. To enhance security, we employ proxy re-encryption techniques, enabling users to
decrypt the cloud server’s encrypted shared intermediate ciphertexts securely. Comprehensive security and
privacy analyses, along with performance evaluations, demonstrate that the proposed scheme offers superior
cost-effectiveness, enhanced privacy protection, and improved execution efficiency compared to existing
solutions.",,,,,,,
"What are the research limitations discussed in the scientific article A Comprehensive Review of Cybersecurity Vulnerabilities, Threats, and Solutions for the Internet of Things at the Network-Cum-Application Layer?","ch, concentrating instead on studies conducted be -
tween 2009 and 2024. This limitation may affect its pertinence to 
nascent trends and technologies that have not yet undergone substantial 
examination. The study may possess diminished empirical significance 
due to its reliance on secondary data and literature reviews, as it lacks 
direct evidence to substantiate its assertions and does not conduct 
original experimental validation.
Although the article effectively classifies IoT applications, general -
ization poses challenges due to IoT domains ’ diversity and rapid 
expansion. Specific sectors, like healthcare and industrial IoT, present 
distinct challenges that necessitate specialized research and solutions. 
Moreover, although the study ’ s recommendations are plausible and 
attainable, substantial obstacles may exist. Scalability, financial limita -
tions, and compatibility with many IoT platforms may all hinder the 
practical feasibility of suggested security solutions. These constraints 
highlight the need for additional enhancement and contextualization to 
guarantee that the study ’ s conclusions and recommendations can be 
effectively used across diverse IoT scenarios.
12.2. Research implications
The research on IoT security that is covered in this article has 
important implications for both academic research and practical 
implementation. This research contributes to the growing body of 
knowledge that deals with the significant security problems of Internet 
of Things (IoT) systems by proposing a five-layer design and focusing on 
the vulnerabilities, dangers, and solutions that are unique to the 
network-cum-application layer. This work ’ s classification of IoT appli -
cations and systematic analysis of real-time monitoring, scientific 
decision-making, and query/scan systems can be used by researchers as 
a foundation for future research. The comprehensive literature review 
pinpoints areas where research is insufficient and recommends investi -

---

are imperative for the security and functionality of the Internet of 
Things. This study reveals critical areas for reinforcement by meticu -
lously analyzing this specific layer, hence enhancing the overall security 
of IoT networks. The report provides a comprehensive summary of 
contemporary research about cybersecurity challenges and solutions in 
IoT, referencing over 200 academic publications. This comprehensive 
literature review not only synthesizes current material but also identifies 
gaps and areas for further investigation. This comprehensive assessment 
is an essential resource for scholars and professionals seeking to un -
derstand the latest vulnerabilities and responses in IoT technology. The 
study significantly benefits from the extensive and comprehensive 
literature review, ensuring that its results and insights are thoroughly 
investigated and substantiated by robust data.
Furthermore, the article presents feasible recommendations for 
improving IoT security. These encompass rectifying physical de -
ficiencies, augmenting computational capabilities, and implementing 
cyber risk mitigation strategies. By offering these valuable recommen -
dations, the study bridges the divide between theoretical analysis and 
practical application, ensuring that its conclusions are both insightful 
and applicable. This study is highly relevant to both academic and 
corporate researchers as it provides stakeholders with a framework for 
enhancing the security and reliability of IoT systems. The work signifi -
cantly contributes to the ongoing discourse on IoT security and devel -
opment by its integration of theoretical insights and practical 
applications.
12.1.2. Research limitations
The article, while comprehensive, does not encompass all contem -
porary IoT research, concentrating instead on studies conducted be -
tween 2009 and 2024. This limitation may affect its pertinence to 
nascent trends and technologies that have not yet undergone substantial 
examinat

---

Contents lists available at ScienceDirect
Internet of Things
journal homepage: www.elsevier.com/locate/iot  
Review article
Privacy and security of federated learning in resource-constrained 
Internet of Things environment: Systematic literature review
Walla Khalaifat
 ∗, Wael Elmedany
 , Haroun Alryalat
College of Information Technology, University of Bahrain, Sakheer, Bahrain
A R T I C L E  I N F O
Keywords:
Federated learning
Internet of Things
Privacy attack
Security attack
Resource constraint IoT
 A B S T R A C T
Federated Learning (FL) has become a suggested method due to the growing adoption of Internet 
of Things (IoT) devices, tied with the growing need for collaborative learning and data analysis. 
FL allows for distributed learning, while ensuring the privacy. Nevertheless, the potential for 
security vulnerabilities and privacy breaches became more and more complex because of the 
increasing number of devices that are connected. Moreover, FL in Resource-Constrained IoT 
environments introduces additional challenges due to the nature of these environments, as these 
environments have devices with limited resources. Additionally, since FL enables collaborative 
learning across a decentralized IoT environment, ensuring strong security and privacy becomes 
crucial to protect information and maintain the trust of participants. This research aims to 
present comprehensive Systematic Literature Review (SLR) of academic articles on security 
and privacy of Resource-Constrained environments in FL published from 2016 to 2024. The 
study intends to maximize the knowledge in FL, FL in Resource-Constrained IoT environments, 
identification of privacy and security concerns, and techniques designed to enhance them in FL.
1. Introduction
Internet of Things (IoT) phrase is used to reflect the vision of linking different devices through a network, where every device is 
tagged with the data corresponding to it [1]. Internet of Things has transformed many industries by a

---

M. Kokila and S. Reddy K Cyber Security and Applications 3 (2025) 100057
Table 1 
Comparative analysis of related works. 
Ref. Survey Objective 
Hameed et al. [23] Comprehending the security needs and confronting challenges 
within the IoT 
Security vulnerabilities are categorized, emphasizing challenges, current 
solutions, and areas of ongoing research. 
Wang et al. [24] Exploration of Blockchain Applications in the IoT Advancements in Blockchain Data Structure and Consensus Protocols: 
Review of Relevant Research Works. 
Sengupta et al. [8] An In-Depth Analysis of Threats, Privacy Concerns, and 
Blockchain-Based Solutions for IoT and Industrial IoT 
Classiﬁcation of Attacks on IoT and Countermeasures; In-Depth 
Examination of Blockchain-Based Solutions for IoT and IIoT Applications. 
Neshenko et al. [25] A Comprehensive Examination of Vulnerabilities in IoT Systems IoT taxonomy, eﬀects and remediation with an initial investigation into 
Large-Scale exploitation 
Meneghello et el. [13] IoT: The Internet of Dangerous Things? A Survey of Practical 
Security Vulnerabilities in Real IoT Devices 
Security measures taken by the IoT communication protocols that are used 
the most, as well as the vulnerabilities in those protocols. 
Raﬁque et al. [15] Enhancing IoT Services via Software-Deﬁned Networking and Edge 
Computing: A Thorough Exploration 
Utilizing SDN and Edge Computing for Resource-Constrained, 
Compute-Intensive Tasks. 
Al-Garadi et al. [20] Examination of Machine and Deep Learning Strategies for 
Augmenting Security in the IoT 
Security Challenges in IoT and Resolutions Employing Machine Learning 
and Deep Learning. 
Sharma et al. [12] Ensuring Security, Privacy, and Trust in Smart Mobile-IoT (M-IoT): 
An In-Depth Survey 
TComparative Analysis of Threats and Countermeasures in Existing 
Literature for Smart Mobile-IoT (M-IoT). 
Fernandez et al. [26] Transitioning from Pre-Quantum to Post-Quantum IoT Security: An 
Exploration of Quantum-Resistant Cryptosystem","The article, while comprehensive, does not encompass all contem
porary IoT research, concentrating instead on studies conducted
tween 2009 and 2024. This limitation may affect its pertinence to nascent trends and technologies that have not yet undergone substantial examination. The study may possess diminished empirical significance due to its reliance on secondary data and literature reviews, as it lacks direct evidence to substantiate its assertions and does not conduct original experimental validation.
Although the article effectively classifies IoT applications, general
ization poses challenges due to IoT domains’ diversity and rapid expansion. Specific sectors, like healthcare and industrial IoT, present distinct challenges that necessitate specialized research and solutions. Moreover, although the study’s recommendations are plausible and attainable, substantial obstacles may exist. Scalability, financial
tions, and compatibility with many IoT platforms may all hinder the practical feasibility of suggested security solutions. These constraints highlight the need for additional enhancement and contextualization to guarantee that the study’s conclusions and recommendations can be effectively used across diverse IoT scenarios.",,,,,,,
Describe the Certificate-Less Public Key Encryption scheme presented in the article Edge-Assisted Lightweight Message Authentication for Industrial Internet of Things,"Internet of Things 30 (2025) 101469
4
J.S. Yalli et al.
Table 1
Summary of related authentication schemes.
Ref. Authentication schemes Results Contribution(s) Limitation(s)
Lamport
[21]
Lightweight Authentication Obtained a lightweight hash
sequence of bits
Proposed a model with a hash
sequence that verified distant users
via an open transmission network
There is no evidence of connection
attempt for the session key; it lacks
known key security, and forward
secrecy
Kumar
et al. [22]
Lightweight auth protocol
(LMAP)
The delay for LMAP is 30 to
156 msec
Proposed a scheme that examines
and reduces the delays in IoT node
data sharing
Availability is not guaranteed
Porambage
et al. [24]
Implicit certificates and
end-to-end security
Designed and labeled a
resource-rich node (end users &
cluster heads CHs) and a highly
resource-intensive network node.
The scheme authenticates between
two constrained nodes and one
constrained node & a resource-rich
entity
Could not exchange messages for
the certificate seamlessly due to
different capabilities of the
resource-rich and constrained nodes
Dass and
Om [25]
Lightweight Authentication &
key exchange
Generated secret & ID from 128
and 96 bits, totaling 228 bits for
storage
The scheme eliminates replay
attacks by using a time stamp to
verify msg completion throughout
the bit exchange process
More memory is needed to keep all
the bits especially when more
readings are recorded
Lee et al.
[26]
Authentication and key
agreement
Obtained a zero-error rate from the
Bioanalysis of the nodes
Proposed a scheme that combines
biometrics and passwords which has
operational benefits over biometrics
Needs less energy consumption to
execute heavy hash operations
Fan et al.
[30]
Ultra Lightweight Mutual
Authentication Protocol
Presented pseudonyms & XOR
operations employed on NFC
technology
Attained a reduced cost of storage,
communication, and computation,
both old and new private keys are
stored in case the new key fails,
the corresponding old ke

---

M. Al-Khalidi et al.
Table 3
Definition of the terms and abbreviations used in the IoMaT security model.
Notation Description
PKG Private Key Generator
IBC Identity Base Encryption
CL-PKC CertificateLess Public Key Cryptography
IoMaT Internet of Marine Things
params Public system parameters for the certificate-less public key system
l The security parameter in the certificate-less public key system refers to the bit size of the
private key used in the ECC algorithm.
q A large prime
𝐹−𝑞 A finite field with q elements (0, q-1)
E An elliptic curve over the finite field 𝐹−𝑞, who should have a subgroup with a large prime order.
G A base point on the elliptic curve E
𝑑𝑎𝑡𝑎𝐼𝑜𝑀𝑎𝑇 IoMaT sensory data
𝑚𝐼𝑜𝑀𝑎𝑇 IoMaT message
SN Sink Node
n A large prime, which is defined to be the order of a subgroup on E
s The master private key of the certificate-less public key system
H A cryptographic hash function, who can map arbitrary strings to strings of l bits
𝑚𝑠𝑘 The master public key of the certificate-less public key system
𝑑𝐼𝐷 Partial private key
𝑅𝐼𝐷 Partial public key
𝑇 𝑖𝑚𝑒𝐼𝑜𝑀𝑎𝑇 Time stamp for the IoMaT sensory data
𝑆𝐼𝐷 Signatory’s private key
mpk The system’s master private key, which is selected randomly from the interval [1, n-1] by
the PKG and should be kept secret by the Sink Node (PKG)
𝑍𝐼𝐷 Secret value generated in each node randomly for a ship ID according to the system public parameters
params
𝑃𝐼𝐷 Public key for ship ID which is generated by key generation algorithm from system public parameters,
partial public key of the ship and secret value of the node which is generated randomly for each node
𝑆𝐼𝐷 Private key for ship ID which is generated by key generation algorithm from system public parameters,
partial private key of the ship and secret value of the node which is generated randomly for each node
• Signature: This algorithm is run by the ship (generator of the
IoMaT sensory data). The ship first needs to attach the IoMaT
data with the time to generate the IoMaT message

---

Public-Key Cryptography–PKC 2016: 19th IACR 
International Conference on Practice and Theory in Public-Key Cryptography, Taipei, Taiwan, March 6-9, 2016, Proceedings, Part I, Springer, 2016, pp. 
387–416.
[27] Johannes Buchmann, Erik Dahmen, Andreas Hülsing, XMSS-a practical forward secure signature scheme based on minimal security assumptions, in: 
Post-Quantum Cryptography: 4th International Workshop, PQCrypto 2011, Taipei, Taiwan, November 29–December 2, 2011. Proceedings 4, Springer, 
2011, pp. 117–129.
[28] John R. Douceur, The sybil attack, in: International Workshop on Peer-To-Peer Systems, Springer, 2002, pp. 251–260.
[29] Lu Xiang, S.T. Wei Zheny, Cross-domain PKI-based key agreement protocol, Comput. Sci. (ISSN: 1002-137X) 44 (01) (2017) 155–158.
[30] C. Tan, M.J. Chen, A.E. Ackah, Research on distributed identity authentication mechanism of IoT device based on blockchain, Chin. J. Internet Things 4 
(2) (2020) 70–77.
[31] Shiwen Zhang, Ziwei Yan, Wei Liang, Kuan-Ching Li, Beniamino Di Martino, BCAE: A blockchain-based cross domain authentication scheme for edge 
computing, IEEE Internet Things J. (2024).
[32] Bei Gong, Guiping Zheng, Muhammad Waqas, Shanshan Tu, Sheng Chen, LCDMA: Lightweight cross-domain mutual identity authentication scheme for 
internet of things, IEEE Internet Things J. 10 (14) (2023) 12590–12602.
[33] LiQuan Chen, WenXin Zhu, TianYang Tu, Zhongmin Wang, Lattice-based DAA cross-domain authentication protocol for internet of things, in: 2023 9th 
International Conference on Computer and Communications, ICCC, IEEE, 2023, pp. 1315–1321.
Internet of Things 33 (2025) 101737 
15

---

S. Liu et al.
Fig. 3. The system model of PQ-BCDA.
with 𝐴𝑢𝑡ℎ, is then used to calculate the root of the XMSS tree. If the computed root matches the root stored in the public key, the 
signature is deemed valid; otherwise, it is rejected.
3.4. EU-CMA and PQ-EU-CMA
Definition 1 (EU-CMA). Let Dss(1𝑛) denote a signature scheme characterized by the security parameter 𝑛. It is considered 
provably secure in the EU-CMA model if no adversary , even after making a polynomial number of signature queries, can create 
a valid signature for a new message that has not been previously queried, except with negligible probability 𝜖, as formalized in 
Eq. (1). 
SuccEU−CMA
Dss(1𝑛) () = Pr
[
𝐹 𝑜𝑟𝑔𝑒 − 𝑆𝑖𝑔𝑛 Dss(1𝑛)
 = 1
]
≤ 𝜖 (1)
Definition 2 (PQ-EU-CMA). Consider Dss as a digital signature scheme as previously defined. It is regarded as provably secure 
in the PQ-EU-CMA model if no quantum adversary , even after performing a polynomial number of classical signature queries, can 
produce a valid signature for a new message that has not been previously queried, except with negligible probability 𝜖, as expressed 
in Eq. (2). 
SuccPQ−EU−CMA
Dss(1𝑛) () = Pr
[
𝐹 𝑜𝑟𝑔𝑒 − 𝑆𝑖𝑔𝑛 Dss(1𝑛)
 = 1
]
≤ 𝜖 (2)
4. System overview
4.1. System model
The system model, which incorporates a trusted key generation center, authentication servers, Internet of Things (IoT) devices, 
and blockchain infrastructure, is illustrated in Fig.  3.
1. IoT devices: IoT devices interact with one another and their surroundings via Internet connectivity. These devices are typically 
defined by their low energy usage, limited processing capabilities, and constrained storage resources.
2. Authentication Server: The server, which functions as a full-fledged blockchain node, facilitates cross-domain authentication 
of IoT devices by executing smart contracts. It also manages data upload and request functions. All AS in different domains 
will work together to manage the consortium’s blockchain.
3. Key generation center: The KG","Certificate-less public key encryption (CL-PKC) is a model that utilizes public key encryption while avoiding the inherent key escrow associated with identity-based encryption, and it does not require certificates to verify the authenticity of public keys. In the CL-PKC system, Key Generation Center (KGC) provides entities with partial private keys, which the entities then combine with secret information to generate their actual private keys. Additionally, entities compute their public keys by combining their secret information with the KGC’s public parameters. In this framework, the KGC is unable to access the entities’ private keys, thus mitigating the key escrow issue. More details can be found in [50].",,,,,,,
Explain the concept of data sharing based on blockchain as presented in the scientific article A Data Sharing Scheme Based on Blockchain for Privacy Protection Certification of Internet of Vehicles,"Vehicular Communications 51 (2025) 100864
Available online 2 December 2024
2214-2096/© 2024 Elsevier Inc. All rights are reserved, including those for text and data mining, AI training, and similar technologies.
A data sharing scheme based on blockchain for privacy protection 
certification of Internet of Vehicles
Fengjun Shang
*
, Xinxin Deng
School of Computer Science and Technology, Chongqing University of Posts and Telecommunications, Chongqing 400065
ARTICLE INFO
Keywords:
Blockchain
Internet of Vehicles data sharing
Cluster head selection
Attribute-based encryption
Zero-knowledge proof
ABSTRACT
With the vigorous development of Internet of Vehicles (IoV) technology, modern cars equipped with advanced 
on-board systems are continuously generating massive amounts of data. Utilizing this data can improve driving 
safety and achieve better service quality in smart transportation systems. Therefore, ensuring the efficiency and 
security of data sharing is an important issue. Integrating IoV and blockchain technology can provide solutions to 
the data sharing security problems. This paper researches on IoV data sharing based on blockchain technology. In 
view of the problem that Internet of Vehicles data is susceptible to denial of service attacks, central failures and 
privacy leaks, we propose a data sharing scheme based on blockchain for privacy protection certification of 
Internet of Vehicles. Firstly, a decentralized privacy protection authentication framework is proposed is based on 
blockchain. Authenticated communication is performed between vehicle nodes and roadside units (as trusted 
authorities) by using authentication and access authentication schemes. Secondly, the trusted cluster head 
selected through the weight indicator is responsible for forwarding the information to the Trust Authority (TA), 
which then forwards the data to cloud storage and records the certificate and hash value on the distributed 
blockchain, along with other related informatio

---

ontrollability and 
privacy protection, and provide feasible technical solutions for the 
development of the Internet of Vehicles. The research on data protection 
for the Internet of Vehicles based on blockchain technology has not yet 
covered the entire lifecycle of data, including the collection, trans -
mission, use, storage, and destruction process. It cannot meet the re -
quirements for confidentiality, integrity, and availability of data in 
processing and business operations, which poses potential security risks 
for users when using Internet of Vehicles services. This paper researches 
on IoV data sharing based on blockchain technology. In view of the 
problem that Internet of Vehicles data is susceptible to denial of service 
attacks, central failures and privacy leaks, we propose a data sharing 
scheme based on blockchain for privacy protection certification of 
Internet of Vehicles. The main contributions of this paper are summa -
rized as follows.
Firstly, this paper proposes a blockchain-based privacy protection 
authentication data sharing scheme for the Internet of Vehicles.
Secondly, this paper proposed a decentralized privacy-preserving 
authentication framework based on blockchain technology and imple -
ments secure communication between vehicle nodes and roadside units 
as trust institutions through identity verification and access control 
policies.
Thirdly, this paper proposed a trusted cluster head selection scheme 
based on weight indicators. The selected cluster head is responsible for 
forwarding information to a trusted authority (Trust Authority, TA). The 
TA then forwards the data to cloud storage and stores it in the distrib -
uted area. Certificates, hash values and other related information are 
recorded on the blockchain. At the same time, TA will revoke the cer -
tificate of the malicious vehicle node and clear it from the blockchain. In 
addition, this solution introduces a practical Byzantine fault-tolerant 
algorithm to maintain

---

a layer, such as hash functions, encryption technology, 
and zero knowledge proof, to ensure the security of data in transactions 
and sharing. The current research has not yet covered security measures 
for the entire lifecycle of data, such as data collection, transmission, use, 
transfer to destruction processes. This limitation cannot fully meet the 
requirements for confidentiality, integrity, and availability of data in 
processing and business operations, and still poses potential security 
risks for users when using connected car services.
This paper proposes a blockchain based data sharing scheme for 
privacy protection authentication in the Internet of Vehicles, addressing 
issues such as susceptibility to denial of service attacks, center failures, 
and privacy leaks. Firstly, we introduce a decentralized privacy pro -
tection authentication framework based on blockchain technology, 
which verifies communication between vehicle nodes and base stations 
(as trusted authorities) through authentication and access authentica -
tion schemes. Secondly, the trusted cluster head selected through weight 
indicators is responsible for forwarding information to the trusted 
institution, which then forwards the data to cloud storage and records 
relevant information such as certificates and hash values on the 
distributed blockchain. In addition, our solution adopts the Practical 
Byzantine Fault Tolerance(PBFT) consensus algorithm to ensure the 
security and reliability of blockchain. Finally, TA will revoke the cer -
tificate of the malicious vehicle node and remove it from the blockchain.
3. Data sharing scheme based on blockchain for privacy 
protection certification
3.1. Foreword
This paper designs the blockchain framework to achieve identity 
verification communication between vehicle nodes and base stations (as 
trusted authoritative institutions) through authentication and access 
control schemes. We select trusted cluster heads based on weight in -
dicators,

---

Contents lists available at ScienceDirect
Computer Networks
journal homepage: www.elsevier.com/locate/comnet  
Blockchain-cloud-based secure data sharing scheme with privacy 
preservation for Internet of vehicles
Tao Li a,b, Kaizhong Zuo a,b,∗, Peng Hu a,b
 ,∗, LaiShui Lv c, Tianjiao Ni a,b, Zhangyi Shen a,b, 
Dong Xie a,b, Fulong Chen a,b
a School of Computer and Information, Anhui Normal University, Wuhu 241002, China
b Anhui Provincial Key Laboratory of Industrial Intelligence Data Security, Anhui Normal University, Wuhu 241002, China
c College of Information Engineering, China Jiliang University, Hangzhou 310018, China
A R T I C L E  I N F O
Keywords:
Internet of vehicles
Data sharing
Blockchain
Hybrid encryption
Privacy preservation
 A B S T R A C T
Massive road environment data sharing can assist vehicle owners in planning optimal routes, thereby enhancing 
driving comfort and safety. However, existing vehicular network data-sharing services face privacy and security 
risks, such as the exposure of vehicle location information. To address these issues, this paper proposes a 
blockchain-cloud-based secure data sharing scheme with privacy preservation for Internet of vehicles, called 
BSDS. The scheme first utilizes blockchain and hybrid encryption to design a secure data storage model. 
The encrypted data is stored on the cloud server, while data credentials are stored on the blockchain, thus 
preventing malicious tampering with the data on the cloud server and ensuring the integrity of vehicular 
network data stored in the cloud. Furthermore, conditional privacy-preserving authentication technology is 
employed to ensure the integrity of vehicular network data during communication and achieve the privacy of 
identities. Comprehensive security proofs and analysis demonstrate that the proposed scheme meets essential 
security requirements, including confidentiality, data integrity, non-repudiation, conditional privacy protection. 
Extensive experimental result","In 2018, Satoshi Nakamoto first proposed the concept of ""Bitcoin""
[13]. As the core of Bitcoin, blockchain technology has attracted much
attention because it solves the problem of data record consensus among
users with different trust backgrounds. The key feature of blockchain is
decentralization, where on chain information is publicly available to all
nodes, and these nodes can jointly maintain transactions and communication
operations through cryptographic algorithms, consensus
F. Shang and X. Deng
Vehicular Communications 51 (2025) 100864
3
mechanisms, and incentive systems in the absence of trust, thereby
avoiding single points of failure and high management costs in the
central control mode. Another notable feature of blockchain is the
immutability of its data. Under the consensus mechanism, once all
participating nodes reach a consensus on the value and state of the data
stored on the blockchain, the data cannot be changed or deleted,
providing strong guarantees for the security and integrity of the data.
The immutable nature of blockchain and the autonomy of smart contracts
have improved the efficiency of data processing and reduced audit
costs, making it widely used in the processing and auditing of big data in
industries such as the Internet of Things, electronic voting, and healthcare.
In addition, due to the transparency of blockchain information to
all network nodes, there is no need for third-party management, and
once data records are on the chain, they cannot be changed arbitrarily.
These security features make blockchain technology particularly suitable
for designing data sharing solutions.
In terms of security, the current research and application of blockchain
technology in the confidentiality of shared data mainly include
data encryption, access control, identity verification, trusted execution,
and hidden channels [14]. As a distributed ledger, the application of
blockchain in data sharing reduces losses caused by third-party center
management, while ensuring the security of data sharing through
autonomous management of smart contracts. The non forgeability of
blockchain data creates a more secure sharing condition for data
transmission [15–17]. Due to its open and transparent characteristics,
combined with cryptographic design and information security assurance
methods, it is more able to implement selective protection for information
security content to ensure data sharing security under the condition
of distributed Internet. In addition, the incentive mechanism of
blockchain technology innovation has also increased the cost of illegal
attack behavior. Cui et al. [15] developed a blockchain based bidirectional
authentication solution for multiple wireless sensor networks
using the distributed and immutable characteristics of blockchain. The
authentication process for ordinary nodes is performed on a private
blockchain, while authentication for cluster head nodes is completed on
a public blockchain. Xue Tengfei et al. [16] improved the consensus
mechanism of blockchain and applied it in medical data sharing scenarios.
Tanwar et al. [17] proposed a blockchain based electronic
medical record sharing system, in which a new access control strategy
algorithm was proposed to improve data accessibility between healthcare
providers.",,,,,,,
Explain the concept of IoT-based smart buildings as discussed in the article Adoption of Internet of Things in Residential Smart Homes: A Structural Equation Modeling Approach!,"Adoption of internet of things in residential smart homes: A structural 
equation modeling approach
Amir Mohammad Norouzzadeh
a
, Seyed Pendar Toufighi
b , *
, Jan Vang
b , *
,  
Abolfazl Edalatipour
c
a
Department of Civic Engineering, University of Tehran, Tehran, Iran
b
Department of Innovation & Technology, Southern Denmark University, Odense, Denmark
c
Department of Computer Engineering, University of Maryland, Baltimore, USA
ARTICLE INFO
Keywords:
Smart living
Technology acceptance
User intention
Residential automation
Behavioral analysis
ABSTRACT
The Internet of Things (IoT) is transforming modern living environments by enabling automation and connec -
tivity in smart homes. This study explores the behavioral factors influencing IoT adoption in residential smart 
buildings. Using a descriptive-survey method, data were collected from 97 companies involved in the smart home 
sector through structured questionnaires. The research employs Partial Least Squares Structural Equation 
Modeling (PLS-SEM) to analyze the relationships among adoption variables. Findings indicate that performance 
expectancy (perceived usefulness) is the most significant factor driving IoT adoption. Security and privacy risks 
have a notable negative impact, while trust, hedonic motivation, effort expectancy, and social influence 
significantly affect user attitudes. Facilitating conditions and perceived value also contribute to behavioral 
intention. The results highlight the need for IoT developers to prioritize user involvement and robust security 
designs to foster trust. The study offers practical implications for smart home manufacturers, policymakers, and 
urban planners by identifying key adoption drivers in emerging markets. These insights are especially relevant 
for sustainable development and energy-efficient housing strategies.
1. Introduction
The increasing integration of internet technologies into daily life has 
significantly transformed various industries [ 1 ], particula

---

uque, R. Lavanya, S. Ramabalan, Reshaping healthcare supply chain using chain- 
of-things technology and key lessons experienced from COVID-19 pandemic, 
Socioecon. Plann. Sci. 85 (2023) 101510 .
[8] Y. Gamil, A.M. Abdullah, I. Abd Rahman, M.M Asad, Internet of things in 
construction industry revolution 4.0: recent trends and challenges in the Malaysian 
context, J. Eng. Des. Technol. 18 (5) (2020) 1091 – 1102 .
[9] T.T. Okanlawon, L.O. Oyewobi, R.A. Jimoh, Effect of blockchain technology 
adoption on construction supply chain: a structural equation modelling (SEM) 
approach, J. Facil. Manag. (2024) .
[10] Q. Zhao, Y. Wang, X. Jin, Modularity analysis of smart building solutions, in: 
Proceedings of the 2019 Chinese Automation Congress (CAC), 2019, 
pp. 2350 – 2357 .
[11] F.A. Ghansah, W. Lu, Major opportunities of digital twins for smart buildings: a 
scientometric and content analysis, Smart Sustain. Built Environ. 13 (1) (2024) 
63 – 84 .
[12] Y. Jiang, B.W. Ritchie, M.L. Verreynne, Building dynamic capabilities in tourism 
organisations for disaster management: enablers and barriers, J. Sustain. Tour. 31 
(4) (2023) 971 – 996 .
[13] M. Bhatia, S. Kaur, S.K. Sood, IoT-inspired smart home based urine infection 
prediction, J. Ambient. Intell. Humaniz. Comput. 14 (5) (2023) 5249 – 5263 .
[14] A.A. Zaidan, B.B. Zaidan, A review on intelligent process for smart home 
applications based on IoT: coherent taxonomy, motivation, open challenges, and 
recommendations, Artif. Intell. Rev. 53 (1) (2020) 141 – 165 .
[15] B. Saadmohammadi, B. Sajadi, 4E analysis and tri-objective optimization of a novel 
solar 4th cogeneration system for a smart residential building in various climates of 
Iran, Energy Convers. Manage 303 (2024) 118177 .
[16] R. Vadruccio, C. Siragusa, A. Tumino, Increasing energy efficiency in Smart 
Building through Internet of Things retrofitting intervention, Procedia Comput. Sci. 
219 (2023) 263 – 270 .
[17] R. Mathumitha, P. Rathika, K. Manimala, Intell

---

ach for evaluating 
sustainability measurement attributes in the steel industry. The International 
Workshop on Best-Worst Method, Springer International Publishing, Cham, 2021, 
pp. 175 – 193 .
[35] L.Y. Rock, F.P. Tajudeen, Y.W. Chung, Usage and impact of the internet-of-things- 
based smart home technology: a quality-of-life perspective, Univers. Access Inf. 
Soc. 23 (1) (2024) 345 – 364 .
[36] A. Pal, K. Kant, IoT-based sensing and communications infrastructure for the fresh 
food supply chain, Computer 51 (2) (2018) 76 – 80 (Long. Beach. Calif) .
[37] F. Ullah, O. Olatunji, S. Qayyum, A scoping review of green Internet of Things in 
construction and smart cities: current applications, adoption strategies and future 
directions, Smart Sustain. Built Environ. (2024) .
[38] A. Ajitha, G. Akhilesh, T. Rajkumar, S. Radhika, S. Goel, Design and 
implementation of smart home energy management system for Indian residential 
sector, Energy Convers. Manage 307 (2024) 118369 .
[39] Chanda, R.C., Vafaei-Zadeh, A., Hanifah, H., & Ramayah, T. (2024). Modelling eco- 
friendly smart home appliances ’ adoption intention from the perspective of 
residents: a comparative analysis of PLS-SEM and fsQCA. Open House Int., (ahead- 
of-print).
[40] M. Alrawad, A. Lutfi, S. Alyatama, A. Al Khattab, S.S. Alsoboa, M.A. Almaiah, A. 
L. Al-Khasawneh, Assessing customers perception of online shopping risks: a 
structural equation modeling – based multigroup analysis, J. Retail. Consum. Serv. 
71 (2023) 103188 .
[41] D. Nakandala, R. Yang, H. Lau, S. Weerabahu, Industry 4.0 technology capabilities, 
resilience and incremental innovation in Australian manufacturing firms: a serial 
mediation model, Supply Chain Manag. Int. J. (2023) ahead-of-print .
[42] O. Yavuz, M.M. Uner, F. Okumus, O.M. Karatepe, Industry 4.0 technologies, 
sustainable operations practices and their impacts on sustainable performance, 
J. Clean. Prod. (2023) 135951 .
[43] K. Lee, P. Romzi, J. Hanaysha, H. Alzoubi, M. Alshu

---

. [ 28 ] addressed interoperability issues as a 
significant barrier to IoT applications in the construction industry. Liu 
et al. [ 29 ] explored IoT usage in the Australian construction industry, 
noting that resistance to change was a major obstacle to adoption. Kazmi 
and Sodangi [ 30 ] emphasized the need for greater knowledge about IoT 
technology and its potential benefits in their investigation of the barriers 
to IoT adoption in the construction sector.
2.2. Smart building based on IoT
To implement IoT applications, a horizontal and flexible approach is 
used, where a common operational platform manages the network and 
services, utilizing multiple data sources [ 31 ]. The American smart 
building institute defines a smart building as one that optimizes its 
structure, systems, services, and management to provide an efficient and 
productive environment [ 13 , 15 ]. Conversely, the European smart 
building group in Britain states that a smart building maximizes occu -
pant effectiveness while providing optimal resource management with 
minimal hardware and infrastructure costs [ 32–34 ]. According to the 
Singapore department of public utilities, a smart building must have 
advanced automated control systems for monitoring facilities such as 
ventilation, temperature, lighting, security, and fire safety [ 19 ].
In the present era, with the emergence of the concept of smart homes 
and buildings, significant efforts in smartening have been focused on the 
production and development of products, solutions, infrastructures, and 
essential necessities in this field [ 29 ]. The concept of smart homes and 
buildings has led to significant efforts in developing products, solutions, 
infrastructures, and essential necessities in this field [ 29 ]. Previously, 
household processes were mechanized using wired protocols, which, 
despite their advantages, required extensive wiring and changes to the 
building’s electrical system, leading to high costs and complexity [ 2","To implement IoT applications, a horizontal and flexible approach is used, where a common operational platform manages the network and services, utilizing multiple data sources [31]. The American smart building institute defines a smart building as one that optimizes its structure, systems, services, and management to provide an efficient and productive environment [13,15]. Conversely, the European smart building group in Britain states that a smart building maximizes occupant effectiveness while providing optimal resource management with minimal hardware and infrastructure costs [32–34]. According to the Singapore department of public utilities, a smart building must have advanced automated control systems for monitoring facilities such as ventilation, temperature, lighting, security, and fire safety [19].
In the present era, with the emergence of the concept of smart homes and buildings, significant efforts in smartening have been focused on the production and development of products, solutions, infrastructures, and essential necessities in this field [29]. The concept of smart homes and buildings has led to significant efforts in developing products, solutions, infrastructures, and essential necessities in this field [29]. Previously, household processes were mechanized using wired protocols, which, despite their advantages, required extensive wiring and changes to the building’s electrical system, leading to high costs and complexity [26]. However, with advancements in smart automation and technology, it is now possible to implement wireless and secure smart systems, reducing construction costs and preventing destruction [35]. Today, IoT technology enhances the comfort, convenience, cleanliness, savings, order, and smart management of homes [36]. Smart building solutions was illustrated in Fig 1.",,,,,,,
Describe the simulation and results presented in the scientific article Advancing IoMT Security: A Two-Factor Authentication Model Employing PUF and Fuzzy Logic Techniques.,"t 
the scheme designed in this paper is safe and effective.Additionally, a simple simulation implementation of the protocol is 
performed, proving the feasibility of the proposed solution even with low computational overhead. 
© 2025 The Authors. Published by ELSEVIER B.V. 
This is an open access article under the CC BY-NC-ND license (https://creativecommons.org/licenses/by-nc-nd/4.0) 
Peer-review under responsibility of the scientific committee of the Sixth International Conference on Futuristic Trends in 
Networks and Computing Technologies (FTNCT06) 
Keywords: Internet of Things; Elliptic Curve Cryptography; Identity Authentication; Key Negotiation. 
1. Introduction 
The data collected by IoT devices is increasing, and any information leakage could significantly impact individuals 
and society. Consequently, IoT security has become a pressing issue, leading to extensive exploration of identity 
 
* Corresponding author. 
E-mail address: yejun@hainanu.edu.cn   
© 2025 The Authors. Published by Elsevier B.V .
This is an open access article under the CC BY-NC-ND license (https://creativecommons.org/licenses/by-nc-nd/4.0)
Peer-review under responsibility of the scientific committee of the Sixth International Conference on Futuristic Trends in Networks and 
Computing Technologies (FTNCT06)

---

on: The status of neighboring ve-
hicles are assessed by multiple vehicles or RSU nodes to determine
whether they are under attack, utilizing both model-based and data-
driven approaches. These evaluations, which take into account factors
such as abnormal behavior or communication inconsistencies, are se-
curely uploaded to a blockchain, ensuring that the data remains trans-
parent and immutable. The Dempster-Shafer theory is applied by the
cloud center to aggregate the evaluation results from various sources,
allowing a comprehensive global safety score to be generated for each
vehicle based on the severity of detected threats. Trust and accuracy in
vehicular safety assessments are improved by integrating and analyzing
multi-dimensional evaluation results from various vehicles within this
decentralized system.
4. Algorithmic design
In this section, the software design of the simulation framework
and the associated algorithms will be detailed. Additionally, the key
methodologies used in the implementation of these algorithms will be
covered.
4.1. Co-simulation architecture
The security assessment framework introduced in this paper is
designed using a combination of CARLA and OMNeT++, employing
a distributed architecture with three core components: the CARLA
server, the CARLA client, and the OMNeT++ simulator, as shown in
Fig. 2. CARLA functions as a client–server model, where the CARLA
server handles the simulation of vehicle dynamics, onboard sensors
(such as GPS, IMU, and LiDAR), and realistic traffic environments.
The CARLA client is responsible for executing the simulation tasks,
managing vehicle interactions, and processing sensor data in real time.
This setup allows for an accurate emulation of the physical behavior of
vehicles in various driving conditions, enabling the system to analyze
both normal and abnormal driving scenarios.
On the other hand, OMNeT++ is dedicated to simulating the net-
work communication aspect of the framework. It generates attack
tra

---

ScienceDirect
Available online at www.sciencedirect.com
Procedia Computer Science 258 (2025) 3426–3435
1877-0509 © 2025 The Authors. Published by Elsevier B.V .
This is an open access article under the CC BY-NC-ND license ( https://creativecommons.org/licenses/by-nc-nd/4.0 )
Peer-review under responsibility of the scientific committee of the International Conference on Machine Learning and 
Data Engineering
10.1016/j.procs.2025.04.599
 
Available online at www.sciencedirect.com 
ScienceDirect 
Procedia Computer Science 00 (2025) 000–000  
www.elsevier.com/locate/procedia 
 
1877-0509 © 2025 The Authors. Published by ELSEVIER B.V. 
This is an open access article under the CC BY-NC-ND license (https://creativecommons.org/licenses/by-nc-nd/4.0) 
Peer-review under responsibility of the scientific committee of the International Conference on Machine Learning and Data Engineering 
International Conference on Machine Learning and Data Engineering 
Investigation of Security Attacks in IoMT Devices and 
Federated Learning as a Mitigation Strategy 
Kiruthika Ma, T Poongodib,* 
aAssistant Professor, Department of Computational Intelligence, School of Computing, SRM Institute of Science and Technology, Kattankulathur, 
Tamilnadu 603203, India 
bProfessor, Department of Computer Science and Engineering, School of Engineering, Dayananda Sagar University, Bangalore, Karnataka, 
India 
*tpoongodi2730@gmail.com 
Abstract 
Internet of Medical Things (IoMT) is transforming the healthcare business with an increasing number of wearables, gadgets, an d 
sensing devices. As a result, several patients are under daily monitoring for their cardio health, blood glucose level, blood pressure, 
etc. The data generated by these devices are very voluminous, and there is an increasing need for safeguarding these sensitive data 
in order to protect them from malicious attacks. This paper suggests to incorporate Federated learning model to IoMT as a mitigative 
measure. It is apt to induct FL into I

---

Internet of Things 30 (2025) 101469
7
J.S. Yalli et al.
Fig. 2. Final articles screened and selected.
3.3. Screening and selection process
A comprehensive screening process was applied to the articles retrieved during the initial search phase. This process followed a
two-step approach:
1. Title and Abstract Screening: Articles were first screened based on their titles and abstracts to remove less relevant studies
from this SLR. At this stage, studies that did not focus on IoT networks or authentication were excluded.
2. Full-Text Screening: The remaining articles underwent a full-text review to ensure relevance to the specific topic of IoT
authentication schemes. Only articles that addressed IoT security via authentication were retained.
Note that the screening and selection process described above was conducted manually by navigating through the whole article
to see if the title, abstract, authentication proof, and analysis are provided to add or drop the article. This was conducted manually
for almost 100 articles. This multi-step manual screening procedure ensured that only proven authentication works of high-quality
articles were selected for further analysis and comparison.
3.4. Research trend
This subsection shows how research in IoT security is gaining weight. It is shown that significant research on IoT has been
conducted in the last decade. This has motivated us to study, assess, and evaluate the works proposed and find out why the security
issue in IoT persists. The keywords search in Section 3.1 reflects the results in Fig. 3. This has shown an exponential increase, and
the number of IoT publications demonstrates that research in IoT is embraced daily. Some observations drawn are as follows:
1. Exponential growth: The number of publications is increasing yearly and has accelerated significantly throughout 2023. This
exponential rise indicates that IoT technology is fast growing and gaining attention across many industries.
2. IoT Sensor Nodes Advancements","The security of the proposed model IoMT-2FAPF has been formally
analysed using Scyther, an automated tool for verifying security protocols.
In the Scyther tool, the adversary model employed is the Dolev-
Yao model (Rabas et al., 2022; Yang et al., 2016). Consequently, the
adversary has the capability to modify, disrupt, intercept, and retransmit
any messages that are exchanged between any two parties via an insecure
channel. The roles of various entities are defined using send,
receive, and claim events. This tool evaluated the resistance of the
proposed model to attacks at all levels, including IoMT devices, the fog
or cloud layer, and healthcare providers. The proposed model
IoMT-2FAPF has been implemented separately across IoMT devices and
the fog layer, as well as between healthcare providers and the fog layer.
In the simulation’s claim events, the confidentiality of challenges, responses,
secret keys, IDs, and session keys was verified.
In the Scyther results, OK signifies that the specific parameter is
safeguarded from attacks, or that the property is maintained by the
proposed IoMT-2FAPF scheme. The Niagree (Rabas et al., 2022)
(Non-injective Agreement) claim is employed to confirm that IoMT devices,
the Fog layer, and healthcare providers in the proposed
IoMT-2FAPF protocol have achieved consensus on specific CRPs and
shared secret keys.Nisynch (Non-injective Synchronization) is a claim
utilized to confirm that all parties in a security protocol are synchronized
in their actions. It ensures that IoMT devices, the fog layer, and
healthcare providers operate in sync, responding correctly to inputs
from the previous steps in the expected sequence. This type of synchronization
helps prevent replay attacks.The Alive claim checks
whether the IoMT devices, fog layer, and healthcare providers are still
active or not. Fig 13(a) and 13(b) depicts the setting the simulation of
the proposed IoMT-2FAPF model. The result of the simulation shows
that the proposed model is safe from various attacks which is depicted in
Fig. 14 and 15.",,,,,,,
Provide a detailed description of the structure of the proposed scheme in the article A Hash-Based Post-Quantum Ring Signature Scheme for the Internet of Vehicles.,"Journal of Systems Architecture 160 (2025) 103345
6
S. Liu et al.
Table 4
Meaning of parameters in the proposed scheme.
Parameter Description
𝑘 Security parameter
𝑡 Maximum number of elements to accumulate
𝑖 𝑖 ∈ [0, 2ℎ − 1]
ℎ ∈ 𝑁 Height of the tree
𝐻 Hash function, 𝐻 ∶ {0, 1}∗ → {0, 1}𝑚
(𝑠𝑘𝛺, 𝑝𝑘𝛺) A key pair
𝑋 The set of { 𝑥𝑖 ∣ 𝑖 ∈ [0, 2ℎ − 1]}
𝛺 The accumulator
𝑎𝑢𝑥 The auxiliary information
𝑤𝑖𝑡𝑥𝑖
The certificate for 𝑥𝑖
a message sender to demonstrate possession of at least one public
key within a set while concealing the specific public key used, thus
providing anonymity and unlinkability. This feature makes ring sig-
natures particularly valuable in applications centered on privacy and
secure communication. Within ring signatures, Merkle trees can be
employed to organize the hashes of messages or data blocks into a
tree structure, facilitating efficient verification of data integrity and
authenticity. Furthermore, ring signatures can leverage Merkle trees
to obscure the identity of sender by integrating the public key of
signer with those of other members in a ring. Consequently, the signer
can validate ownership of at least one public key in the set without
disclosing the specific key used. Even if an attacker intercepts the
signed message, they would be unable to ascertain the true identity
of the signer.
3.2. Scheme description
This scheme is based on the definition of Merkle tree accumulators
as described in [35], with slight modifications to accommodate the
proposed post-quantum ring signature scheme utilizing hash functions,
specifically designed for vehicular networks. This formalism facilitates
the restatement of the Merkle tree accumulator algorithm within the
current framework. The main parameters of this scheme are given in
Table 4.
Definition 4 (Extend Merkle Tree Accumulator). The Merkle tree accu-
mulator algorithm (Algorithm 1) comprises the following subroutines
(Gen, Eval, WitCreate, Verify), defined as follows:
𝐺 𝑒𝑛(1𝑘, 𝑡): The key generation alg

---

Journal of Systems Architecture 160 (2025) 103345
2
S. Liu et al.
Fig. 1. VANET structure.
hash-based post-quantum ring signature scheme for IoV applications.
The ring signature algorithm of Our scheme is based on the XMSS
algorithm, aiming to enhance data sharing security and efficiency.
Merkle trees are used to organize and verify data efficiently, while ring
signatures ensure the authenticity and integrity of data within the IoV
network without compromising user anonymity.
1.1. Related works
In recent years, hash-based post-quantum digital signature schemes
have garnered significant attention within the cryptography commu-
nity. Following the fourth round of the NIST post-quantum digital
signature standardization process, the SPHINCS+ algorithm was in-
troduced as a supplementary standard, featuring a flexible, tunable
hash function structure [9]. As the standardization process progresses,
researchers have proposed various adaptations, including SPHINCS-a
and SPHINCS+-c, which further compress signature sizes and enhance
execution speeds [10,11]. Additionally, Sun, Liu, and colleagues de-
veloped a domestic signature algorithm based on the post-quantum
hash function SM3 [12]. Hülsing and Kudinov provided a rigorous
security proof for the SPHINCS+ algorithm, confirming its robustness
in a post-quantum environment [13]. The XMSS algorithm forms the
foundation of SPHINCS+, with its architectural design and security
proof presented by Hülsing, Butin, and others [14]. Research on hard-
ware implementations of the XMSS algorithm has also advanced, with
significant contributions from Thoma and Güneysu [15]. Meanwhile,
Sun and Liu investigated the feasibility of replacing the hash function
in XMSS with the domestic SM3 hash function [16]. An essential com-
ponent of XMSS is WOTS+, a one-time signature algorithm; Hülsing
provided its security proof [17], while Zhang, Cui, and colleagues
evaluated the efficiency of WOTS+ in tree-based one-time signature
algorithms [18]. Cu

---

D. Chawla et al.
Table 1
Acronym/Signs and their description.
 Acronym/Signs Explanation Acronym/Signs Explanation  
 IoT Internet of Things UAV Unmanned Aerial Vehicle  
 DoS Denial-of-Service RSA Rivest–Shamir–Adleman  
 ECC Elliptic Curve Cryptography IoV Internet of Vehicles  
 SHA-256 Secure Hash Algorithm-256 QKD Quantum Key Distribution  
 GHZ Greenberger–Horne– Zeilinger state | 𝜓⟩ Wave-Function  
 | 0⟩ Ket-Vector ⟨1| Bra-Vector  
 DLT Distributed Ledger Technology ECDSA Elliptic Curve Digital Signature Algorithm 
 PKI Public Key Infrastructure QB Quantum Blockchain  
1. Given the continuous developments of IoT-enabled applications, we investigated the associated security concerns and 
weaknesses.
2. A detailed discussion of the blockchain concerning IoT by dividing them into four major areas: blockchain building blocks, 
features, technologies and security issues.
3. Thorough analysis of blockchain safety and confidentiality abilities for IoT are also deliberated.
4. A comprehensive exploration of the weaknesses in blockchain security for IoT and Quantum impact on classical cryptographic 
schemes.
5. Examining significant advancements in security protocols for IoT authentication research, addressing the challenges and 
vulnerabilities in their security that need Quantum-resistant solutions.
6. Proposed the Quantum Blockchain architecture for Secure IoT communication framework.
7. A comparative analysis of Quantum Cryptography and Blockchain security primitives and analyzed the Quantum impact on 
such schemes.
1.3. Organization
With their description, certain crucial acronyms and mathematical symbols are explained in Table  1. Section 2 evaluates the 
latest initiatives in Blockchain and Quantum-based IoT. Section 3 discusses the IoT security concerns. Section 4 discusses the in-
detail discussion of Blockchain for IoT. The integration and challenges of integrating Blockchain and IoT are discussed in Section 5. 
Quantum attacks and analysis of authentication

---

[25] HBS 210 – 0.16 0.11
Table 7
Function comparison table of the scheme.
Scheme Post-
quantum
security
Anonymity Traceability Application
to IOV
OURS HBS YES YES YES YES
[33] LBS NO YES YES YES
[32] LBS YES NO NO YES
[25] HBS YES YES YES NO
of Merkle tree as 10, and the number of ring members as 210. Among
them, HBS stands for the scheme based on hash and LBS stands for a
scheme based on lattices.
Comparing the scheme proposed in this paper with the scheme
in [33], it can be seen that the post-quantum ring signature scheme
based on Merkle tree has great advantages. First, in this evaluation, the
number of ring members our scheme can accommodate is 210, which
is much larger than the number of ring members evaluated in [33].
When the road section is wider and crowded, the scheme proposed in
this paper is more suitable. Secondly, this scheme has post-quantum
security, which is more secure; Moreover, although the key generation
time of our scheme is slightly longer than that of the scheme with
fewer ring members in [33], it is much faster in terms of signature time
and verification time, especially the verification time is nearly 44 times
faster than that of [25].","The remainder of this paper is organized as follows: Chapter 2
provides the necessary foundational knowledge, along with a review
of the background and related work relevant to this study. In Chapter
3, we present a post-quantum ring signature algorithm based on Merkle
trees and discuss its application within the IoV environment. Chapter
4 offers a security analysis and proof of the robustness of proposed. In
Chapter 5, we evaluate the performance of the scheme and compare it
with existing alternatives. Finally, Chapter 6 concludes the paper and
outlines directions for future research.",,,,,,,
Explain the attack model described in the scientific article A High-Security Batch Message Authentication Protocol Assisted by Edge Servers in Industrial Internet of Things.,"Internet of Things 30 (2025) 101469
20
J.S. Yalli et al.
Table 6
Formal security analysis of related schemes.
Ref. Proposed model System model Evaluation parameters Experiment Formal method
Computational costCommunication costOverhead
Kumar et al. [22], 2014 LAMP, RAPP, &
Kazahaya
Canetti–krawczykReduced Reduced None NS2 Verified
Pawlowski et al. [136], 2015 EAP - TAPANOM Node Reduced Reduced None MATLAB Verified
Mahmood et al. [137], 2016 Auth AES & RSA Dolev–yao Reduced None None Random or Real To an extent only
Srinivas et al. [27], 2017 Lightweight Auth Canetti–krawczykNone Reduced Reduced BAN logic & AVISPA Verified
Dhillon and Kalra [34], 2017XOR & Hash No Reduced None Reduced AVISPA Verified
Gope et al. [138], 2018 Generation
Algorithm Fe.Gen
& Reconstruction
Dolev–yao Reduced Reduced Reduced Scyther Verified
Fan et al. [139], 2018 Look-up tables
(LUT)
Canetti–krawczykNone None None Not mentioned Not verified
Chen et al. [89], 2018 Auth Protocol Dolev–yao Reduced Reduced None AVISPA, HLPSL, OFMCVerified
Raikar et al. [47], 2020 MQTT Protocol Canetti–krawczykNone None None Scyther Not verified
Wazid et al. [140], 2022 BUAKA Dolev–yao Reduced Reduced Reduced RoR & AVISPA Verified
Chen et al. [141], 2023 FSMFA Dolev–yao None None Reduced BAN logic & Proverif To an extent only
2. Evaluation Criteria: The assessment criteria and indicators to evaluate the security of authentication mechanisms are needed
in a successful model. When comparing authentication methods, usability, scalability, interoperability, attack resistance,
overhead, and compatibility with existing infrastructures are considered [143].
3. Protocol Analysis: A good model should discover any security flaws or weaknesses and examine communication protocols and
message formats used for authentication. Assess the protocol’s ability to withstand common protocol-level attacks such as
Sybil attacks, replay attacks, and message tampering [144].
4. Testing and Validation: It is expected by the model to perf

---

performance of the state-of-the-art actor–critic 
models. Our research clarifies that we can develop a more resilient and responsive IIoT security training model 
by merging real-time components with Markov games and A3C technology. This advancement significantly 
improves real-time monitoring and defense capabilities against large-scale IIoT network attacks, thereby 
strengthening the overall security of IIoT network systems.
1. Introduction
The advent of the digital age has brought with it a significant 
challenge in the security of edge-enabled Industrial Internet of Things 
(IIoT), particularly in light of the rapid proliferation of industrial 
automation and Internet of Things (IoT) technologies [1]. The methods 
of IIoT attacks are becoming increasingly diverse and complex, mak-
ing them challenging for traditional IIoT security defenses to remain 
effective against these novel types of attacks.
Recent statistics highlight the gravity of ineffective defense strate-
gies for IIoT security. According to a 2023 report by Statista, the global 
economic losses caused by IIoT security breaches exceeded $12 billion, 
with edge device hijacking and industrial protocol attacks being the 
primary contributors. These losses often stem from the inability of 
traditional security measures to adapt to evolving attack methods. For 
example, a chemical plant experienced a two-day production halt after 
its edge devices were remotely hijacked, exposing vulnerabilities in 
its outdated defense systems and resulting in an estimated $5 million 
in losses. Similarly, a manufacturing firm faced severe consequences 
∗ Corresponding author.
E-mail addresses: 2021082310@stu.zjhu.edu.cn (W. Zhu), 2021082214@stu.zjhu.edu.cn (X. Liu), 2022082143@stu.zjhu.edu.cn (Y. Liu), 
Y.Shen34@newcastle.ac.uk (Y. Shen), xiao-zhi.gao@uef.fi (X.-Z. Gao), shigens@zjhu.edu.cn (S. Shen).
when its insufficient data validation protocols allowed attackers to 
tamper with critical quality control parameters,

---

Contents lists available at ScienceDirect
Journal of Information Security and Applications
journal homepage: www.elsevier.com/locate/jisa  
RT-A3C: Real-time Asynchronous Advantage Actor–Critic for optimally 
defending malicious attacks in edge-enabled Industrial Internet of Things
Wenyi Zhu a, Xiaolong Liu a, Yimeng Liu a, Yizhou Shen b
 , Xiao-Zhi Gao c, Shigen Shen a
 ,∗
a School of Information Engineering, Huzhou University, Huzhou, China
b School of Computing, Newcastle University, NE1 7RU Newcastle upon Tyne, UK
c School of Computing, University of Eastern Finland, Kuopio 70211, Finland
A R T I C L E  I N F O
Keywords:
Markov game
Asynchronous Advantage Actor–Critic
attack–defense
Policy optimization
Industrial Internet of Thing
 A B S T R A C T
The existing Asynchronous Advantage Actor–Critic (A3C) open-source training model can effectively recom-
mend defense strategies for the edge-enabled Industrial Internet of Things (IIoT) under malware attacks. 
However, it faces challenges in rapidly countering large-scale IIoT network attacks. To address this issue, 
we develop an enhanced algorithm, RT-A3C, by innovatively integrating the A3C model into a real-time 
Markov game framework. This approach involves three key enhancements: incorporating prediction models, 
integrating adversary models, and optimizing state transition and action selection strategies. Such contributions 
collectively enhance the practicality and efficiency of IIoT security simulation training. The core innovation 
lies in converting the traditional turn-based Markov game into a real-time reactive one, showing the potential 
for policy optimization and strategic development in advanced IIoT network security. Through simulations, we 
demonstrate that the proposed RT-A3C algorithm surpasses the performance of the state-of-the-art actor–critic 
models. Our research clarifies that we can develop a more resilient and responsive IIoT security training model 
by merging real-time components with

---

A. Shafee et al.
Finally, the attack model is trained on these outputs to distinguish between responses generated for data included in the training
set and those that were not [32].
Chen et al. [33] investigated MIA within an Industrial Internet of Things (IIoT) EI system, where a collaborative inference
framework is employed. In this setup, layers of a deep learning (DL) model are split between IIoT devices and edge servers. Assuming
access to the edge server and observing its layers, the adversary replicates the IIoT device’s layers using a shadow model to execute
an MIA, identifying whether specific data samples were part of the model’s training data.
Wang et al. [34] examined MIA attacks on EI Service Providers (EISP) offering machine learning services at varying quality
levels. By utilizing publicly available information and APIs, the adversary queries the target model, clusters similar data samples, and
assigns class labels. Shadow models are trained on these clusters, and the attack model leverages their outputs to infer membership
status.
Truex et al. [35] explored MIA risks in cloud-based machine learning-as-a-service (MLaaS) APIs, providing a generalized
framework for black-box attacks and evaluating how different models and datasets influence susceptibility.
Model inversion attack: This attack compromises the privacy of sensitive data by attempting to reconstruct feature vectors used
during the training of machine learning models.
He et al. [36] demonstrated a model inversion attack within an EI system. Their objective was to extract sensitive training data
from a collaborative inference model. They employed two distinct approaches: a white-box method using maximum likelihood
estimation and a black-box strategy where an inverse network, trained on a dataset, learns to deduce input samples from the
network’s outputs.
Gong et al. [37] explored the privacy risks inherent in cloud-based machine learning models offered by providers like Amazon
and Google. Thei","The security model applied in this work is the Dolev–Yao model,
which is a formal attack model used to analyze security protocols in
distributed systems. This model assumes that attackers have powerful
capabilities, including controlling network communications, intercepting,
injecting, tampering with, and replaying messages. It also assumes
that basic cryptographic primitives such as encryption, decryption,
signing, verification, etc. are secure and that no one can crack them.
By this security model, it can be assumed that the KGC is trustworthy.
The server connects to the Internet and communicates with the KGC
by a wired connection. However, the SDs and their wireless channel
face higher attack risks. Attackers can intercept and tamper with data
on the wireless channel between the SDs and the ESs, rendering the
data untrustworthy. Therefore, the connection between the KGC and
the server is considered secure, while the connection between the SDs
and the ESs is weak and potentially insecure.
Taking these factors into account, an ideal bulk message authentication
protocol should support security features such as device anonymity,
mutual identity verification, secure data transmission, and perfect
forward and backward secrecy. In addition, it should be able to defend
against active attacks, including impersonation attacks, replay attacks,
man-in-the-middle attacks, and denial of service (DoS) attacks, as well
as passive attacks such as eavesdropping and location tracking.",,,,,,,
What conclusions are presented in the scientific article A Hybrid Blockchain and Machine Learning Approach for Intrusion Detection System in Industrial Internet of Things?,"A. Roy, D. Bhattacharjee and O. Krejcar / Data in Brief 60 (2025) 111599 9 
CRediT Author Statement 
Aparup Roy: Conceptualization, Data curation, Methodology, Writing – original draft, Visual- 
ization, Investigation, Formal analysis; Debotosh Bhattacharjee: Supervision, Validation, Writing 
–r e v i e w & editing; Ondrej Krejcar: Funding acquisition, Formal analysis, Writing –r e v i e w & 
editing. 
Acknowledgements 
The authors would like to acknowledge the VeReMi dataset creators for making their dataset 
publicly available,which enabled this research. Additionally, we express gratitude to our respec- 
tive institutions for their support and resources.This research did not receive any speciﬁc grant 
from funding agencies in the public, commercial, or not-for-proﬁt sectors. This work was sup- 
ported in part by Long-Term Conceptual Development of Research Organization (2025) at Uni- 
versity of Hradec Kralove, Czech Republic; and in part by Long-Term Conceptual Development of 
Research Organization (2025 ) at Skoda Auto University, Czech Republic. 
Declaration of Competing Interest 
The authors declare that they have no economic interests or personal relationships that could 
have inﬂuenced the work presented in this article. 
References 
[1] L. Yang, A. Moubayed, A. Shami, MTH-IDS: a multi-tiered hybrid intrusion detection system for internet of vehicles, 
IEEE Internet Things J. 8 (6) (2021) 4531–4541, doi: 10.1109/JIOT.2021.3084796 . 
[2] F. Macedo, et al., Intrusion detection system in vehicular network using Deep learning approach, in: Proceedings of 
the 2023 International Conference on Smart Systems and Industrial Technology (ICSSIT), 2023, pp. 1–6, doi: 10.1109/ 
ICSSIT55814.2023.10060872 . 
[3] J.C. Santos, et al., Optimized machine learning-based intrusion detection system for internet of vehicles, in: Proceed- 
ings of the 2023 IEEE Symposium Series on Computational Intelligence (SSCI), 2023, pp. 1–8, doi: 10.1109/SSCI52147. 
2023.10371867 . 
[4] A .

---

Table 1: Subjects of the papers.
Subject Paper Reference
BC
BC-RAN: Cloud radio access network enabled by blockchain for 5G [73]
Blockchain-enabled wireless communications: a new paradigm towards 6G [74]
Distributed Network Slicing Management Using Blockchains in E-Health Environments [75]
Design of a Security and Trust Framework for 5G Multi-domain Scenarios [76]
Data Broker: Dynamic Multi-Hop Routing Protocol in Blockchain Radio Access Network [77]
Future Industry Internet of Things with Zero-trust Security [78]
Blockchain Based Privacy Preserving Framework for Emerging 6G Wireless Communications [79]
Blockchain-based fog radio access networks: Architecture, key technologies, and challenges [80]
Evaluation of soft computing in intrusion detection for secure social Internet of Things based on collaborative edge
computing [81]
Resource Sharing and Trading of Blockchain Radio Access Networks: Architecture and Prototype Design [82]
Radio optical network security analysis with routing in quantum computing for 5G wireless communication using
blockchain machine learning model [83]
Hedera: A Permissionless and Scalable Hybrid Blockchain Consensus Algorithm in Multi-Access Edge Computing for IoT [84]
FH
Securing Ethernet-based optical fronthaul for 5G network [85]
Secure Open Fronthaul Interface for 5G Networks [86]
Transport Security Considerations for the Open-RAN Fronthaul [87]
Open-RAN Fronthaul Transport Security Architecture and Implementation [35]
IDS/IPS
Detecting DoS and DDoS Attacks by Using CuSum Algorithm in 5G Networks [88]
Attacks and failures prediction framework for a collaborative 5G mobile network [89]
The Novel System of Attacks Detection in 5G [90]
An edge based hybrid intrusion detection framework for mobile edge computing [91]
A highly secured IDS for IoT using EXPSO-STF A feature selection for LAANN to detect attacks [92]
RRC
Authentication Protocol for an IoT-Enabled LTE Network [93]
On the Impact of Rogue Base Stations in 4G/LTE Self Organizing Net

---

e work, which clearly provides information on the total number of articles identified, 
the number of inclusions, and exclusions, along with the reasons for each exclusion. The PRISMA flowchart representing the work 
underlying this specialized literature review is presented in Fig.  1. The flowchart presented follows the 3 phases of article selection:
identification, screening, and inclusion.
The part of the work concerning the literature review started with an extensive search on well-known and high-quality academic 
databases, namely ACM Digital Library, IEEE Xplore and Google Scholar. The keywords and criteria used to converge to an initial set 
of papers were: Anomaly Detection AND Federated Learning AND Intrusion Detection System AND Internet of Things.
A total of 4228 articles were collected during the identification phase, of which 3640 articles were removed for being duplicated 
records, eight records were removed because they were whitepapers, and 11 articles were filtered out due to not being written in the 
English language. This search yielded an identification of 569 articles. Subsequently, a screening process was implemented to filter 
and select the most pertinent articles for inclusion in this survey article. In the screening phase, 461 records were removed due to not 
being relevant for the review or having titles and abstracts not necessarily relevant to the particular subject at hands, leaving 104 
articles eligible for a more detailed analysis. In the final part of the screening phase, 88 articles were yet excluded prior to the final 
analysis. These exclusions targeted the articles that failed to address novel implementations of anomaly detection in IoT or lacked 
relevant applications of anomaly detection suitable for integration with FL methodologies. This filtering was humanly conducted or 
performed in a semi-automatic manner with human supervision (in the case of the removal of duplicates). After thorough evaluation 
and assessment, a fina

---

chine Learning
CPU Central Processing Unit MT Mobile Terminal
CSO Chicken Swarm Optimization mURLLC Massive Ultra-Reliable and Low-Latency Communications
dApps Decentralized Applications NIB Network-In-Box
DAD Deep Anomaly Detection PoAh Proof of Authentication
DoS Denial of Service PoC Proof of Collaboration
DDoS Distributed Denial of Services PoK Proof of Knowledge
DL Deep Learning PoS Proof of Stack
DRL Deep Reinforcement Learning PoW Proof of Work
DT Digital Twin P2P Peer-to-Peer
DTWN Digital Twin Wireless Networks PBFT Practical Byzantine Fault-Tolerant
DWSN Dynamic Wireless Sensor Networks RIS Reconfigurable Intelligent Surfaces
FDL Federated Transfer learning RNN Recurrence Neural Network
FL Federated Learning SDA Secure Data Analytics
Geth Go-Ethereum SMPC Secure Multi-Party Computation
GNN Gated Neural Network SQL Structured Query Language
GPU Graphical Processing Unit SYN Synchronize
GRU Gated Recurrent Unit UDP User Datagram Protocol
GUI Graphical User Interface VAE Variational Autoencoder
ICMP Internet Control Message Protocol 6G Sixth Generation
excluded the papers that retained low-quality content. In the next stage,
we filter the papers after reading their abstracts and key contributions.
Lastly, we extract the papers for our survey on technology enablers
(i.e., blockchain, FL, and 6G) for secure big data services.
3. Background and literature review
In this section, we present the technological backgrounds of the
stack of technology enablers and a literature review of related survey
articles. Table 2 shows the summarized list of acronyms used in the
article.
3.1. Background
The definition and fundamental concepts of the technologies such
as the Internet of Things (IoT) and IIoT, big data, blockchain, FL, and
6G used in this survey are presented in this section.
3.1.1. IoT and IIoT
The IoT shifts the communication paradigm, enabling billions of
heterogeneous devices to connect seamlessly and provide real-time
information. The IoT is the fastest-growin","The proposed hybrid IDS utilises machine learning and optimisation techniques to enhance the security of industrial IoT networks using blockchain technology. Incorporating blockchain technology ensures that data is immutable, that trust is created, and that communications among IoT devices are secure. In addition to improving threat detection accuracy, XGBoost minimises false positives in AFSO Optimization. This model outperforms existing models in high detection accuracy (97.43%) using the BOT-IoT dataset. Using blockchains for intrusion detection and security of IIoT environments has been found to be effective in reducing cyber threats and improving security. Developing real-time deployment scenarios and adaptive learning models will enhance IDS resilience when dealing with evolving cyber threats in the future. Future work will analyze the long-term viability of the block
chain ledger in handling high-frequency security events, focusing",,,,,,,
Explain the results and discussion presented in the scientific article A Hybrid Blockchain and AI-Based Approach for Attack Protection to Secure Internet of Medical Things Networks,"S. Javanmardi et al.
the articles based on the recent fog computing research about security 
challenges, service and operational issues, and resource management. 
Hazra et al. [21] discussed the applications, assessment metrics, RMSs, 
IoT-Fog architecture and its advancement. Moreover, they looked at 
many issues and possible research directions. Article [22] presented 
a survey for security and privacy defense mechanisms for the Fog 
layer using SDN in IoT-Fog networks. The focus is on the security 
and privacy of the Fog layer, but efficiency is overlooked. Aouedi 
et al. [23] presented a all-around survey of Industrial Internet of Things 
(IIoT), examining its influential applications in mobile networks and 
associated security and privacy matters. This article focuses on the 
convergence of IoT and AI by broadly studying security and privacy 
in several IIoT applications. Sun et al. [24] discussed the network 
security risks IoT devices face, their impacts, and risk assessment 
methods. The authors examined the progress of security research on 
common IoT protocols and presented an IoT architecture for intelligent 
information processing. Moreover, they reviewed the legal status of 
privacy protection in different countries and discussed the future of IoT. 
Yadav et al. [25] surveyed energy-efficient routing protocols for IoT 
networks. They discussed the impact of different network characteris-
tics on protocol performance and provided a comprehensive overview 
for researchers. Their focus is on energy-efficient routing protocols, 
QoS, and secure RPL. To discuss another article, Rezaee et al. [26] 
discussed task offloading and resource management algorithms in Fog-
enabled IoT and SDN-based IoT-Fog networks. They focus on several 
IoT applications and discuss the methods in different applications. A 
recent survey by Sun et al. [27] provides an overview of privacy and 
security in IoT systems. It covers all IoT layers, explains common at-
tacks, and reviews

---

Internet of Things 30 (2025) 101469
7
J.S. Yalli et al.
Fig. 2. Final articles screened and selected.
3.3. Screening and selection process
A comprehensive screening process was applied to the articles retrieved during the initial search phase. This process followed a
two-step approach:
1. Title and Abstract Screening: Articles were first screened based on their titles and abstracts to remove less relevant studies
from this SLR. At this stage, studies that did not focus on IoT networks or authentication were excluded.
2. Full-Text Screening: The remaining articles underwent a full-text review to ensure relevance to the specific topic of IoT
authentication schemes. Only articles that addressed IoT security via authentication were retained.
Note that the screening and selection process described above was conducted manually by navigating through the whole article
to see if the title, abstract, authentication proof, and analysis are provided to add or drop the article. This was conducted manually
for almost 100 articles. This multi-step manual screening procedure ensured that only proven authentication works of high-quality
articles were selected for further analysis and comparison.
3.4. Research trend
This subsection shows how research in IoT security is gaining weight. It is shown that significant research on IoT has been
conducted in the last decade. This has motivated us to study, assess, and evaluate the works proposed and find out why the security
issue in IoT persists. The keywords search in Section 3.1 reflects the results in Fig. 3. This has shown an exponential increase, and
the number of IoT publications demonstrates that research in IoT is embraced daily. Some observations drawn are as follows:
1. Exponential growth: The number of publications is increasing yearly and has accelerated significantly throughout 2023. This
exponential rise indicates that IoT technology is fast growing and gaining attention across many industries.
2. IoT Sensor Nodes Advancements

---

iting – review & editing, Supervision, Funding acqui-
sition. Xiaolong Liu: Writing – review & editing, Supervision, Investi-
gation, Funding acquisition.
Declaration of competing interest
The authors declare that they have no known competing finan-
cial interests or personal relationships that could have appeared to
influence the work reported in this paper.
Acknowledgments
This work was supported in part by fund of scientific and techno-
logical innovation of Fujian agriculture and Forestry University (Grant
No. KFb22091XA), Project of Industry-university-institute Cooperation
in Colleges and Universities in Fujian Province (Grant No. 2022H6006,
2024H6007) and the Project of Software Technology Innovation Re-
search and Industrialization in Fujian Province (Grant No. 2024.488).
Data availability
Data will be made available on request.
References
[1] Number of Internet of Things (IoT) connected devices worldwide from 2019
to 2021, with forecasts from 2022 to 2030, 2018, https://www.statista.com/
statistics/1183457/iot-connected-devices-worldwide/ .
[2] Xu Yang, Xuechao Yang, Xun Yi, Ibrahim Khalil, Xiaotong Zhou, Debiao He, Xinyi
Huang, Surya Nepal, Blockchain-based secure and lightweight authentication for
Internet of Things, IEEE Internet Things J. 9 (5) (2021) 3321–3332.
[3] Soumyashree S. Panda, Debasish Jena, Bhabendu Kumar Mohanta, Somula
Ramasubbareddy, Mahmoud Daneshmand, Amir H. Gandomi, Authentication and
key management in distributed iot using blockchain technology, IEEE Internet
Things J. 8 (16) (2021) 12947–12954.
[4] Zesen Hou, Jianting Ning, Xinyi Huang, Shengmin Xu, Leo Yu Zhang, Blockchain-
based efficient verifiable outsourced attribute-based encryption in cloud, Comput.
Stand. Interfaces (2024) 103854.
[5] Ya-Nan Cao, Yujue Wang, Yong Ding, Zhenwei Guo, Qianhong Wu, Hai Liang,
Blockchain-empowered security and privacy protection technologies for smart
grid, Comput. Stand. Interfaces 85 (2023) 103708.
[6] Noureddine Chikouche, Pierre-Louis Cayrel,

---

Table 1: Subjects of the papers.
Subject Paper Reference
BC
BC-RAN: Cloud radio access network enabled by blockchain for 5G [73]
Blockchain-enabled wireless communications: a new paradigm towards 6G [74]
Distributed Network Slicing Management Using Blockchains in E-Health Environments [75]
Design of a Security and Trust Framework for 5G Multi-domain Scenarios [76]
Data Broker: Dynamic Multi-Hop Routing Protocol in Blockchain Radio Access Network [77]
Future Industry Internet of Things with Zero-trust Security [78]
Blockchain Based Privacy Preserving Framework for Emerging 6G Wireless Communications [79]
Blockchain-based fog radio access networks: Architecture, key technologies, and challenges [80]
Evaluation of soft computing in intrusion detection for secure social Internet of Things based on collaborative edge
computing [81]
Resource Sharing and Trading of Blockchain Radio Access Networks: Architecture and Prototype Design [82]
Radio optical network security analysis with routing in quantum computing for 5G wireless communication using
blockchain machine learning model [83]
Hedera: A Permissionless and Scalable Hybrid Blockchain Consensus Algorithm in Multi-Access Edge Computing for IoT [84]
FH
Securing Ethernet-based optical fronthaul for 5G network [85]
Secure Open Fronthaul Interface for 5G Networks [86]
Transport Security Considerations for the Open-RAN Fronthaul [87]
Open-RAN Fronthaul Transport Security Architecture and Implementation [35]
IDS/IPS
Detecting DoS and DDoS Attacks by Using CuSum Algorithm in 5G Networks [88]
Attacks and failures prediction framework for a collaborative 5G mobile network [89]
The Novel System of Attacks Detection in 5G [90]
An edge based hybrid intrusion detection framework for mobile edge computing [91]
A highly secured IDS for IoT using EXPSO-STF A feature selection for LAANN to detect attacks [92]
RRC
Authentication Protocol for an IoT-Enabled LTE Network [93]
On the Impact of Rogue Base Stations in 4G/LTE Self Organizing Net","The framework should account for resilience against distributed
denial-of-service (DDoS) attacks, which can severely disrupt IoMT networks
by overwhelming devices or communication channels. Mitigation
strategies may include traffic filtering, rate limiting, and decentralized
network architectures that reduce reliance on single nodes. Additionally,
integrating anomaly detection to identify and respond to unusual
traffic patterns in real time can help contain potential DDoS threats and
maintain service availability. In the healthcare sector, blockchain-based
solutions improve the quality of data, improve service delivery, and
ensure that data remains continuous. Fig. 3 illustrates how internetbased
technology can improve patient outcomes through more accurate
treatment, faster medical treatments, and more practical treatment
methods.
As part of the blockchain framework, cloud servers and personal
servers could exchange data securely. As part of the blockchain framework,
cloud servers and personal servers could exchange data securely.
According to Fig. 4, the response latency ratio is more beneficial than
cloud storage and network communication, as well as real-time data
interpretation.
Using Fig. 5, we can see that the response time ratio is as follows.
Efficacy evaluation is essential to maximizing the value of resources.
Optimal health outcomes can be achieved by analyzing how resources
are made available within and across healthcare systems. To improve
well-being, healthcare services can be considered intermediate commodities
when measuring their efficiency.
By evaluating and recording the results, best practices are encouraged
and strengthened. A physician’s treatment must be respected and
redefined through the interpretation of results; Fig. 6 illustrates this
concept.
Organizations can use these logs for auditing, identifying areas of
concern and improving security measures, where possible. According to
Fig. 7, businesses can determine accurate entry points, determine the
cause, and assess the harm of an incident by using audit trails.",,,,,,,
Provide a detailed explanation of the research motivation discussed in the article A Hybrid PKI and Spiking Neural Network Approach for Enhancing Security and Energy Efficiency in IoMT-Based Healthcare 5.0,"S. Javanmardi et al.
the articles based on the recent fog computing research about security 
challenges, service and operational issues, and resource management. 
Hazra et al. [21] discussed the applications, assessment metrics, RMSs, 
IoT-Fog architecture and its advancement. Moreover, they looked at 
many issues and possible research directions. Article [22] presented 
a survey for security and privacy defense mechanisms for the Fog 
layer using SDN in IoT-Fog networks. The focus is on the security 
and privacy of the Fog layer, but efficiency is overlooked. Aouedi 
et al. [23] presented a all-around survey of Industrial Internet of Things 
(IIoT), examining its influential applications in mobile networks and 
associated security and privacy matters. This article focuses on the 
convergence of IoT and AI by broadly studying security and privacy 
in several IIoT applications. Sun et al. [24] discussed the network 
security risks IoT devices face, their impacts, and risk assessment 
methods. The authors examined the progress of security research on 
common IoT protocols and presented an IoT architecture for intelligent 
information processing. Moreover, they reviewed the legal status of 
privacy protection in different countries and discussed the future of IoT. 
Yadav et al. [25] surveyed energy-efficient routing protocols for IoT 
networks. They discussed the impact of different network characteris-
tics on protocol performance and provided a comprehensive overview 
for researchers. Their focus is on energy-efficient routing protocols, 
QoS, and secure RPL. To discuss another article, Rezaee et al. [26] 
discussed task offloading and resource management algorithms in Fog-
enabled IoT and SDN-based IoT-Fog networks. They focus on several 
IoT applications and discuss the methods in different applications. A 
recent survey by Sun et al. [27] provides an overview of privacy and 
security in IoT systems. It covers all IoT layers, explains common at-
tacks, and reviews

---

etto 
PaBPIF, CUP J53D2301493, project id. P20227W8ZC
Data availability
No data was used for the research described in the article.
References
[1] S.A. Latif, F.B.X. Wen, C. Iwendi, F.W. Li-Li, S.M. Mohsin, Z. Han, S.S. Band, AI-
empowered, blockchain and SDN integrated security architecture for IoT network 
of cyber physical systems, Comput. Commun. 181 (2022) 274–283.
[2] A.M. Yadav, S. Sharma, Cooperative task scheduling secured with blockchain in 
sustainable mobile edge computing, Sustain. Comput.: Inform. Syst. 37 (2023) 
100843.
[3] S. Javanmardi, M. Ghahramani, M. Shojafar, M. Alazab, A.M. Caruso, M-RL: A 
mobility and impersonation-aware IDS for DDoS UDP flooding attacks in IoT-Fog 
networks, Comput. Secur. (2024) 103778.
[4] S. Javanmardi, M. Shojafar, R. Mohammadi, A. Nazari, V. Persico, A. Pescapè, 
FUPE: A security driven task scheduling approach for SDN-based IoT–Fog 
networks, J. Inf. Secur. Appl. 60 (2021) 102853.
[5] S. Javanmardi, M. Shojafar, R. Mohammadi, V. Persico, A. Pescapè, S-FoS: A 
secure workflow scheduling approach for performance optimization in SDN-based 
IoT-Fog networks, J. Inf. Secur. Appl. 72 (2023) 103404.
[6] A. Rahman, M.J. Islam, A. Montieri, M.K. Nasir, M.M. Reza, S.S. Band, A. 
Pescape, M. Hasan, M. Sookhak, A. Mosavi, Smartblock-sdn: An optimized 
blockchain-sdn framework for resource management in iot, IEEE Access 9 (2021) 
28361–28376.
[7] S. Singh, A.S. Nandan, G. Sikka, A. Malik, A. Vidyarthi, A secure energy-efficient 
routing protocol for disease data transmission using IoMT, Comput. Electr. Eng. 
101 (2022) 108113.
[8] C. Li, Y. Liu, J. Xiao, J. Zhou, MCEAACO-QSRP: A novel QoS-secure routing 
protocol for industrial internet of things, IEEE Internet Things J. 9 (19) (2022) 
18760–18777.
[9] A. Lakhan, M.A. Mohammed, K.H. Abdulkareem, M. Deveci, H.A. Marhoon, J. 
Nedoma, R. Martinek, A multi-objectives framework for secure blockchain in 
fog-cloud network of vehicle-to-infrastructure applications, Knowl.-Based Syst. 
(

---

ence the work reported in this paper.
Acknowledgments
This work was supported by Hubei Province Key Research and De-
velopment Program [grant number 2023BAB022]; and Hubei Province 
International Science and Technology Collaboration Program [grant 
number 2024EHA048].
Data availability
The datasets generated during and/or analyzed during the cur-
rent study are available from the corresponding author on reasonable 
request.
References
[1] B. Ji, X. Zhang, S. Mumtaz, C. Han, C. Li, H. Wen, D. Wang, Survey on the 
internet of vehicles: Network architectures and applications, IEEE Commun. 
Stand. Mag. 4 (1) (2020) 34–41.
[2] A. Hbaieb, S. Ayed, L. Chaari, A survey of trust management in the internet of 
vehicles, Comput. Netw. 203 (2022) 108558.
[3] E. Alalwany, I. Mahgoub, Security and trust management in the internet of 
vehicles (IoV): Challenges and machine learning solutions, Sensors 24 (2) (2024) 
368.
[4] A. Feraudo, N. Romandini, C. Mazzocca, R. Montanari, P. Bellavista, DIVA: 
A DID-based reputation system for secure transmission in vanets using IOTA, 
Comput. Netw. (2024) 110332.
[5] S.A. Siddiqui, A. Mahmood, Q.Z. Sheng, H. Suzuki, W. Ni, Trust in vehicles: 
toward context-aware trust and attack resistance for the internet of vehicles, 
IEEE Trans. Intell. Transp. Syst. 24 (9) (2023) 9546–9560.
[6] X. Yao, X. Zhang, H. Ning, P. Li, Using trust model to ensure reliable data 
acquisition in VANETs, Ad Hoc Networks 55 (2017) 107–118.
[7] L. Zhang, Y. Zou, W. Wang, Z. Jin, Y. Su, H. Chen, Resource allocation and trust 
computing for blockchain-enabled edge computing system, Comput. Secur. 105 
(2021) 102249.
[8] M.M. Hasan, M. Jahan, S. Kabir, A trust model for edge-driven vehicular ad 
hoc networks using fuzzy logic, IEEE Trans. Intell. Transp. Syst. 24 (2023) 
14037–14050.
[9] D. Jegatheesan, C. Arumugam, Siov-FTFSA-CAOA: a fuzzy trust-based approach 
for enhancing security and energy efficiency in social internet of vehicles, Wirel. 
Netw. 30 (2024) 1–20.
Com

---

ng-Based Security Solutions in 
Healthcare 
An in depth analysis of implementing Healthcare Security Solutions through 
Machine Learning. 
Barua et al. [6] Exploring Security and Privacy Threats in Bluetooth Low Energy for 
IoT and Wearable Devices: An In-Depth Survey 
Security Threats, Classiﬁcation, and Remedial Approaches for 
Bluetooth-Based Attacks. 
Gaurav et al. [22] An In-Depth Review of Machine Learning Approaches for Detecting 
Malware in IoT-Centric Enterprise Information Systems 
Utilizing Machine Learning for Malware Detection in IoT Networks: A 
Comprehensive Overview. 
This Paper Engaged in a Detailed Discussion on IoT Taxonomy, Impacts, and 
Countermeasures; Presented an Overview of Various IoT 
Applications; 
Oﬀered an Overview and Comparative Analysis of IoT and IoE Networks; 
Conducted an In-Depth Examination of authentication, access control and 
scalability issues in IoT security. 
3. Security in IoT 
The signiﬁcant impact of the IoT on daily life has spurred extensive 
research eﬀorts aimed at enhancing its beneﬁts for humanity. Numer- 
ous researchers have undertaken surveys to elucidate the intricacies of 
the IoT ecosystem. While some studies have focused on providing an 
overview of the challenges confronting IoT, others have delved into the 
realm of security threats. 
Several works, including [4–8] , have reviewed security threats in 
IoT, addressing various types of attacks. For instance, [6] speciﬁcally 
highlighted security vulnerabilities in Bluetooth, shedding light on po- 
tential attacks leveraging these vulnerabilities within the IoT context. 
The challenges posed by IoT have been explored by researchers in works 
such as [ 4 , 9 ]. Additionally, [10] presented security guidelines, and the 
impact of 5 G on IoT systems. 
The architectural aspects of IoT, including its layers, were the focal 
point of [11] , while diﬀerent protocols were discussed in various works 
like [12–14] . Diverse applications of IoT, exempliﬁed by [8] , emp","In the healthcare 5.0 era, IoMT is revolutionizing patient care by achieving seamless connectivity and real-time access to data. Still, significant issues remain in terms of secure energy-efficient data transmission. Protecting health information from unauthorized access to patient data and efficient utilization of energy in resource-constrained settings is very important. The requirements and actual motivation for this work relate to the meeting of the above two challenges jointly through the design of an effective framework that will rely on PKI for secure communication, spike neural networks for precise anomaly detection, and ZOA for energy optimization. Such a comprehensive approach will make privacy stronger, network life longer, and healthcare IoMT systems operate in a reliable and effective way.",,,,,,,
Explain the neural network data used in the scientific article Towards an Intelligent and Automatic Irrigation System Based on Internet of Things with Authentication Feature in VANET.,"The Internet of Things is a dynamic global information network 
composed of internet-connected devices [ 4 ]. Thanks to recent advances 
in communications systems and wireless technology over the past 
decade, the Internet of Things has become a dynamic area of research 
[ 5 ]. The concept is simple. A thing or object connected to the internet 
and exchanging data or information with each other over the network. 
At the same time, as human life becomes more and more digital, human 
beings begin to enter the age of intelligence. The application of the 
Internet of things not only improves the quality of life, but also means 
that with intelligent devices and their related applications, people can 
control every object and obtain diversified information through the 
Internet in their daily life [ 6–7 ] [ 8 ]. The Internet of Things technology 
can monitor the growth environment and disease situation of wheat in 
real time through a sensor network deployed in the field. By combining 
artificial intelligence technology, especially image recognition methods, 
it is possible to achieve rapid processing and recognition of wheat dis -
ease images, thereby promptly identifying problems and taking mea -
sures. Artificial intelligence image recognition methods, such as 
convolutional neural network models, can accurately extract features of 
disease images and obtain high-resolution semantic features through 
feature fusion. This enables the system to more accurately identify 
wheat diseases, reducing false positives and false negatives.
In this paper, an image recognition method of wheat fusarium based 
on Internet of Things and artificial intelligence is proposed. Wheat 
fusarium is yield and quality of wheat. The diagnosis and recognition of 
wheat fusarium is an important research direction in precision agricul -
ture. The research on image recognition of wheat fusarium not only 
plays an important role in promoting the development, high quality and 
high efficiency of whe

---

ep of computer image automatic recognition 
method based on Internet of Things information is the image recogni -
tion. Image recognition is realized by multi-source sensors and computer 
network system. In general, it uses computer computing ability to collect 
the image information of different formats, so it has the data with spatial 
characteristics. The formula is as follows: 
̂x
i
=
x
i
","Advancements in sensor technology and the widespread adoption of
smart solutions across various domains, including environmental, industrial,
and medical sectors, have created numerous opportunities for
innovative applications [22,23]. Applications simultaneously are
becoming more complex; thus, the end-user needs a platform that carries
these applications to support mobility and flexibility to act more adaptively
to new requirements. Also, when designing the system, it must be
taken wider than what was before. Typically, applications based on
WSNs, broadcast, monitoring systems, IoT, and peer-to-peer relay we
can rely on including cloud services. Time and location are the most
stringent restrictions for these systems and services. Thus, the situation
is more stringent in terms of multimedia data transmission, and to
overcome network problems special processing and protocols are used
for multimedia applications (broadcast, telephone, etc.) [24,25].
Because of the flow of data packets in the network, the Quality of Services
(QoS) must be considered, such as delay, data loss rate, and costs,
to maintain the quality of data transmission. Therefore, routing is a
crucial factor that has a significant impact on packet switching in
network performance.
Since of the constraints governing the process of exchanging packets
on the network, routing algorithms should provide the most appropriate
path (optimum) for the network according to the traffic volume and QoS
conditions. Therefore, arithmetic operations must be performed when
the transmission command is received between the network’s routers.
Neural networks are at the forefront of these operations because they
perform enormous operations to manage the situation in conjunction
with the rest of the transmission process procedures. This study investigates
using the neural network, which is fully compatible with the
multi-routing of Internet networks.",,,,,,,
List the authors of the scientific article A Machine Learning Approach for Detecting Cybersecurity Vulnerabilities in the Internet of Medical Things,"CRediT authorship contribution statement
Sundaravadivazhagan Balasubramanian: Writing – original draft. 
Robin Cyriac: Supervision. Saleem Raja Abdul Samad: Supervision. 
R. Karthikeyan: Supervision. V. Balamurugan: Supervision.
Declaration of competing interest
The authors declare that they have no known competing financial 
interests or personal relationships that could have appeared to influence 
the work reported in this paper
Data availability
No data was used for the research described in the article.
References
[1] E.C. Balta, M. Pease, J. Moyne, K. Barton, D.M. Tilbury, Digital twin-based cyber- 
attack detection framework for cyber-physical manufacturing systems, IEEE Trans. 
Autom. Sci. Eng. (2023) .
[2] K. Bitirgen, Ü.B. Filik, A hybrid deep learning model for discrimination of physical 
disturbance and cyber-attack detection in smart grid, Int. J. Crit. Infrastruct. Prot. 
40 (2023) 100582 .
[3] H. Shafei, L. Li, R.P. Aguilera, A comprehensive review on Cyber-attack detection 
and control of microgrid systems, Power Systems Cybersecurity: Methods, 
Concepts, and Best Practices (2023) 1–45 .
[4] R. Sun, Q. Luo, Y. Chen, Online transportation network cyber-attack detection 
based on stationary sensor data, Transp. Res. Part C: Emerg. Technol.s 149 (2023) 
104058 .
[5] M.N.K. Sikder, M.B. Nguyen, E.D. Elliott, F.A. Batarseh, Deep H2O: cyber attacks 
detection in water distribution systems using deep learning, J. Water Process. Eng. 
52 (2023) 103568 .
[6] Y. Alaca, Y. Çelik, Cyber attack detection with QR code images using lightweight 
deep learning models, Comput. Secur. 126 (2023) 103065 .
[7] A. Abirami, S. Palanikumar, BBBC-DDRL: a hybrid big-bang big-crunch 
optimization and deliberated deep reinforced learning mechanisms for cyber- 
attack detection, Comput. Electr. Eng. 109 (2023) 108773 .
[8] M. Al-Hawawreh, M.S. Hossain, A privacy-aware framework for detecting cyber 
attacks on internet of medical things systems using data fusion and quantum deep

---

ScienceDirect
Available online at www.sciencedirect.com
Procedia Computer Science 258 (2025) 3426–3435
1877-0509 © 2025 The Authors. Published by Elsevier B.V .
This is an open access article under the CC BY-NC-ND license ( https://creativecommons.org/licenses/by-nc-nd/4.0 )
Peer-review under responsibility of the scientific committee of the International Conference on Machine Learning and 
Data Engineering
10.1016/j.procs.2025.04.599
 
Available online at www.sciencedirect.com 
ScienceDirect 
Procedia Computer Science 00 (2025) 000–000  
www.elsevier.com/locate/procedia 
 
1877-0509 © 2025 The Authors. Published by ELSEVIER B.V. 
This is an open access article under the CC BY-NC-ND license (https://creativecommons.org/licenses/by-nc-nd/4.0) 
Peer-review under responsibility of the scientific committee of the International Conference on Machine Learning and Data Engineering 
International Conference on Machine Learning and Data Engineering 
Investigation of Security Attacks in IoMT Devices and 
Federated Learning as a Mitigation Strategy 
Kiruthika Ma, T Poongodib,* 
aAssistant Professor, Department of Computational Intelligence, School of Computing, SRM Institute of Science and Technology, Kattankulathur, 
Tamilnadu 603203, India 
bProfessor, Department of Computer Science and Engineering, School of Engineering, Dayananda Sagar University, Bangalore, Karnataka, 
India 
*tpoongodi2730@gmail.com 
Abstract 
Internet of Medical Things (IoMT) is transforming the healthcare business with an increasing number of wearables, gadgets, an d 
sensing devices. As a result, several patients are under daily monitoring for their cardio health, blood glucose level, blood pressure, 
etc. The data generated by these devices are very voluminous, and there is an increasing need for safeguarding these sensitive data 
in order to protect them from malicious attacks. This paper suggests to incorporate Federated learning model to IoMT as a mitigative 
measure. It is apt to induct FL into I

---

S. Solera-Cotanilla et al.
Declaration of competing interest
The authors declare that they have no known competing financial interests or personal relationships that could have appeared 
to influence the work reported in this paper.
Acknowledgements
The authors would like to thank the RAYUELA project (contract no. 882828) of the Horizon 2020 programme of the European 
Union for motivating this work. The content of the article reflects the views only of the authors. The European Commission is not 
responsible for any use that may be made of the information contained therein.
Data availability
No data was used for the research described in the article.
References
[1] M. Weiser, The computer of the 21st century, SIGMOBILE Mob. Comput. Commun. Rev. 265 (3) (1991) 66–75.
[2] K. Ashton, That internet of things thing: In the real world things matter more than ideas, RFID J. (2009).
[3] A. AlHogail, Improving IoT technology adoption through improving consumer trust, Technologies 6 (34) (2018).
[4] M.M. Alam, et al., A survey on the roles of communication technologies in IoT-based personalized healthcare applications, IEEE Access 6 (2018) 
36611–36631.
[5] Y. Lu, Industry 4.0: A survey on technologies, applications and open research issues, J. Ind. Inf. Integr. 6 (2017) 1–10.
[6] F. Alam, R. Mehmood, I. Katib, N.N. Albogami, A. Albeshri, Data fusion and IoT for smart ubiquitous environments: A survey, IEEE Access 5 (2017) 
9533–9554.
[7] S.H. Shah, I. Yaqoob, A survey: Internet of things (IOT) technologies, applications and challenges, in: 2016 IEEE Smart Energy Grid Engineering, SEGE, 
2016, pp. 381–385.
[8] S.T. Ambujam, B. Mallala, P. Aggarwal, P.V. Prasad, Enhanced IoT-enabled community microgrid energy management with hybrid COA-HQNN approach 
with battery degradation consideration, J. Energy Storage (2025).
[9] G. Senthilkumar, B. Mallala, S. Sivarajan, C. Harish, D. Harsha, L. Natrayan, Maximizing power utilization through machine learning and IoT based power 
flow st

---

Retraction notice
Retraction notice to ""Advanced machine learning approach for 
DoS attack resilience in internet of vehicles security"" [Heliyon 10 
(2024) e28844]
Nadeem Ahmed
a , *
, Fayaz Hassan
a
, Khursheed Aurangzeb
b
, Arif Hussain Magsi
c
, 
Musaed Alhussein
b
a
School of Electronic Science, Beijing University of Posts and Telecommunications, Beijing, 10086, China
b
Department of Computer Engineering, College of Computer and Information Sciences, King Saud University, P. O. Box 51178, Riyadh, 11543, 
Saudi Arabia
c
State Key Laboratory of Networking and Switching Technology, Beijing University of Posts and Telecommunications, Beijing, 10086, China
This article has been retracted: please see Elsevier policy on article withdrawal ( https://www.elsevier.com/about/policies-and- 
standards/article-withdrawal ).
Post-publication, an investigation conducted by Elsevier ’ s Research Integrity & Publishing Ethics team on behalf of the journal 
identified references that are irrelevant to the article. The authors were asked to comment upon the presence of these references in 
their work but were unable to satisfactorily address the reason for the references. Consequently, the editor no longer has confidence in 
the integrity and the findings of the article and has decided to retract it. The scientific community takes a very strong view on this 
matter and apologies are offered to readers of the journal that this was not detected during the submission process.
The authors disagree with the retraction and dispute the grounds for it.
DOI of original article: https://doi.org/10.1016/j.heliyon.2024.e28844 .
* Corresponding author.
Contents lists available at ScienceDirect
Heliyon
journal homepag e: www.cell.co m/heliyon
https://doi.org/10.1016/j.heliyon.2025.e44362
Heliyon xxx (xxxx) xxx 
2405-8440/© 2025 The Author(s). Published by Elsevier Ltd. All rights are reserved, including those for text and data mining, AI training, and 
similar technologies. 
Please cite this art","Ukamaka Oragwu, Benjamin Aziz ∗, Shahadate Rezvy",,,,,,,
What framework is proposed in the scientific article A New Design of Arithmetic and Logic Unit for Enhancing the Security of Future Internet of Things Devices Using Quantum-Dot Technology?,"y. The primary goal of this paper is to 
propose a Novel Quantum Blockchain framework that protects from classical and Quantum 
computing attacks. For this purpose, this article examines Quantum cryptography for securing 
an IoT communication framework. Then, we analyze Blockchain and Quantum integration 
with IoT, including security primitives, recent tools, technologies, problems and solutions. 
The comparative analysis of classical and Blockchain cryptographic primitives with Quantum-
resistant schemes is analyzed in our work. Our research outlines future avenues for exploration 
aimed at establishing Quantum Blockchain security to ensure secure communication within an 
IoT-enabled framework.
1. Introduction
The Internet of Things (IoT) has emerged as a pivotal technology in intelligent transportation, environmental analysis, wearables, 
and industry, profoundly influencing daily life [1]. Despite its widespread adoption, the proliferation of IoT has introduced 
significant security challenges. IoT devices, often in remote locations, generate vulnerable data susceptible to alterations, leading 
to concerns such as misinformation, inconsistency, and various privacy and security threats. Numerous connected devices are 
vulnerable to attacks within the IoT framework, such as eavesdropping and DoS attacks. The secure and trustworthy transmission 
∗ Correspondence to: Department of Computer Science and Engineering, Delhi Technological University, New Delhi, India
E-mail addresses: pawansingh@dtu.ac.in, pawansinghmehra@gmail.com (P.S. Mehra).
1 Senior Member, IEEE; Member ACM
https://doi.org/10.1016/j.compeleceng.2025.110524
Received 1 February 2025; Received in revised form 5 April 2025; Accepted 6 June 2025
Computers and Electrical Engineering 126 (2025) 110524 
Available online 25 June 2025 
0045-7906/© 2025 Elsevier Ltd. All rights are reserved, including those for text and data mining, AI training, and similar technologies.

---

Contents lists available at ScienceDirect
Computers and Electrical Engineering
journal homepage: www.elsevier.com/locate/compeleceng  
Quantum Blockchain for Internet of Things: A systematic review, 
proposed solutions and challenges
Diksha Chawla a, Saru Kumari b
 , Rajkumar Singh Rathore c
 ,
Pawan Singh Mehra d
 ,1,∗, Ashok Kumar Das e, Neeraj Kumar f
a Department of CSE and IT , Jaypee Institute of Information Technology, Noida, India
b Department of Mathematics , Chaudhary Charan Singh University, Meerut, India
c Cardiff School of Technologies , Cardiff Metropolitan University, Cardiff, United  Kingdom
d Department of CSE , Delhi Technological University, Delhi, India
e Center for Security, Theory and Algorithmic Research , International Institute of Information Technology, Hyderabad, India
f Department of CSE , Thapar University, Patiala, India
A R T I C L E  I N F O
Keywords:
Blockchain
Authentication
Security
Internet of Things (IoT)
Quantum cryptography
Review
 A B S T R A C T
Blockchain and IoT systems have become the focal point of extensive research efforts in 
academia and industry. Recent studies have honed in on utilizing Blockchain technology to 
enhance trust management within IoT networks. Despite the potential benefits across various 
applications, existing blockchain platforms hinge on digital signatures, public key cryptography, 
Zero-Knowledge Proofs, and hash functions, making them susceptible to attacks facilitated 
by Quantum computers. Motivated by these vulnerabilities, this survey paper emphasizes the 
importance of incorporating Quantum Blockchain technology into the IoT landscape to establish 
trust among IoT devices. Specifically, we provide an overview of Blockchain technology and 
its security implications in the context of IoT security. The primary goal of this paper is to 
propose a Novel Quantum Blockchain framework that protects from classical and Quantum 
computing attacks. For this purpose, this article examines Quantum crypt

---

Contents lists available at ScienceDirect
Computers & Security
journal homepage: www.elsevier.com/locate/cose
Full length article
Hybrid framework for security evaluation in Internet of Vehicles✩
Nan Sun a, Wei Wang b,c,d,∗, Kexin Liu b,d, Donghong Li e, Jinhu Lü a,b,c,d
a School of Cyber Science and Technology, Beihang University, Beijing 100191, China
b School of Automation Science and Electrical Engineering, Beihang University, Beijing 100191, China
c The Hangzhou Innovation Institute, Beihang University, Hangzhou 310051, China
d The Zhongguancun Laboratory, Beijing, China
e NSFOCUS GeWuLAB, Shanxi 710077, China
A R T I C L E I N F O
Keywords:
Internet of vehicles
Security framework
Set-membership filtering
Data-driven
Dempster-Shafer theory
A B S T R A C T
Advancements in communication technology are driving the rapid evolution of the Internet of Vehicles (IoV)
industry, paving the way for future connected vehicle ecosystems. Current vehicle cyber-security efforts
primarily concentrate on vulnerabilities within the Controller Area Network (CAN) of existing automobiles.
However, the anticipated proliferation of Internet of Vehicles (IoV) capabilities in the near future brings
forth a new set of cyber-security challenges. Traditional IoV security analysis methods often focus on either
data or dynamic models to assess malicious vehicle behavior, lacking a comprehensive, multidimensional
security evaluation approach. In this paper, a novel IoV security analysis framework is proposed, integrating
vehicle dynamics models with driving behavior and communication traffic data. The framework employs
set-membership filtering algorithms and deep learning techniques to comprehensively assess vehicle status
and detect a wide range of security threats, including ARP spoofing, flooding attacks, and speeding, while
ensuring adaptability to diverse threat scenarios. Security scores are dynamically generated based on varying
threat levels using an enhanced Dempster-Shafer theory,

---

Contents lists available at ScienceDirect
Egyptian Informatics Journal
journal homepage: www.sciencedirect.com  
Full Length Article
Enhancing IoT security and healthcare data protection in the metaverse: A 
Dynamic Adaptive Security Mechanism
Saima Siraj Qureshi a, Jingsha He a, Nafei Zhu a
 , Ahsan Nazir a
 , Juan Fang a, Xiangjun Ma a
 , 
Ahsan Wajahat c, Faheem Ullah a, Sirajuddin Qureshi a, Sahroui Dhelim b,
Muhammad Salman Pathan b,∗
a College of Computer Science, Beijing University of Technology., Beijing 100124, China
b School of Computing, Dublin City University, Ireland
c School of Software, Northwestern Polytechnical University, Xian 710129, China
A R T I C L E  I N F O
Keywords:
Internet of Things
Machine learning
Metaverse
IoT security
Digital Twins
Artificial intelligence
 A B S T R A C T
In the rapidly evolving landscape of the Metaverse, the synergistic integration of the Internet of Things 
(IoT) and Digital Twins (DT) represents a revolutionary paradigm shift, seamlessly bridging the real and 
virtual worlds. While this innovative convergence offers unprecedented potential, it also exposes a broader 
spectrum of security vulnerabilities that challenge conventional approaches. This research aims to fortify 
the multifaceted ecosystem of the Metaverse, with a particular emphasis on securing IoT healthcare data. 
Ensuring the protection of health information within the extensive network of interconnected devices in the 
Metaverse is paramount. Addressing this critical need, we introduce the Dynamic Adaptive Security Mechanism 
(DASM), an advanced Artificial Intelligence (AI)-driven framework meticulously crafted to enhance security 
adaptively. DASM operates as a comprehensive and real-time defensive layer, continuously recalibrating its 
strategies to reinforce the security matrix for both IoT and Digital Twins. This study provides a detailed 
examination of the foundational architecture of DASM and its AI-driven adaptive processes. We elucidate 
i","Modern smart environments rely on IoT devices since they have the potential to ensure a high level of convenience and real-time data transfer between various systems (Elgazzar et al., 2022). These are sensors, actuators, and other devices that collect huge volumes of data and enable many applications in smart cities (Elgazzar et al., 2022). Thus, there are growing demands to ensure the security of these IoT devices and computational elements. Moreover, Fig. 3also shows how the ALU is critical in this integrated IoT ecosystem. The ALU processes data collected from IoT sensors and devices and enables local compu
tations before the data is sent for behavioral analysis. This architecture is important as it allows edge devices to do real-time calculations needed for quick decision-making processes. With this design, not all data is processed in the cloud, which makes the process faster and more responsive. As shown in Fig. 3, a secure and resilient IoT framework relies on three main principles: secure devices, secure communication, and secure cloud services. The priority in securing devices lies in ensuring the integrity of smart devices and managing data at the edge. Only properly authenticated devices are allowed to initiate connections and manage the exchange of messages. Moreover, secure cloud design promotes identification, authentication, and encryption methods. These security measures secure the data that is sent and received along with the calculations that are made, thus, once again, enhancing the trust
worthiness of the QCA-based integration of ALUs (Navimipour et al., 2023) in contemporary IoT devices.
Moreover, the transmitted data might contain sensitive data like personal data and usage patterns (Quasim et al., 2023). There is some energy in this access, and by manipulating the extent of energy, a hacker can steal confidential information and even bring down the entire sys
tem (Quasim et al., 2023). In such a way, the suggested QCA-based component can be considered a serious advancement in solving the contemporary problems of data safety in comparison with the tradi
tional approaches. The computer requirements to enable such profound analysis are frequently very complicated. It is essential to make sure that all components of an IoT system are not vulnerable to unauthorized access. In order to successfully mitigate the above security challenges, the proposed ALU design leverages the inherent benefits of QCA
nology. ALUs play a crucial role in the processors or microcontrollers designed for IoT devices. In this regard, our focus is to realize a QCA-based ALU to guarantee enhanced reliability and security in contemporary IoT settings. The proposed design addresses the
tational restrictions and security weaknesses, therefore providing more secure and efficient IoT-based systems. The proposed ALU is built using several components, some of which include an FA, a 2:1 MUX, and a 4:1 MUX. The following sections describe the design and implementation of the main components.",,,,,,,
Explain the scalability analysis presented in the scientific article Fog Computing Based Public Key Encryption with Multi-Keyword Search for Internet of Vehicles.,"scalability in ultra-dense IoMT networks remains unverified. Prototyp -
ing on IoT testbeds and optimizing session-key negotiation using group- 
based authentication protocols can help address this issue.
Funding
This research did not receive any specific grant from funding 
agencies in the public, commercial, or not-for-profit sectors.
Data availability
No data was used for the research described in the article.
CRediT authorship contribution statement
Ping Guo: Writing – review & editing, Validation, Methodology, 
Conceptualization. Shuilong Xu: Writing – original draft, Validation, 
Methodology. Wenfeng Liang: Writing – review & editing, Validation.
Declaration of competing interest
The authors declare that they have no known competing financial 
interests or personal relationships that could have appeared to influence 
the work reported in this paper.
Data availability
We use three public data sets
References
Al-Turjman, F., Nawaz, M H, Ulusar, U D, 2020. Intelligence in the Internet of Medical 
Things era: A systematic review of current and future trends. Comput. Commun. 150, 
644 – 660 .
Arfaoui, A., Boudia, O R M, Kribeche, A., et al., 2020. Context-aware access control and 
anonymous authentication in WBAN. Comput. Secur 88, 101496. https://doi.org/ 
10.1016/j.cose.2019.03.017 .
Bhatia, T., Verma, A K, Sharma, G., 2020. Towards a secure incremental proxy re- 
encryption for e-healthcare data sharing in mobile cloud computing. Concurr. 
Comput.: Pract. Exp. 32 (5), e5520. https://doi.org/10.1002/cpe.5520 .
Canetti, R., Krawczyk, H., 2001. Analysis of key-exchange protocols and their use for 
building secure channels. In: Advances in Cryptology — EUROCRYPT 2001: 
International Conference on the Theory and Application of Cryptographic 
Techniques Innsbruck, Austria, May 6 – 10, 2001 Proceedings 20. Berlin Heidelberg. 
Springer, pp. 453 – 474 .
Canetti, R., Krawczyk, H., 2002. universally composable notions of key exchange and 
secure channels. In: Advances in C

---

Md.A. Rahim et al.
Fig. 1. IoRT keyword correlation with other keywords.
Fig. 2. Proposed quantitative analysis procedure.
along with its future development, can be better understood through an extensive quantitative analysis of IoRT advancements over 
the past decade. To support this, the article selection and review procedure is illustrated in Fig.  2, and the total 106 papers published 
from 2014 to April 2025 are presented in Table  1.
Based on this analysis, the research articles are categorized according to their research purpose, implemented technologies, 
experimental types, and whether they address security and big data issues, as shown in Table  2. From Table  2, we can infer that 
while the security aspects of IoRT have been frequently addressed, our literature study of research articles could not find any studies 
specifically focused on big data management issues. In this context, we also analyzed several recently published review articles from 
renowned journals, which are presented in Table  3. Now, from Table  3, we can conclude that although a few review articles have 
discussed big data processing, but these discussions are minimal in comparison to the current demands and the expanding application 
prospects of IoRT. Furthermore, the existing articles tend to focus on specific aspects rather than proposing a comprehensive 
conceptual framework that integrates updated security mechanisms, big data processing techniques, communication systems, data 
sensing and computation technologies within the context of IoRT. This highlights a significant research gap and underscores the 
need for the development of an intelligent and secure IoRT framework capable of effectively addressing these multidimensional 
Internet of Things 33 (2025) 101684 
3

---

iting – review & editing, Supervision, Funding acqui-
sition. Xiaolong Liu: Writing – review & editing, Supervision, Investi-
gation, Funding acquisition.
Declaration of competing interest
The authors declare that they have no known competing finan-
cial interests or personal relationships that could have appeared to
influence the work reported in this paper.
Acknowledgments
This work was supported in part by fund of scientific and techno-
logical innovation of Fujian agriculture and Forestry University (Grant
No. KFb22091XA), Project of Industry-university-institute Cooperation
in Colleges and Universities in Fujian Province (Grant No. 2022H6006,
2024H6007) and the Project of Software Technology Innovation Re-
search and Industrialization in Fujian Province (Grant No. 2024.488).
Data availability
Data will be made available on request.
References
[1] Number of Internet of Things (IoT) connected devices worldwide from 2019
to 2021, with forecasts from 2022 to 2030, 2018, https://www.statista.com/
statistics/1183457/iot-connected-devices-worldwide/ .
[2] Xu Yang, Xuechao Yang, Xun Yi, Ibrahim Khalil, Xiaotong Zhou, Debiao He, Xinyi
Huang, Surya Nepal, Blockchain-based secure and lightweight authentication for
Internet of Things, IEEE Internet Things J. 9 (5) (2021) 3321–3332.
[3] Soumyashree S. Panda, Debasish Jena, Bhabendu Kumar Mohanta, Somula
Ramasubbareddy, Mahmoud Daneshmand, Amir H. Gandomi, Authentication and
key management in distributed iot using blockchain technology, IEEE Internet
Things J. 8 (16) (2021) 12947–12954.
[4] Zesen Hou, Jianting Ning, Xinyi Huang, Shengmin Xu, Leo Yu Zhang, Blockchain-
based efficient verifiable outsourced attribute-based encryption in cloud, Comput.
Stand. Interfaces (2024) 103854.
[5] Ya-Nan Cao, Yujue Wang, Yong Ding, Zhenwei Guo, Qianhong Wu, Hai Liang,
Blockchain-empowered security and privacy protection technologies for smart
grid, Comput. Stand. Interfaces 85 (2023) 103708.
[6] Noureddine Chikouche, Pierre-Louis Cayrel,

---

Execution
PA-MADRL Privacy-Aware Multi-Agent Deep Reinforcement Learning PPO Proximal Policy Optimization
PKI Public Key Infrastructure QoS Quality of Service
RBAC Role-Based Access Control RSUs Roadside units
RL Reinforcement Learning RoI Region of Interest
SDIoV Software Defined IoV SMPC Secure Multi-Party Computation
SAW Simple Additive Weighting SGT Stochastic Game Theory
SAC Soft Actor–Critic UAVs Unmanned Aerial Vehicles
URLLC Ultra-Reliable Low Latency Communication VDN Value Decomposition Networks
VANET Vehicular Adhoc networks VEC Vehicular Edge Computing
V2V Vehicle-to-Vehicle V2I Vehicle-to-Infrastructure
V2P Vehicle-to-Pedestrian V2N Vehicle-to-Network
V2G Vehicle-to-grid V2X Vehicle-to-Everything
Furthermore, these surveys are old-fashioned and fail to account
for the most recent developments in MARL methods. In addition, the
study [37,38] highlights the application of MARL in data offloading
and edge computing. It showcases how MARL can efficiently allocate
computational tasks and improve network performance. While these
studies possess value, they do not fully discover the possibilities of
MARL in its integration with new technologies, such as 5G and 6G. In
addition, the inclusion of [39–41] emphasizes the introduction of novel
characteristics in MARL, such as its utilization in situations involving
high mobility and its capacity to improve the reliability of communi-
cation. In addition, they tackle specific uncertain challenges in MARL,
such as non-stationarity and partial observability. However, they still
do not cover security and privacy worries carefully. Collectively, these
studies establish the numerous methods and creative solutions being
created to tackle the problems in multi-agent work allocation and
resource management in the IoV. The incorporation of sophisticated
algorithms, machine learning methods, and edge computing paradigms
is easing the expansion of vehicular networks that are more operative
and robust. Further investigation shou","In our model, as data users are not preselected, so user’s public key
is not used in the keyword index generation process. A data owner (vehicle)
creates a single keyword index set for a particular keyword set for
all users (vehicles), i.e., the model does not create n number of different
keyword index sets for n users for the same keyword set. So, if the
number of vehicles (users) increases, our model does not need to create
additional keyword indexes for the same keyword set. Hence, keyword
index storage cost remains constant and from this perspective, scalability
will not be lowered down. On the other hand, if the number of
fog nodes enhances, initially that improves scalability a lot. But after
certain time, the management complexity and cost and communication
overhead may lower down the scalability if not properly handled (using
load balancing etc.). But for high vehicular density, adding more fog
nodes in the system may give effective result to the performance of the
software.",,,,,,,
Provide a detailed explanation of predictive analytics as discussed in the article An Intelligent and Secure Internet of Robotic Things: A Review and Conceptual Framework,"Md.A. Rahim et al.
Fig. 1. IoRT keyword correlation with other keywords.
Fig. 2. Proposed quantitative analysis procedure.
along with its future development, can be better understood through an extensive quantitative analysis of IoRT advancements over 
the past decade. To support this, the article selection and review procedure is illustrated in Fig.  2, and the total 106 papers published 
from 2014 to April 2025 are presented in Table  1.
Based on this analysis, the research articles are categorized according to their research purpose, implemented technologies, 
experimental types, and whether they address security and big data issues, as shown in Table  2. From Table  2, we can infer that 
while the security aspects of IoRT have been frequently addressed, our literature study of research articles could not find any studies 
specifically focused on big data management issues. In this context, we also analyzed several recently published review articles from 
renowned journals, which are presented in Table  3. Now, from Table  3, we can conclude that although a few review articles have 
discussed big data processing, but these discussions are minimal in comparison to the current demands and the expanding application 
prospects of IoRT. Furthermore, the existing articles tend to focus on specific aspects rather than proposing a comprehensive 
conceptual framework that integrates updated security mechanisms, big data processing techniques, communication systems, data 
sensing and computation technologies within the context of IoRT. This highlights a significant research gap and underscores the 
need for the development of an intelligent and secure IoRT framework capable of effectively addressing these multidimensional 
Internet of Things 33 (2025) 101684 
3

---

ssessing the 
benefits and challenges of ai in forecasting demand and optimizing supply in agriculture, Comput. Sci. IT Res. J. 5 (2) (2024) 473–497.
[56] R. Sharma, B. Villányi, Evaluation of corporate requirements for smart manufacturing systems using predictive analytics, Internet Things 19 (2022) 
100554.
[57] M.A. Rahim, M.M. Rahman, M.S. Islam, A.J.M. Muzahid, M.A. Rahman, D. Ramasamy, Deep learning-based vehicular engine health monitoring system 
utilising a hybrid convolutional neural network/bidirectional gated recurrent unit, Expert Syst. Appl. 257 (2024) 125080.
[58] B. Biswas, S. Mishra, S. Balamurugan, Data analytics and collaborative robots in smart territory: Research methodology, applications, and open challenges, 
Intell. Robot. Cobots: Ind. 5. 0 Appl. (2025) 291–316.
[59] J.V.C. Banta, J.E.C. Licoto, C.A.D. Lukang, D.E.S. Oreta, J.R.R. Sinag, R.A. Maaño, R.C. Belleza Jr., P.J.L. De Castro, D.-B. Nguyen, HerdHero: A livestock 
management system with descriptive analytics, in: International Conference on Advances in Information and Communication Technology, Springer, 2024, 
pp. 837–852.
[60] S.U. Jan, S. Ahmed, V. Shakhov, I. Koo, Toward a lightweight intrusion detection system for the internet of things, IEEE Access 7 (2019) 42450–42471.
[61] P.R. Singh, V. Singh, R. Yadav, S. Chaurasia, 6G networks for artificial intelligence-enabled smart cities applications: A scoping review, Telemat. Inform. 
Rep. (2023) 100044.
[62] M.A. Rahman, M.A. Rahim, M.M. Rahman, N. Moustafa, I. Razzak, T. Ahmad, M.N. Patwary, A secure and intelligent framework for vehicle health 
monitoring exploiting big-data analytics, IEEE Trans. Intell. Transp. Syst. (2022).
[63] K. Buntak, M. Kovačić, M. Mutavdžija, Internet of Things and smart warehouses as the future of logistics, Tehnički Glas. 13 (3) (2019) 248–253.
[64] W. Jia, S. Wang, Y. Xie, Z. Chen, K. Gong, Disruptive technology identification of intelligent logistics robots in AIoT industry: Based on attributes and 
func

---

chine Learning
CPU Central Processing Unit MT Mobile Terminal
CSO Chicken Swarm Optimization mURLLC Massive Ultra-Reliable and Low-Latency Communications
dApps Decentralized Applications NIB Network-In-Box
DAD Deep Anomaly Detection PoAh Proof of Authentication
DoS Denial of Service PoC Proof of Collaboration
DDoS Distributed Denial of Services PoK Proof of Knowledge
DL Deep Learning PoS Proof of Stack
DRL Deep Reinforcement Learning PoW Proof of Work
DT Digital Twin P2P Peer-to-Peer
DTWN Digital Twin Wireless Networks PBFT Practical Byzantine Fault-Tolerant
DWSN Dynamic Wireless Sensor Networks RIS Reconfigurable Intelligent Surfaces
FDL Federated Transfer learning RNN Recurrence Neural Network
FL Federated Learning SDA Secure Data Analytics
Geth Go-Ethereum SMPC Secure Multi-Party Computation
GNN Gated Neural Network SQL Structured Query Language
GPU Graphical Processing Unit SYN Synchronize
GRU Gated Recurrent Unit UDP User Datagram Protocol
GUI Graphical User Interface VAE Variational Autoencoder
ICMP Internet Control Message Protocol 6G Sixth Generation
excluded the papers that retained low-quality content. In the next stage,
we filter the papers after reading their abstracts and key contributions.
Lastly, we extract the papers for our survey on technology enablers
(i.e., blockchain, FL, and 6G) for secure big data services.
3. Background and literature review
In this section, we present the technological backgrounds of the
stack of technology enablers and a literature review of related survey
articles. Table 2 shows the summarized list of acronyms used in the
article.
3.1. Background
The definition and fundamental concepts of the technologies such
as the Internet of Things (IoT) and IIoT, big data, blockchain, FL, and
6G used in this survey are presented in this section.
3.1.1. IoT and IIoT
The IoT shifts the communication paradigm, enabling billions of
heterogeneous devices to connect seamlessly and provide real-time
information. The IoT is the fastest-growin

---

Md.A. Rahim et al.
Fig. 3. Proposed architecture of blockchain integrated intelligent and secure big data analytics-based IoRT.
introduced a method employing Interactive Multi-Objective Reinforcement Learning (IMORL) to enhance prescriptive analytics, 
aiming to address the challenges of real-world environments and enhance human-machine collaboration efficiency. Again, Kandula 
et al. [53] proposed a prescriptive analytics framework for e-commerce shops to enhance delivery with minimum delivery failures 
and cost.
3.2. Predictive analytics
Predictive big data analytics in the IoRT leverages vast amounts of data from interconnected robotic devices to anticipate 
future events based on patterns [54]. It is commonly used to predict when robotic systems will require maintenance to prevent 
failures, identify potential risks and proactively mitigate them, and customize interactions between robots and stakeholders through 
predictive analysis [55]. For instance, Sharma and Villányi [56] proposed a predictive analytics framework for assessing smart 
manufacturing systems requirements, and provided decision priorities to guide actions for better outcomes by incorporating key 
components of many decision support systems. Similarly, Rahim et al. [57] developed a predictive model for vehicular engine 
health monitoring that prioritizes maintenance of the most vulnerable components, aiming to minimize maintenance costs and 
extend service life using a hybrid AI approach.
3.3. Descriptive analytics
Descriptive big data analytics of IoRT refers to the collection, processing, and analysis of huge volumes of data generated by 
networked robotic devices. By this process, it provides feedback on robotic operations, environmental conditions, and operating 
Internet of Things 33 (2025) 101684 
6","Predictive big data analytics in the IoRT leverages vast amounts of data from interconnected robotic devices to anticipate
future events based on patterns [54]. It is commonly used to predict when robotic systems will require maintenance to prevent
failures, identify potential risks and proactively mitigate them, and customize interactions between robots and stakeholders through
predictive analysis [55]. For instance, Sharma and Villányi [56] proposed a predictive analytics framework for assessing smart
manufacturing systems requirements, and provided decision priorities to guide actions for better outcomes by incorporating key
components of many decision support systems. Similarly, Rahim et al. [57] developed a predictive model for vehicular engine
health monitoring that prioritizes maintenance of the most vulnerable components, aiming to minimize maintenance costs and
extend service life using a hybrid AI approach.",,,,,,,
What dataset is used in the scientific article An Intelligent Native Network Slicing Security Architecture Empowered by Federated Learning?,"A. Roy, D. Bhattacharjee and O. Krejcar / Data in Brief 60 (2025) 111599 3 
• Real-World Applications: 
The dataset can be used for intrusion detection, traﬃc anomaly detection, and IoV security. 
It facilitates automated machine learning implementations, making it suitable for real-time 
ITS and vehicular network security applications. 
• Public Availability for Research Reuse: 
The dataset is publicly available and can be used by researchers for further studies in IoV 
security, machine learning-based IDS models, and intelligent transportation research. The 
structured preprocessing pipeline also provides a framework for handling similar vehicular 
datasets in the future [ 4–6 ]. 
2. Background 
Several researchers have attempted to utilize VeReMi to develop intrusion detection systems, 
but the dataset’s inherent imbalance often hampers their efforts: 
• Aldwairi et al. (2020): Proposed hybrid machine learning models to detect intrusions. 
However, their experiments revealed that the signiﬁcant class imbalance in VeReMi ad- 
versely affected the models’ performance, leading to suboptimal results [ 1 ]. 
• Kouzinopoulos et al. (2019) Focused on addressing the dataset imbalance by employing 
manual subsampling techniques. While this improved balance, the usability of the mod- 
iﬁed dataset became limited, as manual subsampling does not easily generalize across 
various machine learning models and scenarios [ 2 ]. 
• Genser et al. (2023): Developed an optimized dataset for traﬃc signal and loop detector 
analysis, demonstrating the importance of structured preprocessing for improved dataset 
usability in transportation research [ 4 ]. 
• Zähringer et al. (2023): Highlighted the signiﬁcance of survey-based dataset structuring, 
reinforcing the necessity of balancing datasets to enhance model generalization and per- 
formance [ 5 ]. 
• Collins et al. (2025): Used big data analytics to differentiate long-haul and short-haul 
trips, emphasizing the critical role of prep

---

sets used in the previously analyzed studies, categorizing them based on their data 
type, security application, and the specific research paper where they were applied. The dataset selection directly impacts the 
accuracy, generalization, and adaptability of LLM-powered IoT security models. As detailed in Table  6, CICIDS2017 and UNSW-
NB15 are among the most widely used datasets for training LLM-based IDS. Hassanin et al. [27] fine-tuned GPT-based IDS models 
on CICIDS2017, demonstrating a 5.8% improvement in attack detection accuracy compared to traditional ML-based IDS models. 
Similarly, Ali et al. [71] leveraged HuntGPT on UNSW-NB15 for network anomaly detection, achieving a 12% reduction in false 
positives and highlighting the effectiveness of LLM-driven cyber threat intelligence.
The IoT-23 dataset is widely used for malware classification and research on adversarial IoT security. Ouyang et al. [91] fine-
tuned a zero-shot LLM-based malware detection system using IoT-23, achieving an 85.4% classification accuracy for novel malware 
families and demonstrating the ability of LLMs to generalize across previously unseen security threats. Since IoT-23 includes 
traffic from real-world IoT malware campaigns, e.g., Mirai, Gafgyt, and Bashlite botnets, it provides valuable training material 
for LLM-based malware detection and behavioral analysis. TON-IoT and BoT-IoT are commonly used for IoT anomaly detection 
and threat intelligence. Xu et al. [85] trained a federated learning-based LLM on TON-IoT, improving privacy-preserving threat 
detection accuracy by 15%, demonstrating that federated security models can effectively leverage decentralized IoT data without 
centralized exposure. Similarly, Wang et al. [79] fine-tuned an LLM-based IDS model on BoT-IoT, achieving 94.2% accuracy in 
detecting DDoS attacks targeting IoT networks. N-BaIoT plays a crucial role in botnet detection research, as it contains behavioral 
traces of real IoT devices compromised by malware

---

Data in Brief 60 (2025) 111599 
Contents lists available at ScienceDirect 
Data in Brief 
journal homepage: www.elsevier.com/locate/dib 
Data Article 
Improving internet of vehicles research: A 
systematic preprocessing framework for the 
VeReMi dataset 
Aparup Roy a , ∗, Debotosh Bhattacharjee b , c , Ondrej Krejcar d 
a Bachelor of Science (B.S.) in Data Science and Applications (Pursuing), Indian Institute of Technology Madras, BS 
Degree Oﬃce, 3rd Floor, ICSR Building, IIT Madras, Chennai 60 0 036, India 
b Department of Computer Science & Engineering, Jadavpur University, 188, Raja S.C. Mallick Rd, Kolkata 70 0 032, 
West Bengal, India 
c Center for Basic and Applied Science, Faculty of Informatics and Management, University of Hradec Kralove, 
Rokitanskeho 62, Hradec Kralove 50 0 03, Czech Republic 
d Research Center, Skoda Auto University, Na Karmeli 1457, 293 01 Mlada Boleslav, Czech Republic 
a r t i c l e i n f o 
Article history: 
Received 21 February 2025 
Revised 18 March 2025 
Accepted 23 April 2025 
Available online 28 April 2025 
Dataset link: Preprocessed VeReMi Dataset 
for IoV Intrusion Detection (Original data) 
Keywords: 
Vehicular reference misbehavior dataset 
(VeReMi) 
Intelligent transportation systems (ITS) 
Internet of vehicles (IoV) 
Intrusion detection systems (IDS) 
Data preprocessing 
Dataset optimization 
Anomaly detection 
Network security 
Machine learning (ML) 
Cybersecurity 
a b s t r a c t 
The Vehicular Reference Misbehavior Dataset (VeReMi) is a 
vital resource for advancing Intelligent Transportation Sys- 
tems (ITS) and the Internet of Vehicles (IoV). However, its 
large size ( ∼7 GB) and inherent class imbalance pose sig- 
niﬁcant challenges for machine learning model develop- 
ment. This paper presents a preprocessing framework to en- 
hance VeReMi’s usability and relevance. Through 10 % down- 
sampling, the dataset was reduced to ∼724MB, making it 
computationally manageable. Biases were addressed by bal- 
ancing benign an

---

ation of existing network infrastructure. By using this function, it becomes feasible to integrate elements of 
the physical world into computerised systems, resulting in enhanced levels of efficiency, precision, and financial 
profitability. The Internet of Things (IoT) encompasses a diverse array of applications. The Internet of Things 
(IoT) may be used in several sectors such as healthcare, smart cities, smart homes, transportation, logistics, 
agriculture, and smart traffic management. The quantity of Internet of Things (IoT) devices is increasing rapidly 
and exponentially. The surge in numbers is accompanied by a significant escalation in security vulnerabilities. 
This article presents the development of an intrusion detection system for the Internet of Things using machine 
learning and feature selection techniques. The system aims to accurately categorise and forecast attacks on IoT 
devices. This approach utilises the publicly accessible NSL KDD dataset as its input dataset. During the data 
collecting process for NSL-KDD, all symbolic qualities are transformed into their corresponding numerical rep -
resentations. Conversely, all numerical features are translated back into symbolic form at the conclusion of the 
procedure. Principal component analysis is employed to achieve the objective of attribute extraction. After 
completing the preparation step, the data set is classified using several machine learning techniques such as 
support vector machine, linear regression, and random forest. Evaluating the veracity, exactness, and retrieval 
rate of different machine learning algorithms is crucial for choosing the most effective ones. The accuracy of the 
Intrusion Detection System (IDS) based on Particle Swarm Optimisation (PSO) is 98.5 percent. The PSO-based 
SVM method is shown superior performance compared to random forest and linear regression methods in 
terms of precision, recall, and specificity.
This article is part of a special issue entitled: IoT","We chose four days to train and validate the deep neural networks,
encompassing tuples of network flows from different days and times.
We used 90% of the time for training and 10% for testing, and each
experiment was performed 10 (ten) times. Each capture or dataset
acquisition day was assigned to a single federated client during the
learning process, as listed in Table 5. The dataset was divided as
follows: Monday featured only regular activity (normal traffic with
different applications), whereas Tuesday through Friday included hybrid
attacks and regular activity. The neural network structure and the
layers employed for each federated client are shown in Fig. 6.
Within just four (4) days of the existing dataset [48], time divisions
into morning, afternoon, and evening led to the separation of more than
four (4) datasets for each ML-Agent, as shown in Table 5 (column
‘‘Assigned to which ML-Agent’’). The dataset comprises a real network
encompassing various devices such as firewalls, switches, and routers.
We previously trained models for the SFI2 AI Management building
block, allowing future microservices of the SFI2 reference architecture
to import the model. Later, using the trained and operational
model, we validated the performance of the security API in classifying
network flows from both network slices and functional blocks of the
architecture.
The chosen dataset represents the diversity of devices and user
behaviors it brings. The dataset was constructed to include various
intrusions and benign traffic at different times of the day to capture
the unique characteristics of each time slot. The first day of the week,
Monday, was excluded from the local training process of our experiment
because it consisted of only regular traffic. The remaining days
were considered for training, as they contained a mixture of benign and
malignant traffic.
To understand the type of data ML-Agents have dealt with, we
conducted a Principal Component Analysis (PCA), which is a statistical
technique used for dimensionality reduction. PCA reduces dimensionality
by transforming the original variables into a new set of variables,
the main components. The PCA-generated scatter plots reveal that
classes have considerable overlap within features, which may lead
to difficulties in achieving high accuracy or convergence in terms of
learning in certain AI models. Fig. 7 shows that the malignant and
benign classes are mixed, indicating an intrinsic classification challenge
for ML-Agents. To migrate some of this overlap, we conducted a
hyperparameter optimization.",,,,,,,
Describe the introduction provided in the article A Novel Ultra-Low Power Post-Quantum Approach Using Artificial Intelligence Based Key Generation for Cyber Physical System in Internet of Things.,"Journal of Network and Computer Applications 236 (2025) 104110
Available online 17 January 2025
1084-8045/© 2025 The Author(s). Published by Elsevier Ltd. This is an open access article under the CC BY license ( http://creativecommons.org/licenses/by/4.0/).
Contents lists available at ScienceDirect
Journal of Network and Computer Applications
journal homepage: www.elsevier.com/locate/jnca
Review article
Internet of Things botnets: A survey on Artificial Intelligence based detection
techniques
Moemedi Lefoane
 , Ibrahim Ghafir ∗, Sohag Kabir, Irfan-Ullah Awan
Faculty of Engineering and Digital Technologies, University of Bradford, Bradford, BD7 1DP, United Kingdom
A R T I C L E I N F O
Keywords:
Botnet attack
Internet Of Things
Network security
Intrusion Detection System
Machine learning
Artificial Intelligence
A B S T R A C T
The Internet of Things (IoT) is a game changer when it comes to digitisation across industries. The Fourth
Industrial Revolution (4IR), brought about a paradigm shift indeed, unlocking possibilities and taking industries
to greater heights never reached before in terms of cost saving and improved performance leading to increased
productivity and profits, just to mention a few. While there are more benefits provided by IoT, there are
challenges arising from the complexities, limitations and requirements of IoT and key enabling technologies.
Distributed Denial of Service (DDoS) attacks are among the most prevalent and dominant cyber-attacks
that have been making headlines repeatedly in recent years. IoT technology has increasingly become the
preferred technology for delivering these cyber-attacks. It does not come as a surprise that IoT devices are
an attractive target for adversaries, as they are easy to compromise due to inherent limitations and given that
they are deployed in large numbers. This paper reviews IoT botnet detection approaches proposed in recent
years. Furthermore, IoT ecosystem components are outlined, revealing their challenges

---

Full Length Article
Enhanced Intrusion Detection System Using Hybrid-Inspired Algorithms 
and Conditional Generative Adversarial Networks for Internet of 
Things Security
Shahab Wahhab Kareem
Department of Artificial Intelligence and Robotics Engineering, Technical College of Computer and Informatics Engineering, Erbil Polytechnic University, Erbil 44001, Iraq
Department of Information Technology, College of Engineering and Computer Science, Lebanese French University, Erbil 44001, Iraq
ARTICLE INFO
Keywords:
Intrusion detection system
Conditional generative adversarial networks
Bio-inspired algorithms
Synthetic data generation
Feature selection optimization
ABSTRACT
This research proposes a new Intrusion Detection System architecture that aims at improving the protection of 
IoT through the integration of multiple techniques. The system utilizes a dataset called Bot-IoT that contains 
unbalanced data, to develop a stable Intrusion Detection System. The methodology is divided into three stages: 
data pre-processing, synthetic data generation and bio-inspired hybrid features selection. The first process in -
cludes cleaning, encoding as well as scaling the data set for the machine learning algorithms such as Extreme 
Gradient Boosting (XGBoost), Light Gradient Boosting Machine, Deep Neural Network, Support Vector Machine, 
and Decision Tree to be affected. The second stage involves the use of a novel architecture of a Conditional 
Generative Adversarial Network, with a two-discriminator structure to enhance the generation of synthetic data 
that will improve the balance and the overall quality of the dataset used for training. It is described how the 
validity of the synthetic data is assessed statistically, and how the generated data affects different models of 
machine learning. The last step uses meta -heuristic bio-hybrid algorithms for selecting features. The two methods 
of crocodile hunting search and bee optimization are integrated with Recursive Feature Elim

---

Formal analysis, Con-
ceptualization. Quazi Mamun: Writing – review & editing, Validation, 
Methodology, Funding acquisition, Conceptualization. Arash Mah-
boubi: Writing – review & editing, Supervision, Methodology, Formal 
analysis, Conceptualization. Patrick Walsh: Writing – review & edit-
ing, Supervision, Investigation, Conceptualization. Md Zahidul Islam: 
Writing – review & editing, Supervision, Methodology, Formal analysis, 
Conceptualization.
Declaration of competing interest
The authors declare the following ﬁnancial interests/personal rela-
tionships which may be considered as potential competing interests: 
Sajal Halder reports ﬁnancial support was provided by Charles Sturt Uni-
versity (C1668AICF). Sajal Halder reports a relationship with Common-
wealth Scientiﬁc and Industrial Research Organisation that includes: 
employment. Author previously employed at RMIT University, Aus-
tralia. If there are other authors, they declare that they have no known 
competing ﬁnancial interests or personal relationships that could have 
appeared to inﬂuence the work reported in this paper.
Acknowledgement
This project is supported by funding from the AI and Cyber Futures 
Institute at Charles Sturt University, NSW, Australia (C1668AICF).
Data availability
No data was used for the research described in the article.
References
[1] T. Qureshi, M. Saeed, K. Ahsan, A.A. Malik, E.S. Muhammad, N. Touheed, Smart 
agriculture for sustainable food security using internet of things (iot), Wirel. Com-
mun. Mob. Comput. 2022 (2022) 1–10.
[2] V. Vostriakova, M.L. Swarupa, O. Rubanenko, S.L. Gundebommu, Blockchain and 
climate smart agriculture technologies in agri-food security system, in: Interna-
tional Conference on Artiﬁcial Intelligence and Data Science, Springer, 2021, 
pp. 490–504.
[3] H. Kaur, Modelling internet of things driven sustainable food security system, 
Benchmarking 28 (5) (2021) 1740–1760.
[4] World Population Prospects, United Nations, Department of Economic and

---

Table 1: Subjects of the papers.
Subject Paper Reference
BC
BC-RAN: Cloud radio access network enabled by blockchain for 5G [73]
Blockchain-enabled wireless communications: a new paradigm towards 6G [74]
Distributed Network Slicing Management Using Blockchains in E-Health Environments [75]
Design of a Security and Trust Framework for 5G Multi-domain Scenarios [76]
Data Broker: Dynamic Multi-Hop Routing Protocol in Blockchain Radio Access Network [77]
Future Industry Internet of Things with Zero-trust Security [78]
Blockchain Based Privacy Preserving Framework for Emerging 6G Wireless Communications [79]
Blockchain-based fog radio access networks: Architecture, key technologies, and challenges [80]
Evaluation of soft computing in intrusion detection for secure social Internet of Things based on collaborative edge
computing [81]
Resource Sharing and Trading of Blockchain Radio Access Networks: Architecture and Prototype Design [82]
Radio optical network security analysis with routing in quantum computing for 5G wireless communication using
blockchain machine learning model [83]
Hedera: A Permissionless and Scalable Hybrid Blockchain Consensus Algorithm in Multi-Access Edge Computing for IoT [84]
FH
Securing Ethernet-based optical fronthaul for 5G network [85]
Secure Open Fronthaul Interface for 5G Networks [86]
Transport Security Considerations for the Open-RAN Fronthaul [87]
Open-RAN Fronthaul Transport Security Architecture and Implementation [35]
IDS/IPS
Detecting DoS and DDoS Attacks by Using CuSum Algorithm in 5G Networks [88]
Attacks and failures prediction framework for a collaborative 5G mobile network [89]
The Novel System of Attacks Detection in 5G [90]
An edge based hybrid intrusion detection framework for mobile edge computing [91]
A highly secured IDS for IoT using EXPSO-STF A feature selection for LAANN to detect attacks [92]
RRC
Authentication Protocol for an IoT-Enabled LTE Network [93]
On the Impact of Rogue Base Stations in 4G/LTE Self Organizing Net","The swift proliferation of Internet of Things (IoT) devices has revolutionized
numerous sectors, including healthcare, where the Internet of
Medical Things (IoMT) plays a pivotal role in collecting, analyzing, and
transmitting patient data. Despite its potential, the resource-constrained
nature of IoT devices poses significant challenges to ensuring robust
security, particularly in the era of quantum computing. Conventional
cryptographic algorithms may falter under the computational demands
of such devices, necessitating innovative solutions that are lightweight,
secure, and quantum-resistant. This work presents an intelligent cryptographic
framework that leverages dynamic cryptographic components
and advanced lightweight primitives to address these challenges. The
cryptographic key generation process, a cornerstone of this framework,
utilizes human activity recognition (HAR) data, processed through a 4D
Chen hyper-chaotic map as shown in Fig. 1. This approach ensures that
the keys are dynamic, unpredictable, and conform to modern cryptographic
standards for quantum-resistant security. This framework’s
adaptability and robustness make it particularly well-matched for
sensitive domains such as IoMT, where patient data must be securely
stored and conveyed while adhering to stringent resource constraints.
The key contributions of this work are as follows: a novel algorithm
targeting low power application unique feature like offering a balance
between high security and low energy consumption. It achieved a homogeneity
score of 0.0175, energy efficiency of 0.0061, and an image
contrast of 4987.688. Moreover, the total energy consumption of the
system was recorded at just 3.536 μJ, demonstrating its suitability for
real-time, low-power medical environments. The novelty claim have
been validated on versatile and commercially competent architecture
thus establishing the merit of proposed algorithm over the state of the
art.This paper is systematized into several sections as follows: Section 2
presents the prior work that has been done in this field. Section 3 introduces
the proposed method. Section 4 discusses the experimental
results and findings. Finally, Section 5 provides the concludes the paper",,,,,,,
What are the contributions presented in the scientific article Blockchain-Based Identity Authentication and Data Interaction Scheme for Industrial Internet of Things?,"chine Learning
CPU Central Processing Unit MT Mobile Terminal
CSO Chicken Swarm Optimization mURLLC Massive Ultra-Reliable and Low-Latency Communications
dApps Decentralized Applications NIB Network-In-Box
DAD Deep Anomaly Detection PoAh Proof of Authentication
DoS Denial of Service PoC Proof of Collaboration
DDoS Distributed Denial of Services PoK Proof of Knowledge
DL Deep Learning PoS Proof of Stack
DRL Deep Reinforcement Learning PoW Proof of Work
DT Digital Twin P2P Peer-to-Peer
DTWN Digital Twin Wireless Networks PBFT Practical Byzantine Fault-Tolerant
DWSN Dynamic Wireless Sensor Networks RIS Reconfigurable Intelligent Surfaces
FDL Federated Transfer learning RNN Recurrence Neural Network
FL Federated Learning SDA Secure Data Analytics
Geth Go-Ethereum SMPC Secure Multi-Party Computation
GNN Gated Neural Network SQL Structured Query Language
GPU Graphical Processing Unit SYN Synchronize
GRU Gated Recurrent Unit UDP User Datagram Protocol
GUI Graphical User Interface VAE Variational Autoencoder
ICMP Internet Control Message Protocol 6G Sixth Generation
excluded the papers that retained low-quality content. In the next stage,
we filter the papers after reading their abstracts and key contributions.
Lastly, we extract the papers for our survey on technology enablers
(i.e., blockchain, FL, and 6G) for secure big data services.
3. Background and literature review
In this section, we present the technological backgrounds of the
stack of technology enablers and a literature review of related survey
articles. Table 2 shows the summarized list of acronyms used in the
article.
3.1. Background
The definition and fundamental concepts of the technologies such
as the Internet of Things (IoT) and IIoT, big data, blockchain, FL, and
6G used in this survey are presented in this section.
3.1.1. IoT and IIoT
The IoT shifts the communication paradigm, enabling billions of
heterogeneous devices to connect seamlessly and provide real-time
information. The IoT is the fastest-growin

---

CRediT authorship contribution statement
Wan Tao: Writing – original draft, Validation, Software, Methodol -
ogy, Investigation, Formal analysis, Conceptualization. Shi Buhai: 
Writing – review & editing, Validation, Software, Methodology, Inves -
tigation, Formal analysis. Wang Huan: Writing – review & editing, 
Validation, Software, Investigation, Formal analysis, Conceptualization.
Declaration of Competing Interest
The authors declare that they have no known competing financial 
interests or personal relationships that could have appeared to influence 
the work reported in this paper.
Data availability
All relevant data are within the paper.
References
[1] N. Kumar, S. Challa, M. Wazid, A.K. Das, A.G. Reddy, E.-J. Yoon, K.-Y. Yoo, Secure 
signature-based authenticated key establishment scheme for future IoT 
applications, IEEE Access 5 (1) (2017) 3028–3043 .
[2] Amar Khelloufi, et al., A multimodal latent-features-based service recommendation 
system for the social Internet of Things, IEEE Trans. Comput. Soc. Syst. (2024) .
[3] M. Tanveer, A. Alkhayyat, N. Kumar, et al., REAP-IIoT: resource-efficient 
authentication protocol for the industrial Internet of Things, IEEE Internet Things 
J. 9 (23) (2022) 24453–24465 .
[4] Abdenacer Naouri, et al., Efficient fog node placement using nature-inspired 
metaheuristic for IoT applications, Clust. Comput. (2024) 1–17 .
[5] S. Son, D. Kwon, S. Lee, et al., A zero-trust authentication scheme with access 
control for 6G-enabled IoT Environments, IEEE Access (2024) .
[6] Abdelkarim Ben Sada, et al., A context-aware edge computing framework for smart 
internet of things, Future Internet 15 (5) (2023) 154 .
[7] Jian Wang, Fan Li*, Song Lv, Lijun He, Chao Shen, Physically realizable adversarial 
creating attack against vision-based BEV space 3D object detection, IEEE Trans. 
Image Process. 34 (2025) 538–551 .
[8] J. Ryu, D. Kang, H. Lee, et al., A secure and lightweight three-factor-based 
authentication scheme for smart healthca

---

CRediT authorship contribution statement
Fengjun Shang: Writing – review & editing, Writing – original draft, 
Supervision, Project administration, Funding acquisition. Xinxin Deng: 
Visualization, Validation, Methodology, Investigation, Formal analysis, 
Conceptualization.
Declaration of competing interest
The authors declare that they have no known competing financial 
interests or personal relationships that could have appeared to influence 
the work reported in this paper.
Acknowledgment
This work was supported by Natural Science Foundation of 
Chongqing, China (No. CSTB2022NSCQ-MSX1130), Chongqing Social 
Science Planning (Office of Cyberspace Affairs Commission) Projects, 
China (No.2024WX06) and Chinese University Industry-university 
Research Innovation- IFlytek University Innovation Research Special 
Project (Phase II), China.
Data availability
No data was used for the research described in the article. 
References
[1] Y. Fu, F.R. Yu, C. Li, et al., Vehicular blockchain-based collective learning for 
connected and autonomous vehicles, IEEE Wirel. Commun. 27 (2) (2020) 197 – 203 .
[2] W. Xu, H. Zhou, N. Cheng, et al., Internet of vehicles in big data era, IEEE/CAA J. 
Automatica Sinica 5 (1) (2018) 19 – 35 .
[3] Trusted Blockchain Promotion Plan(TBI) & IMT-2020(5G)promotion group C-V2X 
working group[EB/OL]. (2021-10-23)[2024-03-13]. http://www.trustedblockcha 
in.cn/#/result/result/resultDetail/28597265fc8d43a7a94adaed07cea389/0 .
[4] Xiong Xiao, Li Leixiao, Gao Jing, et al., Research progress of blockchain in the field 
of data sharing in the Internet of Vehicles, Comput. Sci. Explor. 16 (5) (2022) 
1008 – 1024 .
[5] A.H. Sodhro, S. Pirbhulal, M. Muzammal, et al., Towards blockchain-enabled 
security technique for industrial internet of things based decentralized 
applications, J. Grid. Comput. 18 (4) (2020) 615 – 628 .
[6] A. Dixit, A. Singh, Y. Rahulamathavan, et al., Fast data: a fair, secure, and trusted 
decentralized iiot data marketplace enabled by

---

Formal analysis, Con-
ceptualization. Quazi Mamun: Writing – review & editing, Validation, 
Methodology, Funding acquisition, Conceptualization. Arash Mah-
boubi: Writing – review & editing, Supervision, Methodology, Formal 
analysis, Conceptualization. Patrick Walsh: Writing – review & edit-
ing, Supervision, Investigation, Conceptualization. Md Zahidul Islam: 
Writing – review & editing, Supervision, Methodology, Formal analysis, 
Conceptualization.
Declaration of competing interest
The authors declare the following ﬁnancial interests/personal rela-
tionships which may be considered as potential competing interests: 
Sajal Halder reports ﬁnancial support was provided by Charles Sturt Uni-
versity (C1668AICF). Sajal Halder reports a relationship with Common-
wealth Scientiﬁc and Industrial Research Organisation that includes: 
employment. Author previously employed at RMIT University, Aus-
tralia. If there are other authors, they declare that they have no known 
competing ﬁnancial interests or personal relationships that could have 
appeared to inﬂuence the work reported in this paper.
Acknowledgement
This project is supported by funding from the AI and Cyber Futures 
Institute at Charles Sturt University, NSW, Australia (C1668AICF).
Data availability
No data was used for the research described in the article.
References
[1] T. Qureshi, M. Saeed, K. Ahsan, A.A. Malik, E.S. Muhammad, N. Touheed, Smart 
agriculture for sustainable food security using internet of things (iot), Wirel. Com-
mun. Mob. Comput. 2022 (2022) 1–10.
[2] V. Vostriakova, M.L. Swarupa, O. Rubanenko, S.L. Gundebommu, Blockchain and 
climate smart agriculture technologies in agri-food security system, in: Interna-
tional Conference on Artiﬁcial Intelligence and Data Science, Springer, 2021, 
pp. 490–504.
[3] H. Kaur, Modelling internet of things driven sustainable food security system, 
Benchmarking 28 (5) (2021) 1740–1760.
[4] World Population Prospects, United Nations, Department of Economic and","The maincontributions are as follows:
(1) We propose IADI, a scheme for identity authentication and asynchronous data interaction in the IIoT. Our scheme includesdesigning the identity smart contract, the identity authentication smart contract, and the data interaction smart contract. Thesesmart contracts are designed according to different stages of industrial data generation to achieve decentralization, distribution,and traceability. Each participant must be verified through the smart contract to continue sharing their private data to realize thecharacteristics of decentralization, distribution, and traceability.
(2) Our identity authentication scheme is based on the Schnorr non-interactive zero-knowledge proof. It involves designingtwo private keys that collectively form the SIC. One private key is used to generate the participant’s identity on the blockchain,and the other generates the secret number for the participant’s identity authentication. This scheme realizes distributed identityauthentication and better protects the participants’ authentication privacy.
(3) Our asynchronous data interaction scheme is based on the DH key agreement algorithm. The on-chain identity is used for thesession key agreement between the two participants to achieve asynchronous data interaction based on the identity authenticationscheme. The participants negotiated the key, generated the session key, and realized the encrypted data interaction based on thesymmetric key through the identity information disclosed in the blockchain.
(4) Performance tests and security analysis indicate that our scheme offers better security while enhancing performance comparedto alternative algorithms. We achieve shorter identity authentication times, making it more suitable for practical applications in theIIoT.",,,,,,,
What is the conclusion of the scientific article Blockchain-Based Lightweight Authentication Scheme for Internet of Things Using Lattice Encryption Algorithm?,"iting – review & editing, Supervision, Funding acqui-
sition. Xiaolong Liu: Writing – review & editing, Supervision, Investi-
gation, Funding acquisition.
Declaration of competing interest
The authors declare that they have no known competing finan-
cial interests or personal relationships that could have appeared to
influence the work reported in this paper.
Acknowledgments
This work was supported in part by fund of scientific and techno-
logical innovation of Fujian agriculture and Forestry University (Grant
No. KFb22091XA), Project of Industry-university-institute Cooperation
in Colleges and Universities in Fujian Province (Grant No. 2022H6006,
2024H6007) and the Project of Software Technology Innovation Re-
search and Industrialization in Fujian Province (Grant No. 2024.488).
Data availability
Data will be made available on request.
References
[1] Number of Internet of Things (IoT) connected devices worldwide from 2019
to 2021, with forecasts from 2022 to 2030, 2018, https://www.statista.com/
statistics/1183457/iot-connected-devices-worldwide/ .
[2] Xu Yang, Xuechao Yang, Xun Yi, Ibrahim Khalil, Xiaotong Zhou, Debiao He, Xinyi
Huang, Surya Nepal, Blockchain-based secure and lightweight authentication for
Internet of Things, IEEE Internet Things J. 9 (5) (2021) 3321–3332.
[3] Soumyashree S. Panda, Debasish Jena, Bhabendu Kumar Mohanta, Somula
Ramasubbareddy, Mahmoud Daneshmand, Amir H. Gandomi, Authentication and
key management in distributed iot using blockchain technology, IEEE Internet
Things J. 8 (16) (2021) 12947–12954.
[4] Zesen Hou, Jianting Ning, Xinyi Huang, Shengmin Xu, Leo Yu Zhang, Blockchain-
based efficient verifiable outsourced attribute-based encryption in cloud, Comput.
Stand. Interfaces (2024) 103854.
[5] Ya-Nan Cao, Yujue Wang, Yong Ding, Zhenwei Guo, Qianhong Wu, Hai Liang,
Blockchain-empowered security and privacy protection technologies for smart
grid, Comput. Stand. Interfaces 85 (2023) 103708.
[6] Noureddine Chikouche, Pierre-Louis Cayrel,

---

Internet of Things 30 (2025) 101469
6
J.S. Yalli et al.
Table 2
Inclusion and exclusion criteria.
Criteria Inclusion criteria Exclusion criteria
Publication year 2014–2023 Not between 2014–2023
Type Journal articles and full conference papers Abstract-only papers, tutorials, seminars, interviews, and blog
posts
Language English Non-English
Availability Full-text articles available for review Incomplete or inaccessible studies
Relevance Focus on IoT authentication schemes Not addressing IoT authentication mechanisms
Authentication proof Works that include algorithms/pseudo-code with security
analysis
Works that do not provide any algorithm or analysis
Publication status Peer-reviewed and final versions Unpublished or pre-print versions
Access type Open access or subscription-based articles via institutional
login
Non-accessible (restricted or pay-walled)
Fig. 1. Flowchart of articles inclusion & exclusion criteria.
• IoT OR Internet of Things
• IoT Security
• IoT AND Authentication
• Authentication Algorithm OR Lightweight Authentication
• IoT Authentication Analysis
No filters were applied initially to ensure a comprehensive result of potentially relevant studies, so 4472 papers were displayed.
Once the broad pool of articles was obtained, multiple filters were used to refine the results based on publication date (restricted
to the last decade), language (English only), and document type (journal articles and full conference papers). Fig. 2 illustrates the
initial search results, showing the distribution of articles across the selected databases.
3.2. Inclusion and exclusion criteria
All retrieved studies were meticulously evaluated during the article screening phase based on the inclusion and exclusion criteria,
as specified in Table 2. These criteria guided the selection process, ensuring that only papers addressing IoT authentication schemes
were used in this review. Articles not aligning with the criteria were excluded from further analysis, and 4372 articles we

---

of IIoT terminals and high latency fault of 
existing auditing schemes. Through data files being encoded using exact-repair regenerating codes, computation of authentication 
tags using ZSS signatures, and the use of a multi-level dynamic hash table (ML-DHT), the scheme is very capable of enhancing data 
I This article is part of a Special issue entitled: ‘Data Security for IIOT’ published in Internet of Things.
∗ Corresponding author.
E-mail address: hwtan@zstu.edu.cn (H. Tan).
https://doi.org/10.1016/j.iot.2025.101765
Internet of Things 34 (2025) 101765 
Available online 17 September 2025 
2542-6605/© 2025 Elsevier B.V. All rights are reserved, including those for text and data mining, AI training, and similar technologies.

---

damental content, namely 
English, to recreate the texts from complete recordings without any 
marked training data. M2M is introduced by Rafiullah et al. [ 110 ]. The 
Internet-of-the-Things can be thought of as the future assessment of the 
Internet for M2M learning. The IoT brings some kind of intelligence into 
Internet-connected devices to exchange and communicate information, 
invoke operations, make decisions, and provide superior service. FPGA 
is introduced by Schellen-Berg et al. [ 111 ]. This article introduces Field 
Programmable Gate Arrays, which are gaining popularity, especially in 
rapid prototyping. For the realization of the encryption algorithm, not 
only the speed and the size of the loop. It also covers its potential side 
effects. CRT is introduced by Zoyousefein et al. [ 112 ]. A new wire -
tapping approach is used to remotely read CRT displays. The light in -
tensity released by the raster scan screen is combined using an instinct 
response of a phosphor as a video signal. This article describes experi -
ments performed using a personal computer color display to demon -
strate that adequate high-frequency components remain in the produced 
light to reconstruct decipherable texts by deconvolving the received 
signal with the faster photo sensor. Even these diffuse optical reflectors 
can receive these optical tradeoffs.
Transmission Attack/Threat: This attack affects the metrics 
transmitting the engineering projects. Schedule risk is introduced by 
Yang et al. [ 113 ]. The transmission attack in engineering projects in -
cludes the schedule, quality, safety, cost, and other risks. However, the 
project risks are unavoidable in all engineering projects. The quality of 
transmission risk control directly or indirectly affects the project capa -
bility. This article combines the actual situation and sums up the mobile 
BS transmission access project in the progress of the existence of a va -
riety of factors in the assessment to formulate speci","This paper proposed a novel and lightweight authentication scheme
for securing interconnected devices in the rapidly growing Internet
of Things (IoT) environment. Recognizing the limitations of traditional
cryptographic methods for resource-constrained IoT devices,
we leveraged the combined strengths of blockchain technology and
lattice cryptography to address scalability, quantum vulnerability, and
computational overhead challenges. Our research implemented a decentralized
identity management model based on blockchain, eliminating
central points of failure and strengthening system resilience.
We also developed an efficient lattice-based protocol for user and
device authentication, utilizing simplified hash operations and matrix–
vector multiplication to significantly reduce computational complexity
and communication overhead. At a 100-bit security level, our scheme
achieves authentication and key agreement in 257.401 μs with a communication
cost of 1052 bits. Comprehensive performance analysis
demonstrated the scheme’s resistance to common cryptographic attacks
and quantum computing threats, while its blockchain-based design offers
strong scalability for large-scale IoT deployments. Future research
will focus on exploring advanced consensus mechanisms for further
reducing computational overhead, investigating cross-chain authentication
protocols for heterogeneous IoT environments, and developing
adaptive security parameters to optimize the balance between security
and performance.",,,,,,,
What are the highlights of the scientific article Distributed Ledgers and Security Mechanisms on Radio Access Networks: A Systematic Review?,"Journal Pre-proof
Distributed Ledgers and Security Mechanisms on Radio Access Networks: A Systematic Review
Daniel Hindemburg de Miranda Marques and Dalton Cézane Gomes Valadares
PII: S2096-7209(25)00122-8
DOI: https://doi.org/10.1016/j.bcra.2025.100395
Reference: BCRA 100395
To appear in: Blockchain: Research and Applications
Received date: 13 February 2025
Revised date: 4 June 2025
Accepted date: 16 July 2025
Please cite this article as: D.H. de Miranda Marques and D. Cézane Gomes Valadares, Distributed Ledgers and Security Mechanisms on Radio Access
Networks: A Systematic Review, Blockchain: Research and Applications, 100395, doi: https://doi.org/10.1016/j.bcra.2025.100395.
This is a PDF ﬁle of an article that has undergone enhancements after acceptance, such as the addition of a cover page and metadata, and formatting for
readability, but it is not yet the deﬁnitive version of record. This version will undergo additional copyediting, typesetting and review before it ispublished in its
ﬁnal form, but we are providing this version to give early visibility of the article. Please note that, during the production process, errors may be discovered which
could affect the content, and all legal disclaimers that apply to the journal pertain.
© 2025 Published by Elsevier.

---

Author contributions 
 
U
se this form to specify the contribution of each author of your manuscript. A distinction is made 
between five types of contributions: Conceived and designed the analysis; Collected the data; 
Contributed data or analysis tools; Performed the analysis; Wrote the paper. 
For each author of your manuscript, please indicate the types of contributions the author has made. 
An author may have made more than one type of contribution. Optionally, for each contribution 
type, you may specify the contribution of an author in more detail by providing a one-sentence 
statement in which the contribution is summarized. In the case of an author who contributed to 
performing the analysis, the author’s contribution for instance could be specified in more detail as 
‘Performed the computer simulations’, ‘Performed the statistical analysis’, or ‘Performed the text 
mining analysis’. 
If an author has made a contribution that is not covered by the five pre-defined contribution types, 
then please choose ‘Other contribution’ and provide a one-sentence statement summarizing the 
author’s contribution. 
 
Manuscript title:  Distributed Ledgers and Security Mechanisms on Radio Access Networks: A 
Systematic Review 
 
Author 1: Daniel Hindemburg de Miranda Marques 
 
[X] Conceived and designed the analysis
 
Specify contribution in more detail (optional; no more than one sentence) 
[X] Collected the data 
Read, selected, and accepted papers 
[X] Contributed data or analysis tools 
Read, selected, and accepted papers 
[X] Performed the analysis 
Read, selected, and accepted papers 
[X] Wrote the paper 
Specify contribution in more detail (optional; no more than one sentence) 
☐ Other contribution 
Specify contribution in more detail (required; no more than one sentence) 
 
Author 1: Dalton Cézane Gomes Valadares 
 
[X] Conceived and designed the analysis
 
Specify contribution in more detail (optional; no more than one sentence) 
[X] Collected the data 
Read, sel

---

Other publishers collectively con-
tributed 18 journal papers (6%) and 17 conference papers (6%). The 
data highlights IEEE’s dominance in both journal and conference pa-
pers, followed by substantial contributions from Springer and Elsevier. 
Other publishers, such as MDPI, Hindawi, and Tech Science Press, also 
play important roles in this research domain.
3. Results and discussion
3.1. Security concerns in IoMT
As shown in Fig. 8, the research topics in IoMT security span a broad 
spectrum. The topics with the most publications are privacy (53 papers), 
IDSs (42 papers), authentication (35 papers) and secure frameworks 
(35 papers). These areas are followed by attack detection (28 papers), 
encryption (28 papers), and trust management(18 papers). Data man-
agement, access control, and data transmission appear in 18, 21, and 25 
papers, respectively. Security assessments and secure communication 
each account for 18 papers, while security has 35 papers. Fewer pub-
lications address data hiding (11 papers), evaluation frameworks (11 
papers), data sharing (21 papers), identiﬁcation (14 papers), and attack 
mechanisms (18 papers). Additionally, 14 papers fall under miscella-
neous research topics, highlighting the diversity and breadth of IoMT 
security research.
Fig. 9, [25] presents a Sankey diagram depicting the distribution of 
research articles by publisher and topic. Publishers are positioned on 
the left, with ﬂows indicating the number of articles directed toward re-
search topics on the right. Each ﬂow is annotated with article counts, 
providing a clear overview of how research is distributed across pub-
lishers and topics. This diagram highlights publication trends, revealing 
shifts in research focus across areas such as cybersecurity, privacy, and 
IoMT security. Fig. 10presents a clustered bar chart comparing the dis-
tribution of research articles across security topics and publishers. For 
instance, IEEE’s strong output in “Privacy” is evident, reﬂe

---

E. Shammar, X. Cui, A. Zahary et al. 
Fig. 1. Paper structure. 
As shown in Fig. 2, the search strategy and selection procedure 
are summarized in a ﬂowchart following the Preferred Reporting Items 
for Systematic Reviews and Meta-Analysis (PRISMA) standards. This 
ﬂowchart illustrates the methodology by outlining each stage of the 
selection process and indicating the number of articles included and 
excluded. The process begins with the removal of duplicate documents. 
In the second phase, selection is guided by inclusion criteria 1 and 2 
and exclusion criteria 1 and 2. Phase 3 involves scanning the titles and 
abstracts of the articles to ensure compliance with inclusion and exclu-
sion criteria 2. In the eligibility phase, papers not published in reputable 
journals are excluded. Finally, a full-text review of the articles is con-
ducted.
Upon completion of the article review process, the ﬁndings were 
synthesized into a taxonomy of IoMT security. This taxonomy was con-
structed through a comprehensive examination and analysis of the se-
lected publications, enabling the eﬀective categorization of the various 
aspects of IoMT security research.
A full-counting relevance study using the VOSviewer [24], a widely 
used tool for visualizing scientiﬁc landscapes based on the co-occurrence 
of terms or subjects in datasets, is shown in Fig. 3. The visualization in-
cludes terms that occur more than ﬁve times, resulting in 51 selected 
terms out of 791. The ﬁgure presents a network visualization of key 
terms in the IoMT ﬁeld, with security positioned at the core. Key con-
cepts include IoMT, privacy, and IoT, underscoring the importance of 
secure and interconnected medical devices. The interdisciplinary nature 
of this ﬁeld integrates AI, ML, and medical services. Other prominent 
terms include blockchain, authentication, Federated Learning(FL), and 
cloud computing, which emphasize data integrity and secure access. The 
map emphasizes the importance of security mec","The evolution of mobile communication based on openness, softwarization, and virtualization inserts new vulnerabilities into networks.
• The increasing number of connected devices, especially IoT ones, is a security attention point in mobile networks.
• Various security mechanisms, including Distributed ledger technologies (DLT), may enhance RAN security once these technologies can increase system
resilience.
• Other security approaches may also address RAN security issues.",,,,,,,
Explain the cross-domain data sharing scheme presented in the scientific article Efficient and Secure Cross-Domain Data Sharing Scheme with Traceability for Industrial Internet!,"W. Luo et al.
However, data silos among multiple manufacturers are a major
challenge that conventional industrial data sharing methods find dif-
ficult to solve: Due to the distribution of data across different domains,
it is difficult to achieve cross-domain data flow solely through data
sharing methods within a single domain. For instance, a manufacturing
enterprise needs to share data with its partners or production agents.
These datasets contain privacy information, including business strate-
gies, key technologies, feature parameters, etc. In this situation, all
partners urgently need to obtain these private data. However, differ-
ent domains have different attribute divisions and access policies, so
existing single-domain ABE-based data sharing schemes cannot directly
perform cross-domain data sharing. This article will construct a secure
and efficient cross-domain data sharing scheme based ABE to protect
industrial data privacy and prevent unauthorized access.
1.2. Contribution
In this paper, we present an improved ciphertext policy attribute-
based encryption (CP-ABE) concrete structure and propose a trace-
able cross-domain data sharing scheme for Industrial Internet com-
bined with proxy re-encryption technology to achieve secure cross-
domain data flow and ensure the privacy and confidentiality of critical
industrial data. Our research concentrates on the following points.
(1) A traceable and efficient CP-ABE (TE-CP-ABE) specific con-
struction is proposed, which utilizes outsourced decryption based on
key conversion and white-box tracing to tackle the issues of high
computational cost and key abuse in resource-constrained clients. TE-
CP-ABE prevents the proxy server from acquiring any knowledge about
sensitive data and only provides outsourced decryption services to users
who meet the access policy.
(2) A secure cross-domain data sharing scheme constructed on TE-
CP-ABE and proxy re-encryption technology is presented. It utilizes
the TE-CP-ABE to achiev

---

rts policy hiding, effective dispersing the computational and
management pressure of a single attribute authority (AA), adapting to
the needs of large-scale users and complex attributes, but also bringing
more complex system management and coordination problems [19].
Subsequently, Niu et al. solved the problem of data redundancy and
privacy by introducing attribute-based search encryption technology
to encrypt and retrieve data without revealing user privacy [20]. This
scheme uses an edge server to assist decryption, which reduces the cost
of resource-limited users.
2.2. Cross-domain data sharing scheme
The above schemes are suitable for single-domain environments and
lack the capability to support multi-domain data sharing, which is not
conducive to realizing the full value of data and limits opportunities
for innovation and collaboration. To solve the problem, Shen et al.
proposed a framework to enhance the security of device authentication
in the cross-domain Industrial Internet of Things (IIoT) environment
by using blockchain technology [21]. Chi et al. proposed an effective
and secure cross-domain data sharing protocol for the IIoT, which uses
identity authentication technology to achieve access control of data and
blockchain technology to ensure data security and traceability [10].
The scheme proposed in Ref. [22] provides a cross-domain data sharing
scheme based on centralized cloud platforms and blockchain that main-
tains trust relationships between different domains for manufacturing
collaboration. Cheng et al. combined edge computing and blockchain
technologies with public key encryption with keyword search (PEKS)
to achieve efficient and secure cross-domain data sharing, while en-
suring privacy protection and data integrity [23]. Yu et al. propose
a blockchain-based enhanced security access control scheme that ad-
dresses the semi-trustworthiness of smart factories cloud platforms
in IIoT while protecting data security [24]. Zeng et al. presented
a bloc

---

Contents lists available at ScienceDirect
Computer Networks
journal homepage: www.elsevier.com/locate/comnet
Efficient and secure cross-domain data sharing scheme with traceability for
Industrial Internet✩
Wei Luo
 ∗, Ziyi Lv, Chengzhe Lai, Tengfei Yang
School of Cyberspace Security, Xi’an University of Posts and Telecommunications, Xi’an, 710121, Shaanxi, China
A R T I C L E I N F O
Keywords:
Industrial Internet
Data sharing
Cross-domain
CP-ABE
Traceability
A B S T R A C T
As the Industrial Internet undergoes swift growth, secure data sharing has become a crucial issue. However,
currently most schemes are mainly applied to single-domain environments, and with the increasing demand
for data sharing among various parties, the need for cross-domain data interaction becomes increasingly
urgent. To solve the problem, we propose an efficient and secure industrial data cross-domain sharing scheme
based on traceable CP-ABE in this paper. Firstly, a traceable and efficient CP-ABE is proposed, called TE-
CP-ABE, which utilizes key conversion and key sanity check to reduce the computational complexity of the
client and enable the tracking of malicious users, respectively. Secondly, based on TE-CP-ABE and proxy re-
encryption technology, we design a traceable and secure cross-domain data sharing scheme for Industrial
Internet. This scheme introduces domain proxies for cross-domain authentication and employs proxy re-
encryption technology to facilitate policy transformation, breaking down attribute differences between different
domains. TE-CP-ABE has been proven to achieve IND-CPA security under the decisional q-BDHE problem, and
it efficiently prevents malicious users from abusing their keys. Finally, the proposed scheme is compared with
the existing schemes in terms of theoretical analysis and experimental simulation. The results show that the
proposed scheme has certain advantages in terms of computing and storage overhead.
1. Introduction
Industrial Internet, as a model of

---

W. Luo et al.
architectures [27]. Then, the attribute-based access control (ABAC)
model is used to address cross-domain access challenges in distributed
multi-autonomous networks [28,29]. In cross-domain scenarios, data
security and access policies may change frequently, and data owners
usually hope to have more precise control over data access permissions
to meet different access requirements of different users or organiza-
tions [30]. These efforts focused on building efficient cross-domain
sharing frameworks, but neglected the data management design re-
quired for cross-domain sharing.
Bai et al. introduced the idea of a trustworthy third-party and a
center for attribute mapping to achieve effective cross-domain access
control by establishing trust relationships and defining attribute map-
ping rules [31]. The above works focused on the data management
design of attribute-based encryption protocols but did not fully consider
the efficient network architecture required to support cross-domain for
Industrial Internet. Li et al. presented a CP-ABE-driven approach for
secure data exchange across different domains that allows authorized
users from different domains to securely access and share data [32].
However, this article did not provide specific data analysis and security
proof, which may limit readers’ accurate evaluation of the validity and
feasibility of the model in practical applications. Zhang et al. [33]
introduced a CP-ABE-enabled decentralized method for fine-grained
access control of Industrial data. Nonetheless, this scheme insufficiently
considers issues such as key abuse and resource-constrained users.
In addition, some scholars have explored cross-domain sharing
schemes for secure data in machine learning scenarios based on tech-
niques such as differential privacy and federated learning, in order
to promote knowledge sharing among multiple intelligent edge de-
vices [34]. Liang et al. has proposed a personal data privacy protection
scheme based on","The above schemes are suitable for single-domain environments andlack the capability to support multi-domain data sharing, which is notconducive to realizing the full value of data and limits opportunitiesfor innovation and collaboration. To solve the problem, Shen et al.proposed a framework to enhance the security of device authenticationin the cross-domain Industrial Internet of Things (IIoT) environmentby using blockchain technology [21]. Chi et al. proposed an effectiveand secure cross-domain data sharing protocol for the IIoT, which usesidentity authentication technology to achieve access control of data andblockchain technology to ensure data security and traceability [10].The scheme proposed in Ref. [22] provides a cross-domain data sharingscheme based on centralized cloud platforms and blockchain that main-tains trust relationships between different domains for manufacturingcollaboration. Cheng et al. combined edge computing and blockchaintechnologies with public key encryption with keyword search (PEKS)to achieve efficient and secure cross-domain data sharing, while en-suring privacy protection and data integrity [23]. Yu et al. proposea blockchain-based enhanced security access control scheme that ad-dresses the semi-trustworthiness of smart factories cloud platformsin IIoT while protecting data security [24]. Zeng et al. presenteda blockchain-based inter-domain data sharing protocol using zero-knowledge proof and key agreement protocol to guarantee data securityand privacy in IIoT. However, data encryption adopts symmetric en-cryption (SE), which can only perform one-to-one access control, andthe access policy is not flexible enough [25]. Despite the prospects arepromising, the combination of blockchain and data governance stillfaces some challenges, and the privacy of the data still need to beexplored [26].
In a multi-domain environment, it is difficult for users to accessdata due to complex inter-domain authentication and lack of uni-fied access standards which can lead to potential privacy leakage. Niet al. presented an attribute-based access control approach that con-fronts the challenge of cross-domain access control in service-oriented
Computer Networks 260 (2025) 111117
2
W. Luo et al.
architectures [27]. Then, the attribute-based access control (ABAC)
model is used to address cross-domain access challenges in distributed
multi-autonomous networks [28,29]. In cross-domain scenarios, data
security and access policies may change frequently, and data owners
usually hope to have more precise control over data access permissions
to meet different access requirements of different users or organizations
[30]. These efforts focused on building efficient cross-domain
sharing frameworks, but neglected the data management design required
for cross-domain sharing.
Bai et al. introduced the idea of a trustworthy third-party and a
center for attribute mapping to achieve effective cross-domain access
control by establishing trust relationships and defining attribute mapping
rules [31]. The above works focused on the data management
design of attribute-based encryption protocols but did not fully consider
the efficient network architecture required to support cross-domain for
Industrial Internet. Li et al. presented a CP-ABE-driven approach for
secure data exchange across different domains that allows authorized
users from different domains to securely access and share data [32].
However, this article did not provide specific data analysis and security
proof, which may limit readers’ accurate evaluation of the validity and
feasibility of the model in practical applications. Zhang et al. [33]
introduced a CP-ABE-enabled decentralized method for fine-grained
access control of Industrial data. Nonetheless, this scheme insufficiently
considers issues such as key abuse and resource-constrained users.
In addition, some scholars have explored cross-domain sharing
schemes for secure data in machine learning scenarios based on techniques
such as differential privacy and federated learning, in order
to promote knowledge sharing among multiple intelligent edge devices
[34]. Liang et al. has proposed a personal data privacy protection
scheme based on federated blockchain [35]. Wang et al. proposed a
multi-party collaborative privacy preservation mechanism based on
federated learning with differential privacy (DP) preservation technique,
which ensures sufficient anonymity of the published aggregated
information [36]. However, due to the essence of differential privacy is
to perturb the data and the noise added is random, the estimated value
will have certain variance, thus affecting the accuracy of the data. In
addition, attackers may infer certain features of the original data by
analyzing model updates, so it is still necessary to combine encryption
techniques to further enhance privacy and security.
We have performed a thorough analysis of current industrial data
sharing methodologies, such as conventional CP-ABE based sharing
schemes [16,17] and the schemes [23–25,31,34,36] that support crossdomain
sharing, and conducted comparative analysis. The results are
shown in Table 1, where ‘‘interaction’’ refers to the relationship between
the ciphertext and the decryption key. For instance, in Symmetric
Encryption (SE), a ciphertext can only be decrypted with a unique
key. In contrast, with Attribute-Based Encryption (ABE), a ciphertext
can be decrypted using different private keys, enabling a single encryption
to allow multiple requestors who satisfy the policy to access
the data with their own private keys, achieving more flexible access
control.
Both CP-ABE and federated learning technologies can achieve information
sharing among different participants, with the distinction lying
in the type of information shared. In the federated learning framework,
each participant trains a model using their own data and shares only
the model parameters or update information with the central server,
rather than the raw data directly. In the CP-ABE framework, each
participant can encrypt their own raw data using CP-ABE and share
the ciphertext with recipients who meet the access policy, ensuring that
the raw data remains inaccessible to unauthorized users. Nevertheless,
these schemes have their constraints.
(1) The conventional CP-ABE based sharing schemes focus on sharing
within a single domain. However, in the Industrial Internet, crossdomain
data sharing is an inevitable requirement. Therefore, traditional
sharing schemes based on CP-ABE are not applicable to crossdomain
scenarios. In addition, key abuse is a challenge faced by traditional
CP-ABE applications. Users may abuse their attribute keys and
cannot be traced.
(2) Current schemes for cross-domain data sharing suffer from
high computational costs and do not support flexible access control.
However, the industrial Internet system encompasses a vast array of
resource-limited mobile devices. Therefore, existing cross-domain data
sharing schemes need to be improved in performance and functionality.
(3) Although cross-domain sharing schemes based on blockchain
provide tamper proof and",,,,,,,
"Identify and provide a detailed explanation of the research questions addressed in the scientific article Quantum Blockchain for Internet of Things: A Systematic Review, Proposed Solutions and Challenges.","Contents lists available at ScienceDirect
Computers and Electrical Engineering
journal homepage: www.elsevier.com/locate/compeleceng  
Quantum Blockchain for Internet of Things: A systematic review, 
proposed solutions and challenges
Diksha Chawla a, Saru Kumari b
 , Rajkumar Singh Rathore c
 ,
Pawan Singh Mehra d
 ,1,∗, Ashok Kumar Das e, Neeraj Kumar f
a Department of CSE and IT , Jaypee Institute of Information Technology, Noida, India
b Department of Mathematics , Chaudhary Charan Singh University, Meerut, India
c Cardiff School of Technologies , Cardiff Metropolitan University, Cardiff, United  Kingdom
d Department of CSE , Delhi Technological University, Delhi, India
e Center for Security, Theory and Algorithmic Research , International Institute of Information Technology, Hyderabad, India
f Department of CSE , Thapar University, Patiala, India
A R T I C L E  I N F O
Keywords:
Blockchain
Authentication
Security
Internet of Things (IoT)
Quantum cryptography
Review
 A B S T R A C T
Blockchain and IoT systems have become the focal point of extensive research efforts in 
academia and industry. Recent studies have honed in on utilizing Blockchain technology to 
enhance trust management within IoT networks. Despite the potential benefits across various 
applications, existing blockchain platforms hinge on digital signatures, public key cryptography, 
Zero-Knowledge Proofs, and hash functions, making them susceptible to attacks facilitated 
by Quantum computers. Motivated by these vulnerabilities, this survey paper emphasizes the 
importance of incorporating Quantum Blockchain technology into the IoT landscape to establish 
trust among IoT devices. Specifically, we provide an overview of Blockchain technology and 
its security implications in the context of IoT security. The primary goal of this paper is to 
propose a Novel Quantum Blockchain framework that protects from classical and Quantum 
computing attacks. For this purpose, this article examines Quantum crypt

---

Journal of Network and Computer Applications 237 (2025) 104130
5
N. Anjum et al.
Table 1
List of research questions.
No Research questions Motivation
1 What are the security and privacy problems in
IIoT big data?
This motivates us to study IIoT survey articles regarding big
data security and privacy.
2 What are the different security loopholes, and how
do we overcome these problems?
It aims to identify attacks and explore technology enablers
(blockchain, FL, and 6G) to resolve security threats and
privacy concerns in industrial big data.
3 How do the technology enablers help to carry out
secure big data management (data acquisition and
sharing, data analytics, and data storage)
operations?
This aims to provide the critical analysis (i.e., problems,
solutions, advantages, simulation tools, and technology
enablers to address security and privacy issues) in data
acquisition and sharing, analytics, and storage.
4 What is the practical use of this study, and what
are the research challenges of IIoT big data
communication?
The different sector’s real-life industrial applications are
studied. Moreover, its objective is to provide open-issue and
research solutions for secure industrial big data operations.
Table 2
List of major acronyms used in this article.
Acronyms Definitions Acronyms Definitions
ACO Aunt Colony Optimization IIoT Industrial Internet of Things
AE Autoencoder IoE Internet of Everything
AI Artificial Intelligence IoT Internet of Things
API Application Programmable Interface IPFS Interplanetary File System
BC Blockchain IT Information Technology
CA Certification Authority LSTM Long Short-Term Memory
CIA Confidentiality, Integrity, and Availability MiTM Man-In-The-Middle
CNN Convolutional Neural Network MPC Multi-Party Computation
CPS Cyber–Physical Systems ML Machine Learning
CPU Central Processing Unit MT Mobile Terminal
CSO Chicken Swarm Optimization mURLLC Massive Ultra-Reliable and Low-Latency Communications
dApps Decentralized Applications NIB Network-I

---

Contents lists available at ScienceDirect
Internet of Things
journal homepage: www.elsevier.com/locate/iot  
Review article
Big data and Internet of Things applications in smart cities: Recent 
advances, challenges, and critical issues
Elias Dritsas
 ∗, Maria Trigka
Department of Informatics and Computer Engineering, University of West Attica, Egaleo Park Campus, Athens, 12243, Greece
A R T I C L E  I N F O
Keywords:
Internet of Things
Big data
Smart cities
Emerging trends
Urban intelligence
 A B S T R A C T
The rapid urbanization of modern cities has been propelled by the convergence of the 
Internet of Things (IoT) and Big Data, enabling real-time monitoring, predictive analytics, and 
intelligent automation across transportation, energy, healthcare, and public safety. This survey 
systematically reviews advancements in IoT-enabled infrastructure, Big Data analytics, edge 
and cloud integration, digital twin technology, and blockchain for secure and scalable data 
management. The literature selection focused on peer-reviewed works published from 2020 
onward, prioritizing journal and conference papers that present concrete smart city deployment 
or technical frameworks. Each technological domain is examined with respect to its operational 
benefits, limitations, and role in enabling resilient urban ecosystems. Emerging trends such 
as 6G-enabled IoT, federated learning (FL), quantum computing, and swarm intelligence are 
explicitly contextualized in terms of their maturity, current research focus, and prospective im-
pacts. To address persisting challenges, including scalability bottlenecks, interoperability gaps, 
cybersecurity threats, and data governance issues, the survey identifies actionable directions 
such as geospatial data standardization, energy-aware orchestration, and lightweight consensus 
mechanisms. These targeted measures provide a foundation for guiding future research and 
practice toward secure, efficient, and human-centric smart city develop

---

S. Jamshidi et al.
3. Methodology
This systematic review follows the structured methodology for conducting systematic reviews outlined by Kitchenham and 
Charters [30], ensuring a rigorous approach to planning, execution, and reporting. The process commenced with formulating well-
defined research questions to establish a clear direction for the review. A comprehensive keyword selection was then undertaken to 
develop a robust search strategy, ensuring the identification of the most relevant studies within the domain. Explicit inclusion and 
exclusion criteria were established to filter the retrieved literature and maintain transparency and reproducibility systematically. 
Next, a structured data extraction process was implemented, aligning with the research questions to facilitate the systematic 
organization and relevance of the collected data. Finally, the extracted information underwent data synthesis and analysis, 
integrating key findings to identify emerging trends, existing research gaps, and critical insights into the role of LLMs in IoT security.
3.1. Research questions (RQs)
The primary objective of this systematic review is to examine the application of LLMs in the context of IoT security and 
privacy. This involves a detailed analysis of various LLM-driven security mechanisms, their effectiveness in threat detection, privacy 
preservation, and automated cybersecurity intelligence, and the challenges and future directions in this emerging domain (Section 4). 
To systematically address this objective, the following RQs have been formulated:
• RQ1: What are the LLM-driven solutions to improve the security and privacy of IoT systems?
This research question investigates existing applications of LLMs in enhancing IoT security and privacy. It explores their role 
in intrusion detection, anomaly detection, automated threat intelligence, and privacy-preserving mechanisms. The aim is to 
identify the most commonly used models and techniques for securing IoT syste","1.
RQ1: How can blockchain’s foundational characteristics and techniques be combined with IoT?
Motivations: Identify the attributes of blockchain, decentralize IoT using blockchain technology, and integrate blockchain with IoT.
2.
RQ2: Why should blockchain be utilized to implement privacy in IoT?Motivations: To identify the distributed ledger and smart contracts features that can be integrated with IoT.
3.
What impact does Quantum technology exert on the current security facets of Blockchain concerning IoT?Motivations: To identify the recent Quantum impact on the security of Blockchain-enabled IoT.
4.
What Quantum-related guidelines can be adhered to ensure the effective utilization of Quantum blockchain in the process of IoT authentication?Motivations: To pinpoint Quantum-resistant strategies applicable for safeguarding IoT and addressing the susceptibilities of Blockchain.",,,,,,,
Describe the performance evaluation presented in the scientific article Smart-Contract-Based Blockchain-Enabled Decentralized Scheme for Improving Smart-Grid Security.,"S. Solera-Cotanilla et al.
Declaration of competing interest
The authors declare that they have no known competing financial interests or personal relationships that could have appeared 
to influence the work reported in this paper.
Acknowledgements
The authors would like to thank the RAYUELA project (contract no. 882828) of the Horizon 2020 programme of the European 
Union for motivating this work. The content of the article reflects the views only of the authors. The European Commission is not 
responsible for any use that may be made of the information contained therein.
Data availability
No data was used for the research described in the article.
References
[1] M. Weiser, The computer of the 21st century, SIGMOBILE Mob. Comput. Commun. Rev. 265 (3) (1991) 66–75.
[2] K. Ashton, That internet of things thing: In the real world things matter more than ideas, RFID J. (2009).
[3] A. AlHogail, Improving IoT technology adoption through improving consumer trust, Technologies 6 (34) (2018).
[4] M.M. Alam, et al., A survey on the roles of communication technologies in IoT-based personalized healthcare applications, IEEE Access 6 (2018) 
36611–36631.
[5] Y. Lu, Industry 4.0: A survey on technologies, applications and open research issues, J. Ind. Inf. Integr. 6 (2017) 1–10.
[6] F. Alam, R. Mehmood, I. Katib, N.N. Albogami, A. Albeshri, Data fusion and IoT for smart ubiquitous environments: A survey, IEEE Access 5 (2017) 
9533–9554.
[7] S.H. Shah, I. Yaqoob, A survey: Internet of things (IOT) technologies, applications and challenges, in: 2016 IEEE Smart Energy Grid Engineering, SEGE, 
2016, pp. 381–385.
[8] S.T. Ambujam, B. Mallala, P. Aggarwal, P.V. Prasad, Enhanced IoT-enabled community microgrid energy management with hybrid COA-HQNN approach 
with battery degradation consideration, J. Energy Storage (2025).
[9] G. Senthilkumar, B. Mallala, S. Sivarajan, C. Harish, D. Harsha, L. Natrayan, Maximizing power utilization through machine learning and IoT based power 
flow st

---

iting – review & editing, Supervision, Funding acqui-
sition. Xiaolong Liu: Writing – review & editing, Supervision, Investi-
gation, Funding acquisition.
Declaration of competing interest
The authors declare that they have no known competing finan-
cial interests or personal relationships that could have appeared to
influence the work reported in this paper.
Acknowledgments
This work was supported in part by fund of scientific and techno-
logical innovation of Fujian agriculture and Forestry University (Grant
No. KFb22091XA), Project of Industry-university-institute Cooperation
in Colleges and Universities in Fujian Province (Grant No. 2022H6006,
2024H6007) and the Project of Software Technology Innovation Re-
search and Industrialization in Fujian Province (Grant No. 2024.488).
Data availability
Data will be made available on request.
References
[1] Number of Internet of Things (IoT) connected devices worldwide from 2019
to 2021, with forecasts from 2022 to 2030, 2018, https://www.statista.com/
statistics/1183457/iot-connected-devices-worldwide/ .
[2] Xu Yang, Xuechao Yang, Xun Yi, Ibrahim Khalil, Xiaotong Zhou, Debiao He, Xinyi
Huang, Surya Nepal, Blockchain-based secure and lightweight authentication for
Internet of Things, IEEE Internet Things J. 9 (5) (2021) 3321–3332.
[3] Soumyashree S. Panda, Debasish Jena, Bhabendu Kumar Mohanta, Somula
Ramasubbareddy, Mahmoud Daneshmand, Amir H. Gandomi, Authentication and
key management in distributed iot using blockchain technology, IEEE Internet
Things J. 8 (16) (2021) 12947–12954.
[4] Zesen Hou, Jianting Ning, Xinyi Huang, Shengmin Xu, Leo Yu Zhang, Blockchain-
based efficient verifiable outsourced attribute-based encryption in cloud, Comput.
Stand. Interfaces (2024) 103854.
[5] Ya-Nan Cao, Yujue Wang, Yong Ding, Zhenwei Guo, Qianhong Wu, Hai Liang,
Blockchain-empowered security and privacy protection technologies for smart
grid, Comput. Stand. Interfaces 85 (2023) 103708.
[6] Noureddine Chikouche, Pierre-Louis Cayrel,

---

cation (IDBA) method solves this issue by improving th e 
quality of service (Qos) in IoT devices and providing a steady bandwidth supply. The IDBA algorithm is fed a dataset of IoT 
bandwidth from smart home-based devices. Based on the degree of use, data sets from different IoT devices will be collected. To 
improve service quality, dynamic bandwidth allocation and machine learning are employed. In terms of specific metrics like time 
delay, accuracy, precision, recall, and other parameters the result is superior. 
© 2025 The Authors. Published by ELSEVIER B.V. 
This is an open access article under the CC BY-NC-ND license (https://creativecommons.org/licenses/by-nc-nd/4.0) 
Peer-review under responsibility of the scientific committee of the Sixth International Conference on Futuristic Trends in 
Networks and Computing Technologies (FTNCT06) 
Keywords: IoT, IDBA, QoS, Cluster. 
1. Introduction 
Everything in the industrial 4.0 revolution will have something to do with the internet. The target of the Internet 
of Things is to link as many devices as possible worldwide. There are several instances of this technology's potential 
applications.  For example, while you are driving to work, your car already knows the best way  to take and your 
mobile calendar syncs with your vehicle . Your car may contact your secretary to let her know you will be late to 
work if there is a lot of traffic. Businesses have a great chance to grow because to the Internet of Things. IoT apps 
 
Available online at www.sciencedirect.com 
ScienceDirect 
Procedia Computer Science 00 (2025) 000–000  
www.elsevier.com/locate/procedia 
 
1877-0509 © 2025 The Authors. Published by ELSEVIER B.V. 
This is an open access article under the CC BY-NC-ND license (https://creativecommons.org/licenses/by-nc-nd/4.0) 
Peer-review under responsibility of the scientific committee of the Sixth International Conference on Futuristic Trends in Networks and 
Computing Technologies (FTNCT06) 
Sixth International C

---

the current  infrastructure. The Improved Dynamic Bandwidth Allocation (IDBA) method solves this issue by improving th e 
quality of service (Qos) in IoT devices and providing a steady bandwidth supply. The IDBA algorithm is fed a dataset of IoT 
bandwidth from smart home-based devices. Based on the degree of use, data sets from different IoT devices will be collected. To 
improve service quality, dynamic bandwidth allocation and machine learning are employed. In terms of specific metrics like time 
delay, accuracy, precision, recall, and other parameters the result is superior. 
© 2025 The Authors. Published by ELSEVIER B.V. 
This is an open access article under the CC BY-NC-ND license (https://creativecommons.org/licenses/by-nc-nd/4.0) 
Peer-review under responsibility of the scientific committee of the Sixth International Conference on Futuristic Trends in 
Networks and Computing Technologies (FTNCT06) 
Keywords: IoT, IDBA, QoS, Cluster. 
1. Introduction 
Everything in the industrial 4.0 revolution will have something to do with the internet. The target of the Internet 
of Things is to link as many devices as possible worldwide. There are several instances of this technology's potential 
applications.  For example, while you are driving to work, your car already knows the best way  to take and your 
mobile calendar syncs with your vehicle . Your car may contact your secretary to let her know you will be late to 
work if there is a lot of traffic. Businesses have a great chance to grow because to the Internet of Things. IoT apps 
© 2025 The Authors. Published by Elsevier B.V .
This is an open access article under the CC BY-NC-ND license (https://creativecommons.org/licenses/by-nc-nd/4.0)
Peer-review under responsibility of the scientific committee of the Sixth International Conference on Futuristic Trends in Networks and 
Computing Technologies (FTNCT06)","Blockchain technology is used in SG systems to improve the security, transparency, and efficiency of energy management. Its performance is evaluated using three key cost metrics: computation cost, communication cost, and smart-contract execution cost. Computation cost measures the resources required for energy transactions, while communication cost assesses data exchange among grid nodes. Smart-contract execution cost is critical, encompassing both one-time deployment costs and ongoing costs for regular interactions.",,,,,,,
What is the conclusion of the scientific article Toward Zero Trust in 5G Industrial Internet Collaboration System?,"ScienceDirect
Available online at www.sciencedirect.com
Procedia Computer Science 259 (2025) 1270–1281
1877-0509 © 2025 The Authors. Published by Elsevier B.V .
This is an open access article under the CC BY-NC-ND license ( https://creativecommons.org/licenses/by-nc-nd/4.0 )
Peer-review under responsibility of the scientific committee of the Sixth International Conference on Futuristic Trends 
in Networks and Computing Technologies (FTNCT06)
10.1016/j.procs.2025.04.082
 
Available online at www.sciencedirect.com 
ScienceDirect 
Procedia Computer Science 00 (2025) 000–000  
www.elsevier.com/locate/procedia 
 
1877-0509 © 2025 The Authors. Published by ELSEVIER B.V. 
This is an open access article under the CC BY-NC-ND license (https://creativecommons.org/licenses/by-nc-nd/4.0) 
Peer-review under responsibility of the scientific committee of the Sixth International Conference on Futuristic Trends in Networks and 
Computing Technologies (FTNCT06) 
Sixth International Conference on Futuristic Trends in Networks and Computing Technologies (FTNCT06)  held in  
Uttarakhand, India 
Enhance Quality of Services in Internet of Things using 
Improved Dynamic Bandwidth Allocation (IDBA) Techniques 
Shekhara, Gaurav Bhandarib , Sudhanshu Tyagic 
aIcfai university, Dehradun, uttarkhand 248197,India  
                                                                                                                      bIcfai university, Dehradun, uttarkhand 248197,India  
 
Abstract 
The Internet of Things (IoT) is a frequently employed term in the twenty -first century. It is an important part of the Industrial 4.0 
revolution and has garnered industrial traction. By 2030, there will be approximately 50 billion Internet of Th ings devices, 
according to many projections. Some countries will expand around two -thirds of these IoT devices on their own. Numerous 
Internet of things or I oT issues might arise from inadequate computing power and broadband availability. These issues incl

---

se (http://creativecommons.org/licenses/by-nc-nd/4.0/)
Peer-review under responsibility of the scientific committee of the KES International.
Keywords: Internet of Things; Cybersecurity; Security audit; Home automation; Domoticz
1. Introduction
The Internet of Things (IoT) is a fast-developing technology that enables the connection of devices and objects
themselves, and the connection of these devices to the data processing servers. IoT technology is used in many areas
of life, including healthcare, communication and transport, power and goods delivery, buildings and cities manage-
ment [42], environmental monitoring, agriculture [35] and many others. An example, which is becoming popular, is
the use of this technology in homes, creating a so-called smart home [36]. Devices installed in buildings can help
manage the whole house from a single point or even from outside with the use of an internet connection. IoT makes it
possible to control heating, ventilation and air conditioning (HV AC) [44], light intensity, home appliances like vacuum
cleaners, microwave ovens, dishwashers, washing machines and many others. Advanced control algorithms connected
with green power sources can help to optimise energy consumption [18] and reduce the cost of energy by dynami-
cally adjusting the momentary energy use to the current price or generation level by a photovoltaic system [43]. This
∗ Corresponding author. Tel.: +48-32-237-2300 ; fax: +48-32-237-1655.
E-mail address: krzysztof.tokarz@polsl.pl
1877-0509 © 2025 The Authors. Published by Elsevier B.V .
This is an open access article under the CC BY -NC-ND license (http://creativecommons.org/licenses/by-nc-nd/4.0/)
Peer-review under responsibility of the scientific committee of the KES International.
© 2025 The Authors. Published by Elsevier B.V .
This is an open access article under the CC BY-NC-ND license (https://creativecommons.org/licenses/by-nc-nd/4.0)
Peer-review under responsibility of the scientific committee of the KES

---

ScienceDirect
Available online at www.sciencedirect.com
Procedia Computer Science 272 (2025) 625–630
1877-0509 © 2025 The Authors. Published by Elsevier B.V .
This is an open access article under the CC BY-NC-ND license (https://creativecommons.org/licenses/by-nc-nd/4.0)
Peer review under the responsibility of the scientific committee of the Program Chairs.
10.1016/j.procs.2025.10.258
10.1016/j.procs.2025.10.258 1877-0509
© 2025 The Authors. Published by Elsevier B.V .
This is an open access article under the CC BY-NC-ND license (https://creativecommons.org/licenses/by-nc-nd/4.0)
Peer review under the responsibility of the scientific committee of the Program Chairs.
 
Available online at www.sciencedirect.com 
ScienceDirect 
Procedia Computer Science 00 (2025) 000–000  
www.elsevier.com/locate/procedia 
 
1877-0509 © 2025 The Authors. Published by Elsevier B.V. 
This is an open access article under the CC BY-NC-ND license (http://creativecommons.org/licenses/by-nc-nd/4.0/) 
Peer-review under responsibility of the Conference Program Chairs.  
The 2nd International Workshop on Intelligent Mobile Systems based on Internet of Things 
October 28-30, 2025, Istanbul, Türkiye 
Securing the Industrial Internet of Things: Threats, Vulnerabilities, 
and Recommendations 
Akzhibek Amirovaa*, Laura Aldashevaa, Aliya Abdiramana 
aAstana IT University, Astana, 010000, Kazakhstan 
Abstract 
The Industrial Internet of Things (IIoT) is a key component of Industry 4.0, enabling intelligent automation, real -time data 
exchange, and integration of cyber -physical systems in industrial environments. However, the increasing complexity and 
interconnectivity of IIoT infrastructures introduce significant cybersecurity challenges. This paper provides a comprehensive 
overview of the current state of information security in IIoT systems. It begins with a conceptual analysis of IIoT and its distinctions 
from general IoT applications. The study reviews recent scientific research from 2018 to 2

---

Formal analysis, Con-
ceptualization. Quazi Mamun: Writing – review & editing, Validation, 
Methodology, Funding acquisition, Conceptualization. Arash Mah-
boubi: Writing – review & editing, Supervision, Methodology, Formal 
analysis, Conceptualization. Patrick Walsh: Writing – review & edit-
ing, Supervision, Investigation, Conceptualization. Md Zahidul Islam: 
Writing – review & editing, Supervision, Methodology, Formal analysis, 
Conceptualization.
Declaration of competing interest
The authors declare the following ﬁnancial interests/personal rela-
tionships which may be considered as potential competing interests: 
Sajal Halder reports ﬁnancial support was provided by Charles Sturt Uni-
versity (C1668AICF). Sajal Halder reports a relationship with Common-
wealth Scientiﬁc and Industrial Research Organisation that includes: 
employment. Author previously employed at RMIT University, Aus-
tralia. If there are other authors, they declare that they have no known 
competing ﬁnancial interests or personal relationships that could have 
appeared to inﬂuence the work reported in this paper.
Acknowledgement
This project is supported by funding from the AI and Cyber Futures 
Institute at Charles Sturt University, NSW, Australia (C1668AICF).
Data availability
No data was used for the research described in the article.
References
[1] T. Qureshi, M. Saeed, K. Ahsan, A.A. Malik, E.S. Muhammad, N. Touheed, Smart 
agriculture for sustainable food security using internet of things (iot), Wirel. Com-
mun. Mob. Comput. 2022 (2022) 1–10.
[2] V. Vostriakova, M.L. Swarupa, O. Rubanenko, S.L. Gundebommu, Blockchain and 
climate smart agriculture technologies in agri-food security system, in: Interna-
tional Conference on Artiﬁcial Intelligence and Data Science, Springer, 2021, 
pp. 490–504.
[3] H. Kaur, Modelling internet of things driven sustainable food security system, 
Benchmarking 28 (5) (2021) 1740–1760.
[4] World Population Prospects, United Nations, Department of Economic and","In this paper, we introduced the security issues in the 5G Industrial
Internet collaboration system, and presented an overview of the
current ZTA. Then, we presented a gap analysis between existing techniques
and the ZTA. Finally, we discussed several techniques that can
potentially be used in the ZT architecture.
Nowadays, the basic ZTA for the 5G Industrial Internet collaboration
system has been designed. However, several issues remain to be
addressed. First, how to develop various security techniques to achieve
the ZT goal is still a challenging problem. Second, existing authentication
is typically based on a single technique such as machine learning or
cryptography. Once the biometric or secret key is compromised, the entire
5G Industrial Internet collaboration system will be broken through.
Therefore, multi-modal authentication is desirable. Third, the factors
for trust assessment in different Industrial Internet scenarios may be
different, and how to quantitatively determine the trust degree is a
challenging problem. Fourth, unlike the existing perimeter-based techniques,
the access control techniques in the ZTA are based on the trust
level of the subject and the requesting asset. In this case, the access
control techniques should be able to minimize the authorization of the
subject. Furthermore, since the trust level of the subject and the asset
may change over time, dynamic access control techniques are desired.
In summary, to realize a ZTA in the 5G Industrial Internet collaboration
systems requires to employ multiple security techniques, multi-modal
authentication, quantitative trust assessment, and fine-grained and dynamic
access control techniques. These researches are essential to ensure
the security of the systems and to mitigate the potential risks of
multiple and increasingly sophisticated attacks.",,,,,,,
Explain the application layer as discussed in the scientific article Privacy and Security of Wearable Internet of Things: A Scoping Review and Conceptual Framework Development for Safety and Health Management in Construction.,"processing raw data collected in the perception layer to generate
meaningful information used in the application layer to make real-time
decisions to improve safety monitoring. This layer consists of hardware,
software, and cloud computing services working together for the desired
output ( Aqeel-ur-Rehman et al., 2016 ). As the store house of collected
data, the computational layer is equipped with robust security measures
to ensure the privacy of the collected data and avoid data breaches
( Mukherjee et al., 2017 ). These privacy and security measures are
reviewed in subsequent sections.
4.3.4. Application layer
The application layer is the end-user of the cycle where the infor-
mation obtained and processed is used for the intended purpose. This
layer promotes the development of an IoT system as it is the reason for
the development of the entire system ( Farooq et al., 2015 ). In the con-
struction industry, real-time information on construction workers and
the work environment could help safety officers and construction
workers make more informed proactive decisions to improve safety and
health performance. For instance, WIoT can monitor the vital signs and
locations of construction workers in real-time. This information can be
instantly relayed to safety officers, who can respond swiftly in the event
of an emergency or if a worker ’ s health is compromised. Such proactive
measures can save lives and prevent accidents. In some cases, this in-
formation contains personal information that can be used to identify
individuals, thereby presenting the need to provide security measures to
protect such information.
4.4. WIoT Privacy and security challenges (RQ3)
Security and privacy are of primary concern to any industry that
collects and transmits personal data transmitted over the internet.
Without proper infrastructure and security protocol for privacy and se-
curity management of data, the same advantages of IoT, such as easy
location and identification of individual

---

Review Article
A comprehensive review of cybersecurity vulnerabilities, threats, and 
solutions for the Internet of Things at the network-cum-application layer
Abdul Razaque
a , *
, Salim Hariri
b
, Abrar M. Alajlan
c
, Joon Yoo
d
a
International Information Technology University, Manas 34/1, Almaty Kazakhstan
b
University of Arizona, Tucson, Arizona, United States
c
Self-Development Skills Department, Common First Year Deanship, King Saud University, 11362, Riyadh, Kingdom of Saudi Arabia
d
School of Computing, Gachon University, 1342 Seongnam-daero, Seongnam-si, 13120, Gyeonggi-do, Republic of Korea
ARTICLE INFO
Keywords:
Internet of Things
Cyber security
Real-time
Controlling system
Data mining
Scientific decision-making system
Vulnerabilities
Security attacks
ABSTRACT
The proliferation of smart homes, smart logistics, and other technologies has expedited the expansion of Internet- 
of-Things (IoT) devices. This expansion has heightened the complexity of associated security challenges. Despite 
extensive research on IoT security, several studies fail to provide a comprehensive examination of both the 
network and application layers. This is particularly applicable to real-time and mission-critical settings. This 
review addresses that deficiency by offering a systematic review of IoT across five tiers. It concentrates on the 
application layer, categorizing it into three domains: real-time control systems, scientific decision-making sys -
tems, and query/scan search systems. The study examines vulnerabilities, attack vectors, and security measures 
in real-time control and query/scan systems. It examines how emerging technologies such as artificial intelli -
gence (AI), Software Defined Networking (SDN), and fog/edge computing can enhance security via improved 
context awareness and access management. The study ultimately presents recommendations and suggests en -
hancements to foster trust, scalability, and enhanced security in contemporary IoT systems.
1. Intro

---

ted architecture where the layers of FL and IoMT can be 
knotted u p for ensuring privacy and security. This proposed architecture model, further elaborates a distributed working 
environment. This paper illustrates how FL helps in securing the data produced by the different IoMT devices through the proposed 
architecture. The challenges involved in the deployment of FL in the framework of IoMT along with potential research directio ns 
are discussed further in this research. 
© 2025 The Authors. Published by ELSEVIER B.V. 
This is an open access article under the CC BY-NC-ND license (https://creativecommons.org/licenses/by-nc-nd/4.0) 
Peer-review under responsibility of the scientific committee of the International Conference on Machine Learning and Data 
Engineering 
Keywords: : Federated Learning; IoMT Security; Internet of Medical Things; IoMT Data Attacks; Optimization; 
1. Main text  
Smart Healthcare system (SHS) [1] is a developing approach in healthcare that integrates advanced trends and 
technologies, such as Artificial Intelligence (AI), Deep Learning (DL), Big Data Analytics (BDA), Internet of Things 
(IoT), Machine Learning (ML), etc., to improve the patient’s healthcare experience, streamline clinical workflows, 
facilitate precision medicine and manage supply chain effectively. SHS have outgrown the conventional healthcare 
positively and have impacted many lives already. IoT plays  a vital role in building SHS as it interconnects networks 
of devices, sensors, and medical applications. When IoT is used for interconnection of medical devices, it is termed 
2 Author name / Procedia Computer Science 00 (2025) 000–000 
as Internet of Medical Things (IoMT) [2]. IoMT is used in SHS for remote monitoring of patients and their 
environment, collectively. IoMT is useful for tracking medication, analysis of patient’s health data including medical 
images, remote consultations and in prescribing personalized medicine. There are variety of IoMT devices and sens

---

RQ3: What are the security challenges associated with the use of
WIoT for construction safety and health monitoring?
RQ4: What are the applicable data (privacy and security) regulations
for the use of WIoT for construction safety and health monitoring?
3.2. Identifying Relevant studies (Step 2)
First, a list of keywords related to the research questions was created
to aid the development of the database search rule. The keywords
included privacy, security, Wearable Internet of Things, construction
safety, construction health data, data privacy regulations, and wearable
sensing devices. Scopus and Web of Science were the main search da-
tabases used in this study to extract academic articles. These databases
are known to be comprehensive and index quality journals and confer-
ence publications ( Cai et al., 2019 ; Ma et al., 2023 ). Several studies have
relied on these databases as the primary source of literature selection
( Thapa and Camtepe, 2021 ; Wang and Waltman, 2016 ; Yang et al.,
2022 ). Google Scholar was used to track the references of articles
considered highly relevant to the study as well as the relevant privacy
regulations and technical reports. Given the emerging nature of the topic
under review, the authors decided to include relevant conference papers
that provide case studies on health data privacy regulations for different
regions as well as regulations from standard organizations to this study.
This inclusion provides additional relevant insight regarding the existing
data privacy and safety regulations and their impacts on the use of WIoT.
The following search rules were used to probe the databases of Scopus
and Web of Science. 1) “ construction ” AND “ health monitoring ” OR
“ safety monitoring ” AND “ Wearable Internet of Things ” OR “ wearable
sensing devices ” OR “ Internet of Things ” ; 2) “ privacy ” OR “ security ”
AND “ wearable Internet of Things ” OR “ wearable sensing devices ” ; 3)
“ privacy regulation ” OR “ security regulation ” AN","The application layer is the end-user of the cycle where the infor_x0002_mation obtained and processed is used for the intended purpose. This
layer promotes the development of an IoT system as it is the reason for
the development of the entire system (Farooq et al., 2015). In the con_x0002_struction industry, real-time information on construction workers and
the work environment could help safety officers and construction
workers make more informed proactive decisions to improve safety and
health performance. For instance, WIoT can monitor the vital signs and
locations of construction workers in real-time. This information can be
instantly relayed to safety officers, who can respond swiftly in the event
of an emergency or if a worker’s health is compromised. Such proactive
measures can save lives and prevent accidents. In some cases, this in_x0002_formation contains personal information that can be used to identify
individuals, thereby presenting the need to provide security measures to
protect such information.",,,,,,,
Describe the discussion provided in the article Security and Privacy in Edge Computing: A Survey of Electric Vehicles!,"Journal of Network and Computer Applications 237 (2025) 104130
8
N. Anjum et al.
Table 3
Comparison of existing studies and related survey articles.
Literature Security and Privacy Acquisition Storage Analytics FL Blockchain 6G
Gadekallu et al. (2021) ✔ ✔ ✔ ✔ ✔ ✗ ✗
Quy et al. (2024) ✗ ✗ ✗ ✗ ✔ ✔ ✔
Ghildiyal et al. (2023) ✗ ✗ ✗ ✔ ✔ ✔ ✔
Jiang et al. (2021) ✔ ✔ ✗ ✗ ✗ ✗ ✗
Jagatheesaperumal et al. (2021) ✔ ✔ ✔ ✔ ✔ ✗ ✗
Deepa et al. (2022) ✔ ✔ ✔ ✔ ✗ ✔ ✗
Huo et al. (2022) ✔ ✔ ✔ ✔ ✗ ✔ ✗
Kumar et al. (2022c) ✔ ✗ ✗ ✗ ✗ ✔ ✗
Pham et al. (2021) ✔ ✔ ✔ ✗ ✔ ✔ ✗
Nguyen et al. (2021) ✔ ✗ ✗ ✗ ✔ ✗ ✔
Bansal et al. (2020) ✗ ✔ ✔ ✔ ✗ ✗ ✗
Gupta et al. (2020) ✔ ✗ ✗ ✔ ✔ ✗ ✗
Our paper ✔ ✔ ✔ ✔ ✔ ✔ ✔
highlighted. Second, the potential advantages of FL’s contribution to
different IIoT systems, such as smart cities, smart medical, Unmanned
Aerial Vehicles (UAV), and intelligent transportation, are presented.
Further, the main reasons for integrating FL into IIoT are critically
analyzed. Lastly, the research challenges and future directions are
presented. However, this article lacks FL’s privacy and security aspects
while integrating with 6G-enabled IIoT.
In Ghildiyal et al. (2023), the authors present a spectacular survey
article which elaborates on the significance of 6G towards industry 4.0.
The importance of 6G towards Industry 4.0 advancement is highlighted
and analyzed to attain sustainability. Further, the enabling technologies
of 6G, such as IoT, big data, blockchain, AI, and digital twins, are
discussed to assist in carrying out industrial operations in an efficient
and scalable way. However, this study lacks the security aspect of
Industry 4.0, which comes with 6G and enabling technologies.
Another study Jiang et al. (2021) presents a detailed survey on
opportunities, motivations, applications, and challenges in differential
privacy in IIoT. Further, the authors explain the evaluation metrics to
analyze data privacy in the industrial sector. Moreover, they examine
the contradiction between

---

dology, Formal analysis, Data curation. Fawad: Writing – 
original draft, Visualization, Methodology, Formal analysis, Data curation. Aamir Nadeem: Writing – original draft, Methodology, 
Data curation. Muhammad Arif: Writing – original draft, Data curation. Muhammad Mehran Bashir: Writing – original draft, 
Data curation. Wooyeol Choi: Writing – review & editing, Validation, Supervision, Resources, Project administration, Investigation, 
Funding acquisition, Conceptualization.
Declaration of competing interest
The authors declare the following financial interests/personal relationships which may be considered as potential competing 
interests: This research was suported by the Chung-Ang University Research Grants in 2025.
Data availability
No data was used for the research described in the article.
References
[1] Y. Liu, C. Yang, L. Jiang, S. Xie, Y. Zhang, Intelligent edge computing for IoT-based energy management in smart cities, IEEE Netw. 33 (2) (2019) 
111–117.
[2] G.F. Huseien, K.W. Shah, A review on 5G technology for smart energy management and smart buildings in Singapore, Energy AI 7 (2022) 100116.
[3] S. Mumtaz, A. Alsohaily, Z. Pang, A. Rayes, K.F. Tsang, J. Rodriguez, Massive Internet of Things for industrial applications: Addressing wireless IIoT 
connectivity challenges and ecosystem fragmentation, IEEE Ind. Electron. Mag. 11 (1) (2017) 28–33.
[4] G. Enabler, Discover Key Trends & Insights on Disruptive Technologies & IoT Innovations, GrowthEnabler, Bengaluru, India, 2017.
[5] Industrial IoT (IIoT) Market Size & amp; Forecast to 2026, Market Study Rep., Selbyville, DE, USA, 2019.
[6] M. Stoyanova, Y. Nikoloudakis, S. Panagiotakis, E. Pallis, E.K. Markakis, A survey on the Internet of Things (IoT) forensics: Challenges, approaches, and 
open issues, IEEE Commun. Surv. Tutor. 22 (2) (2020) 1191–1221.
[7] D. Minoli, K. Sohraby, B. Occhiogrosso, IoT considerations, requirements, and architectures for smart buildings—Energy optimization and next-generation

---

thors, they declare that they have no known 
competing financial interests or personal relationships that could have 
appeared to influence the work reported in this paper.
Acknowledgments
The study of Milad Taleby Ahvanooey was supported partially by 
the Ulam Research Fellowship under Grant No. BPN/ULM/
2022/1/00069 funded by the NAWA-Polish National Agency for Aca-
demic Exchange in Poland and the NTU research fellowship in Singa-
pore. The work of Luca Caviglione was supported by the Project RAISE 
- Robotics and AI for Socio-economic Empowerment, funded by the 
European Union - NextGenerationEU under Grant No. ECS00000035. 
The work of K.-K. R. Choo was supported only by the Cloud Technology 
Endowed Professorship.
Data availability
No data was used for the research described in the article.
References
[1] Yirui Bai, Hong Lei, Suozai Li, Haoyu Gao, Jun Li, Leixiao Li, Decentralized 
and self-sovereign identity in the era of blockchain: a survey, in: 2022 IEEE 
International Conference on Blockchain (Blockchain), 2022, pp. 500–507.
[2] Longbing Cao, Decentralized ai: Edge intelligence and smart blockchain, 
metaverse, web3, and desci, IEEE Intell. Syst. 37 (3) (2022) 6–19.
[3] Aparna Kumari, Rajesh Gupta, Sudeep Tanwar, Amalgamation of blockchain 
and IoT for smart cities underlying 6g communication: A comprehensive review, 
Comput. Commun. 172 (2021) 102–118.
[4] Paul P. Momtaz, Some very simple economics of web3 and the metaverse, 
FinTech 1 (3) (2022) 225–234.
[5] Kelsie Nabben, Web3 as ‘self-infrastructuring’: The challenge is how, Big Data 
Soc. 10 (1) (2023) 20539517231159002.
[6] Internet of Everything (IoE), available at https://ioe.org/.
[7] Qingxuan Wang, Ding Wang, Understanding failures in security proofs of multi-
factor authentication for mobile devices, IEEE Trans. Inf. Forensics Secur. 18 
(2022) 597–612.
[8] Daniel Moghimi, Downfall: Exploiting speculative data gathering, in: 32nd 
USENIX Security Symposium (USENIX Security 23), 2023, pp. 7179–7

---

Table 1: Subjects of the papers.
Subject Paper Reference
BC
BC-RAN: Cloud radio access network enabled by blockchain for 5G [73]
Blockchain-enabled wireless communications: a new paradigm towards 6G [74]
Distributed Network Slicing Management Using Blockchains in E-Health Environments [75]
Design of a Security and Trust Framework for 5G Multi-domain Scenarios [76]
Data Broker: Dynamic Multi-Hop Routing Protocol in Blockchain Radio Access Network [77]
Future Industry Internet of Things with Zero-trust Security [78]
Blockchain Based Privacy Preserving Framework for Emerging 6G Wireless Communications [79]
Blockchain-based fog radio access networks: Architecture, key technologies, and challenges [80]
Evaluation of soft computing in intrusion detection for secure social Internet of Things based on collaborative edge
computing [81]
Resource Sharing and Trading of Blockchain Radio Access Networks: Architecture and Prototype Design [82]
Radio optical network security analysis with routing in quantum computing for 5G wireless communication using
blockchain machine learning model [83]
Hedera: A Permissionless and Scalable Hybrid Blockchain Consensus Algorithm in Multi-Access Edge Computing for IoT [84]
FH
Securing Ethernet-based optical fronthaul for 5G network [85]
Secure Open Fronthaul Interface for 5G Networks [86]
Transport Security Considerations for the Open-RAN Fronthaul [87]
Open-RAN Fronthaul Transport Security Architecture and Implementation [35]
IDS/IPS
Detecting DoS and DDoS Attacks by Using CuSum Algorithm in 5G Networks [88]
Attacks and failures prediction framework for a collaborative 5G mobile network [89]
The Novel System of Attacks Detection in 5G [90]
An edge based hybrid intrusion detection framework for mobile edge computing [91]
A highly secured IDS for IoT using EXPSO-STF A feature selection for LAANN to detect attacks [92]
RRC
Authentication Protocol for an IoT-Enabled LTE Network [93]
On the Impact of Rogue Base Stations in 4G/LTE Self Organizing Net","In this paper, we present a holistic overview of EC and highlight its
key characteristics such as location awareness, its distributed nature,
and support from large-scale IoT applications. We have discussed the
security risks and challenges associated with the core infrastructure, ac_x0002_cess networks, and data security and privacy in EC.
Looking ahead, EC faces several challenges. First, ensuring robust
security of the core infrastructure and access networks will be crucial
for protecting against potential cyberattacks and data breaches. Second,
as EC continues to grow in scale, it will be necessary to develop stan_x0002_dardized security protocols and mechanisms that can be applied univer_x0002_sally. Third, as the amount of sensitive data at edge servers increases,
the development of more effective privacy preservation techniques is
becoming essential for safeguarding users’ information. Additionally,
the tradeoff between security and performance metrics is expected to be
another critical challenge in EC.
Moreover, methods for quantifying and measuring privacy risks and
benefits in EC remain an ongoing area of study. Standardizing pri_x0002_vacy quantification methodologies will be vital for evaluating the effec_x0002_tiveness of privacy protection methods and ensuring compliance with
regulations. Finally, EC involves collaboration among multiple stake_x0002_holders, including device manufacturers, network operators, and service
providers. Coordinating security efforts among these diverse entities
and establishing effective governance mechanisms will be essential for
developing holistic and collaborative solutions for EC security.
Our study clarifies the importance of security and privacy in EC and
presents a review of existing approaches developed in the domains of
offloading, the IoV, and smart grids. The challenges identified in this
paper point to a need for continuous efforts in developing secure and
privacy-preserving solutions in the future.
",,,,,,,
Explain the concept of abused domain categorization as discussed in the scientific article Web of Shadows: Investigating Malware Abuse of Internet Services,"Contents lists available at ScienceDirect
Computers & Security
journal homepage: www.elsevier.com/locate/cose
Web of shadows: Investigating malware abuse of internet services
Mauro Allegretta a, Giuseppe Siracusano b, Roberto González b, Marco Gramaglia a,∗,
Juan Caballero c
a University Carlos III of Madrid, Avenida Universidad 30, Leganés, 28911, Madrid, Spain
b NEC Laboratories Europe, Kurfürsten-Anlage 36, Heidelberg, 69115, Baden-Württemberg, Germany
c IMDEA Software Institute, Campus Montegancedo s/n, Pozuelo de Alarcon, 28223, Madrid, Spain
A R T I C L E I N F O
Keywords:
CTI
Malware
A B S T R A C T
Internet Web and cloud services are routinely abused by malware, but the breadth of this abuse has not
been thoroughly investigated. In this work, we quantitatively investigate this abuse by leveraging data from
the Cyber Threat Alliance (CTA), where 36 security vendors share threat intelligence. We analyze CTA data
collected over 4 years from January 2020 until December 2023 comprising over one billion cyber-security
observations from where we extract 7.7M URLs and 1.8M domains related to malware. We complement this
dataset with an active measurement where we periodically attempt to download the content pointed out by
33,876 recently reported malicious URLs.
We investigate the following questions. How generalized is malware abuse of Internet services? How do
domains of abused Internet services differ? For what purpose are Internet services abused? and How long do
malicious resources remain active?
Among others, we uncover a broad abuse affecting 22K domains of Internet services, that Internet services
are largely abused for enabling malware distribution, and that malicious content in Internet services remains
active longer than on malicious domains.
1. Introduction
The Internet has woven itself into the fabric of modern society,
shaping the way we work, communicate, and entertain. A key role
for this transformation has been played by the advent of Web and
cloud s

---

19;
Alrawi et al., 2021; Huh et al., 2022; van Liebergen et al., 2023; Yao
et al., 2023). These works often report malware abusing a specific type
of Internet service such as cloud hosting services where attackers can
obtain cheap virtual machines (Nappa et al., 2013; Canali et al., 2013;
Wang et al., 2014; Liao et al., 2016), dynamic DNS providers offering
free subdomains (Lever et al., 2017), and social networks (Roy et al.,
2021). However, none of these works focused on investigating the scope
of the abuse of Internet services by malware. Most related to this goal
is recent research by Yao et al. (2023) that proposed a concolic engine
to run malware, identify the benign Web applications the malware
connects to, and classify the type of abuse by the malware. The authors
run 10K malware samples identifying the abuse of 29 Web applications.
Despite the value of their findings, malware likely abuses a much larger
number of benign services and it is not efficient to run malware samples
https://doi.org/10.1016/j.cose.2024.104182
Received 12 July 2024; Received in revised form 27 September 2024; Accepted 24 October 2024
Computers & Security 149 (2025) 104182 
Available online 4 November 2024 
0167-4048/© 2024 The Authors. Published by Elsevier Ltd. This is an open access article under the CC BY-NC license ( http://creativecommons.org/licenses/by- 
nc/4.0/ ).

---

M. Allegretta et al.
Fig. 2. Most reported abuse domains.
domain receives (e.g., Peng et al., 2019). Instead, for an abused service,
detections should happen in specific URLs or subdomains pointing to
the malicious uploaded content. However, if the domain queried to VT
corresponds to the eSLD of an Internet service, then it could have no
(or very low) detections, as the service itself is benign. Unfortunately,
we cannot query all 1.8M eSLDs in our malware-filtered dataset to
VT since this number is beyond our VT API query limit. To address
this issue, we first use the Tranco 1M domain popularity list (Pochat
et al., 2018) to identify 27,028 (1.6%) domains that have been reported
to the CTA, are related to a malware SDO, and belong to popular
Internet services.1 Since it is possible that some malicious domains
could have made it into the Tranco list, we then query these 27K
domains to VT and remove domains with at least four detections. We
use a threshold larger than zero to account for potential erroneous
detections by security tools, as recommended by prior work (Zhu et al.,
2020). This filtering step leaves 22,480 domains that form our abused
services dataset comprising popular domains that have received no or
very low detections, indicating that they are not malicious. Thus, we
classify as abused-services eSLDs that are popular (i.e., in the Tranco
top 1M list) and not reported as malicious (i.e., not flagged by at least
four security engines in VirusTotal).
Furthermore, it is important to note that abused services do not
necessarily need to be globally popular, i.e., may not appear in the
Tranco list. For example, it is possible that abused domains are locally
popular (i.e., popular in specific geographic regions) but not popular
enough across all regions to make it into the Tranco list (Ruth et al.,
2022a,b). It is also possible for attackers to abuse or compromise
little-known domains, e.g., new domains that still have not gained
popularity. Thus, our abused d

---

into the Tranco list (Ruth et al.,
2022a,b). It is also possible for attackers to abuse or compromise
little-known domains, e.g., new domains that still have not gained
popularity. Thus, our abused domains dataset does not contain all
abused domains reported to the CTA, but rather a subset of those. Thus,
as a quantitative answer to RQ1, we can say that there are at least 22K
benign Internet services abused by malware, which is a lower bound
on the total number of abused services in the CTA data.
3. Domain analysis
After having identified the abused services in the previous section,
we now analyze the differences between the 22K abused domains
and the entire set of malware-related domains reported to CTA in the
context of RQ2. Throughout this section, the terms domain and eSLD
will be used interchangeably and we will use FQDN to refer to domain
names inclusive of their respective subdomains.
3.1. Domain popularity
As a measure of the popularity of a domain within the CTA ex-
change, we compute the frequency with which a domain is reported.
For this, we count the number of Indicator objects that feature a URL
1 The Tranco list used is from March 22, 2023.
Table 2
Top 20 domains by number of reports.
eSLD Tranco rank Reports Creators Top20
baiming728.com ✗ 1,173,111 1 1.0
cloudfront.net 106 688,266 12 46.0
aliyuncs.com 353 682,207 11 23.0
lcirc.net ✗ 363,775 4 11.0
dealbigdata.com ✗ 224,613 6 6.0
glzip.com 562,118 203,169 7 12.0
discordapp.com 820 190,353 12 41.0
mediafire.com 291 171,953 12 33.0
kpzip.com 680,346 167,937 7 14.0
netai.net 121,129 164,772 6 14.0
blackievirus.com ✗ 155,790 4 9.0
yolox.net ✗ 144,360 5 7.0
tietuku.com 969,836 139,394 5 17.0
zhongguohao123.com ✗ 123,183 6 12.0
amazonaws.com 5 119,712 15 16.0
zol.com.cn 794 107,222 7 12.0
ddns.net 572 105,205 16 6.0
bejnz.com ✗ 89,652 4 5.0
ow5dirasuek.com ✗ 89,463 5 23.0
migsel.com ✗ 85,373 4 7.0
or FQDN corresponding to each eSLD. We call each such Indicator
object a report for the domain. We observe tha","In addition to the discussion in Section 3, we analyze what kind of
services are being abused adding context to RQ3. To classify domains,
we leverage the information available in the 22K VT reports. VT runs
user-submitted domains through various commercial providers that cat_x0002_egorize the domains into classes that roughly capture industrial sectors
(e.g., Information Technology, Education, Games). We observe 11 such
providers used by VT. For each provider, Fig. 6 shows the fraction
of domains for which the provider outputs at least one category. The
provider with the highest coverage is Forcepoint, which classifies 82%
of the 22K domains, followed by Xcitum (72%), and BitDefender (68%).
A provider may output multiple categories for the same domain. To
obtain a category for each domain, we favor the coverage criteria.
For each domain, we first assign the category from the provider with
the largest coverage (i.e., Forcepoint). If that provider does not return
a category for the domain, we move to the next provider in terms
of coverage, and so on until a category is found. Since categories
used by each provider may not map one-to-one, we manually build a
mapping to solve disagreements. Using this methodology, we are able
to categorize 95% of the 22K domains into 63 categories. For each of
these categories, Fig. 7 shows the probability density function of being
ranked in the specific range of the Tranco 1M list. Each domain is
weighted by the number of reports it receives. The most popular cate_x0002_gory is Information Technology (accounting for 21.0% of the domains),
followed by Business/Economy (16.1%), Education (6.4%), and Adult
(6.1%). As highlighted earlier, in general we observe the distribution is
skewed towards higher ranks for most categories, showing how attacks
generally target highly popular domains. Exceptions are categories with
significant geographical components such as News and Media, Business
and Economy, Cultural Institutions, and Real Estate, all of which show
a more spread behavior. Table 5 shows the top 5 reported domains for
the top 10 categories by total number of domains in the category. The
table captures the diverse range of popularity of abused domains, e.g., 6
domains in the Tranco top 1K and 7 domains with a rank larger than
500,000.
",,,,,,,
